Pathway,Count
"1,4-alpha-oligoglucan phosphorylase activity (GO:0004645)",5
1-acylglycerol-3-phosphate O-acyltransferase activity (GO:0003841),13
1-acylglycerophosphocholine O-acyltransferase activity (GO:0047184),6
1-alkyl-2-acetylglycerophosphocholine esterase activity (GO:0003847),7
1-phosphatidylinositol binding (GO:0005545),15
1-phosphatidylinositol-3-kinase activity (GO:0016303),10
1-phosphatidylinositol-3-kinase regulator activity (GO:0046935),16
1-phosphatidylinositol-4-phosphate 3-kinase activity (GO:0035005),7
1-phosphatidylinositol-4-phosphate 5-kinase activity (GO:0016308),6
11-cis retinal binding (GO:0005502),6
"2 iron, 2 sulfur cluster binding (GO:0051537)",12
2-oxoglutarate-dependent dioxygenase activity (GO:0016706),33
"3',5'-cyclic-AMP phosphodiesterase activity (GO:0004115)",12
"3',5'-cyclic-GMP phosphodiesterase activity (GO:0047555)",7
"3',5'-cyclic-nucleotide phosphodiesterase activity (GO:0004114)",21
3'-5' DNA helicase activity (GO:0043138),16
3'-5' exonuclease activity (GO:0008408),48
3'-5'-exodeoxyribonuclease activity (GO:0008296),11
3'-5'-exoribonuclease activity (GO:0000175),34
3-chloroallyl aldehyde dehydrogenase activity (GO:0004028),5
3-hydroxyacyl-CoA dehydrogenase activity (GO:0003857),7
"4 iron, 4 sulfur cluster binding (GO:0051539)",14
4-galactosyl-N-acetylglucosaminide 3-alpha-L-fucosyltransferase activity (GO:0017083),6
5'-3' DNA helicase activity (GO:0043139),7
5'-3' exodeoxyribonuclease activity (GO:0035312),8
5'-3' exonuclease activity (GO:0008409),14
5'-3' RNA polymerase activity (GO:0034062),29
5'-deoxyribose-5-phosphate lyase activity (GO:0051575),5
5'-flap endonuclease activity (GO:0017108),8
5'-nucleotidase activity (GO:0008253),14
5S rRNA binding (GO:0008097),9
7S RNA binding (GO:0008312),5
7SK snRNA binding (GO:0097322),8
[heparan sulfate]-glucosamine 3-sulfotransferase 1 activity (GO:0008467),7
ABC-type glutathione S-conjugate transporter activity (GO:0015431),7
ABC-type xenobiotic transporter activity (GO:0008559),11
acetyl-CoA C-acyltransferase activity (GO:0003988),6
acetylation-dependent protein binding (GO:0140033),21
acetylcholine receptor activity (GO:0015464),22
acetylcholine receptor binding (GO:0033130),8
acetylcholine-gated cation-selective channel activity (GO:0022848),11
acetylgalactosaminyltransferase activity (GO:0008376),27
acetylglucosaminyltransferase activity (GO:0008375),48
acetyltransferase activity (GO:0016407),32
acid phosphatase activity (GO:0003993),6
acid-amino acid ligase activity (GO:0016881),7
acid-thiol ligase activity (GO:0016878),13
acidic amino acid transmembrane transporter activity (GO:0015172),15
acrosin binding (GO:0032190),5
actin binding (GO:0003779),177
actin monomer binding (GO:0003785),25
actinin binding (GO:0042805),21
active ion transmembrane transporter activity (GO:0022853),42
"activin receptor activity, type I (GO:0016361)",5
activin receptor binding (GO:0070697),10
activin-activated receptor activity (GO:0017002),9
acyl carnitine transmembrane transporter activity (GO:0015227),5
acyl-CoA dehydrogenase activity (GO:0003995),9
acyl-CoA hydrolase activity (GO:0047617),18
acyl-CoA oxidase activity (GO:0003997),7
acylglycerol lipase activity (GO:0047372),13
acylglycerol O-acyltransferase activity (GO:0016411),20
"acyltransferase activity, transferring groups other than amino-acyl groups (GO:0016747)",76
adenine nucleotide transmembrane transporter activity (GO:0000295),12
adenosine deaminase activity (GO:0004000),10
adenyl nucleotide binding (GO:0030554),11
adenyl ribonucleotide binding (GO:0032559),306
adenyl-nucleotide exchange factor activity (GO:0000774),11
adenylate cyclase binding (GO:0008179),10
adenylate cyclase inhibiting G protein-coupled glutamate receptor activity (GO:0001640),9
adenylate kinase activity (GO:0004017),8
adenylyltransferase activity (GO:0070566),22
ADP binding (GO:0043531),27
ADP transmembrane transporter activity (GO:0015217),7
ADP-ribose diphosphatase activity (GO:0047631),5
adrenergic receptor binding (GO:0031690),17
alanine transmembrane transporter activity (GO:0022858),12
alcohol dehydrogenase (NAD+) activity (GO:0004022),9
alcohol dehydrogenase (NADP+) activity (GO:0008106),17
alcohol dehydrogenase [NAD(P)+] activity (GO:0018455),7
"alcohol dehydrogenase activity, zinc-dependent (GO:0004024)",7
aldehyde dehydrogenase (NAD+) activity (GO:0004029),13
aldehyde dehydrogenase [NAD(P)+] activity (GO:0004030),15
aldehyde-lyase activity (GO:0016832),8
alditol:NADP+ 1-oxidoreductase activity (GO:0004032),11
aldo-keto reductase (NADP) activity (GO:0004033),10
alkali metal ion binding (GO:0031420),13
alkaline phosphatase activity (GO:0004035),6
alkane 1-monooxygenase activity (GO:0018685),5
all-trans retinal binding (GO:0005503),5
alpha-(1->3)-fucosyltransferase activity (GO:0046920),8
"alpha-1,4-glucosidase activity (GO:0004558)",5
alpha-2A adrenergic receptor binding (GO:0031694),5
alpha-actinin binding (GO:0051393),24
alpha-adrenergic receptor activity (GO:0004936),6
alpha-amylase activity (GO:0004556),5
alpha-glucosidase activity (GO:0090599),6
alpha-mannosidase activity (GO:0004559),7
"alpha-N-acetylgalactosaminide alpha-2,6-sialyltransferase activity (GO:0001665)",6
"alpha-N-acetylneuraminate alpha-2,8-sialyltransferase activity (GO:0003828)",6
alpha-tubulin binding (GO:0043014),31
amidine-lyase activity (GO:0016842),6
amino acid binding (GO:0016597),32
amino acid transmembrane transporter activity (GO:0015171),49
amino acid:sodium symporter activity (GO:0005283),11
aminoacyl-tRNA editing activity (GO:0002161),5
aminoacyl-tRNA ligase activity (GO:0004812),38
aminopeptidase activity (GO:0004177),27
aminophospholipid flippase activity (GO:0015247),7
ammonia-lyase activity (GO:0016841),5
ammonium transmembrane transporter activity (GO:0008519),10
AMP binding (GO:0016208),11
amylase activity (GO:0016160),5
amyloid-beta binding (GO:0001540),80
androgen receptor binding (GO:0050681),27
androsterone dehydrogenase activity (GO:0047023),8
anion channel activity (GO:0005253),68
anion transmembrane transporter activity (GO:0008509),17
anion:anion antiporter activity (GO:0015301),19
anion:sodium symporter activity (GO:0015373),5
ankyrin binding (GO:0030506),19
ankyrin repeat binding (GO:0071532),5
annealing activity (GO:0097617),5
antiporter activity (GO:0015297),20
apolipoprotein A-I binding (GO:0034186),5
apolipoprotein receptor binding (GO:0034190),6
arachidonate-CoA ligase activity (GO:0047676),6
arachidonic acid binding (GO:0050544),6
arachidonic acid epoxygenase activity (GO:0008392),16
arachidonic acid monooxygenase activity (GO:0008391),19
arginine binding (GO:0034618),8
arginine N-methyltransferase activity (GO:0016273),8
arginine transmembrane transporter activity (GO:0015181),8
armadillo repeat domain binding (GO:0070016),9
aromatic amino acid transmembrane transporter activity (GO:0015173),9
aryl hydrocarbon receptor binding (GO:0017162),8
aryl sulfotransferase activity (GO:0004062),9
arylesterase activity (GO:0004064),6
arylsulfatase activity (GO:0004065),14
"aspartic endopeptidase activity, intramembrane cleaving (GO:0042500)",6
aspartic-type endopeptidase activity (GO:0004190),15
aspartic-type endopeptidase inhibitor activity (GO:0019828),7
aspartic-type peptidase activity (GO:0070001),12
ATP binding (GO:0005524),278
ATP hydrolysis activity (GO:0140603),45
ATP transmembrane transporter activity (GO:0005347),10
ATP-activated inward rectifier potassium channel activity (GO:0015272),6
ATP-gated ion channel activity (GO:0035381),8
ATPase activator activity (GO:0001671),20
"ATPase activity, coupled to transmembrane movement of ions, rotational mechanism (GO:0044769)",16
ATPase binding (GO:0051117),73
ATPase inhibitor activity (GO:0042030),5
ATPase regulator activity (GO:0060590),38
basal RNA polymerase II transcription machinery binding (GO:0001099),33
basic amino acid transmembrane transporter activity (GO:0015174),13
benzodiazepine receptor activity (GO:0008503),10
benzodiazepine receptor binding (GO:0030156),5
"beta-1,3-galactosyltransferase activity (GO:0048531)",7
beta-2 adrenergic receptor binding (GO:0031698),5
beta-galactosidase activity (GO:0004565),5
beta-glucosidase activity (GO:0008422),6
beta-tubulin binding (GO:0048487),32
BH domain binding (GO:0051400),6
BH3 domain binding (GO:0051434),6
bHLH transcription factor binding (GO:0043425),22
bicarbonate transmembrane transporter activity (GO:0015106),15
bile acid binding (GO:0032052),9
bile acid:sodium symporter activity (GO:0008508),6
bioactive lipid receptor activity (GO:0045125),9
bis(5'-adenosyl)-hexaphosphatase activity (GO:0034431),5
bis(5'-adenosyl)-pentaphosphatase activity (GO:0034432),5
bitter taste receptor activity (GO:0033038),25
BMP binding (GO:0036122),12
BMP receptor activity (GO:0098821),6
BMP receptor binding (GO:0070700),13
branched-chain amino acid transmembrane transporter activity (GO:0015658),7
bubble DNA binding (GO:0000405),8
C-acetyltransferase activity (GO:0016453),5
C-acyltransferase activity (GO:0016408),11
C-C chemokine binding (GO:0019957),24
C-C chemokine receptor activity (GO:0016493),23
C-palmitoyltransferase activity (GO:0016454),5
C-X-C chemokine binding (GO:0019958),5
C-X-C chemokine receptor activity (GO:0016494),5
C-X3-C chemokine binding (GO:0019960),5
C2H2 zinc finger domain binding (GO:0070742),12
C3HC4-type RING finger domain binding (GO:0055131),6
C4-dicarboxylate transmembrane transporter activity (GO:0015556),16
cadherin binding (GO:0045296),322
cadherin binding involved in cell-cell adhesion (GO:0098641),18
cadmium ion binding (GO:0046870),5
calcitonin family receptor activity (GO:0097642),5
calcium activated cation channel activity (GO:0005227),19
calcium channel activity (GO:0005262),84
calcium channel inhibitor activity (GO:0019855),11
calcium channel regulator activity (GO:0005246),37
calcium ion binding (GO:0005509),348
calcium ion transmembrane transporter activity (GO:0015085),55
"calcium, potassium:sodium antiporter activity (GO:0008273)",5
calcium-activated potassium channel activity (GO:0015269),12
calcium-dependent cysteine-type endopeptidase activity (GO:0004198),15
calcium-dependent phospholipase A2 activity (GO:0047498),16
calcium-dependent phospholipid binding (GO:0005544),50
calcium-dependent protein kinase activity (GO:0010857),8
calcium-dependent protein serine/threonine kinase activity (GO:0009931),8
calcium-dependent protein serine/threonine phosphatase activity (GO:0004723),7
calcium-independent phospholipase A2 activity (GO:0047499),8
calcium-release channel activity (GO:0015278),17
calcium:cation antiporter activity (GO:0015368),6
calcium:sodium antiporter activity (GO:0005432),10
calmodulin-dependent protein kinase activity (GO:0004683),24
calmodulin-dependent protein phosphatase activity (GO:0033192),5
cAMP binding (GO:0030552),12
cAMP response element binding (GO:0035497),10
cAMP response element binding protein binding (GO:0008140),9
cAMP-dependent protein kinase activity (GO:0004691),5
cAMP-dependent protein kinase inhibitor activity (GO:0004862),8
cAMP-dependent protein kinase regulator activity (GO:0008603),10
carbohydrate kinase activity (GO:0019200),11
carbohydrate:cation symporter activity (GO:0005402),12
carbohydrate:proton symporter activity (GO:0005351),7
"carbon-nitrogen ligase activity, with glutamine as amido-N-donor (GO:0016884)",8
carbonate dehydratase activity (GO:0004089),11
carbonyl reductase (NADPH) activity (GO:0004090),5
carboxy-lyase activity (GO:0016831),23
carboxylic acid binding (GO:0031406),41
carboxylic acid transmembrane transporter activity (GO:0046943),57
carboxylic ester hydrolase activity (GO:0052689),96
carboxypeptidase activity (GO:0004180),38
CARD domain binding (GO:0050700),16
cardiolipin binding (GO:1901612),10
carnitine O-acyltransferase activity (GO:0016406),6
caspase binding (GO:0089720),12
"catalytic activity, acting on a tRNA (GO:0140101)",35
cation channel activity (GO:0005261),98
cation transmembrane transporter activity (GO:0008324),48
cation:cation antiporter activity (GO:0015491),6
cation:chloride symporter activity (GO:0015377),10
CCR chemokine receptor binding (GO:0048020),42
CCR1 chemokine receptor binding (GO:0031726),5
CCR3 chemokine receptor binding (GO:0031728),5
CCR5 chemokine receptor binding (GO:0031730),5
CCR6 chemokine receptor binding (GO:0031731),7
CD4 receptor binding (GO:0042609),8
CDP-alcohol phosphatidyltransferase activity (GO:0017169),7
cell adhesion mediator activity (GO:0098631),24
cell adhesive protein binding involved in bundle of His cell-Purkinje myocyte communication (GO:0086083),5
cell-cell adhesion mediator activity (GO:0098632),42
cell-matrix adhesion mediator activity (GO:0098634),7
ceramide 1-phosphate binding (GO:1902387),7
ceramide 1-phosphate transfer activity (GO:1902388),7
ceramide transfer activity (GO:0120017),8
cGMP binding (GO:0030553),11
channel activity (GO:0015267),46
chemoattractant activity (GO:0042056),32
chemokine activity (GO:0008009),46
chemokine binding (GO:0019956),32
chemokine receptor activity (GO:0004950),26
chemokine receptor binding (GO:0042379),50
chemorepellent activity (GO:0045499),25
chitinase activity (GO:0004568),6
chloride channel activity (GO:0005254),64
chloride channel inhibitor activity (GO:0019869),10
chloride channel regulator activity (GO:0017081),15
chloride ion binding (GO:0031404),11
chloride transmembrane transporter activity (GO:0015108),16
cholesterol binding (GO:0015485),50
cholesterol transfer activity (GO:0120020),18
choline transmembrane transporter activity (GO:0015220),5
chondroitin sulfotransferase activity (GO:0034481),5
chromatin insulator sequence binding (GO:0043035),5
chromo shadow domain binding (GO:0070087),6
ciliary neurotrophic factor receptor activity (GO:0004897),8
ciliary neurotrophic factor receptor binding (GO:0005127),9
cis-regulatory region sequence-specific DNA binding (GO:0000987),1149
clathrin adaptor activity (GO:0035615),15
clathrin heavy chain binding (GO:0032050),9
clathrin light chain binding (GO:0032051),7
co-SMAD binding (GO:0070410),10
CoA carboxylase activity (GO:0016421),6
CoA hydrolase activity (GO:0016289),16
CoA-ligase activity (GO:0016405),14
cobalamin binding (GO:0031419),6
collagen binding involved in cell-matrix adhesion (GO:0098639),5
collagen receptor activity (GO:0038064),6
complement component C3b binding (GO:0001851),5
complement receptor activity (GO:0004875),11
copper ion binding (GO:0005507),45
core promoter sequence-specific DNA binding (GO:0001046),37
coreceptor activity involved in Wnt signaling pathway (GO:0071936),8
"coreceptor activity involved in Wnt signaling pathway, planar cell polarity pathway (GO:1904929)",6
creatine kinase activity (GO:0004111),5
crossover junction endodeoxyribonuclease activity (GO:0008821),6
cuprous ion binding (GO:1903136),8
CXCR chemokine receptor binding (GO:0045236),17
CXCR3 chemokine receptor binding (GO:0048248),5
cyclic nucleotide binding (GO:0030551),23
cyclic nucleotide-dependent protein kinase activity (GO:0004690),6
cyclic-nucleotide phosphodiesterase activity (GO:0004112),23
cyclin-dependent protein kinase activity (GO:0097472),23
cyclin-dependent protein serine/threonine kinase activator activity (GO:0061575),8
cyclin-dependent protein serine/threonine kinase activity (GO:0004693),23
cyclin-dependent protein serine/threonine kinase inhibitor activity (GO:0004861),10
cyclin-dependent protein serine/threonine kinase regulator activity (GO:0016538),44
cysteine-type endopeptidase activator activity involved in apoptotic process (GO:0008656),15
cysteine-type endopeptidase activity (GO:0004197),105
cysteine-type endopeptidase activity involved in apoptotic process (GO:0097153),15
cysteine-type endopeptidase activity involved in apoptotic signaling pathway (GO:0097199),10
cysteine-type endopeptidase activity involved in execution phase of apoptosis (GO:0097200),13
cysteine-type endopeptidase inhibitor activity (GO:0004869),40
cysteine-type endopeptidase inhibitor activity involved in apoptotic process (GO:0043027),21
cysteine-type peptidase activity (GO:0008234),98
cytidine deaminase activity (GO:0004126),12
cytidylyltransferase activity (GO:0070567),9
cytochrome-c oxidase activity (GO:0004129),15
cytokine activity (GO:0005125),173
cytokine receptor activity (GO:0004896),88
cytokine receptor binding (GO:0005126),105
cytoskeleton-nuclear membrane anchor activity (GO:0140444),5
D-loop DNA binding (GO:0062037),5
damaged DNA binding (GO:0003684),44
DEAD/H-box RNA helicase binding (GO:0017151),7
death domain binding (GO:0070513),11
death receptor activity (GO:0005035),12
death receptor binding (GO:0005123),15
dehydroascorbic acid transmembrane transporter activity (GO:0033300),6
delayed rectifier potassium channel activity (GO:0005251),33
deoxycytidine deaminase activity (GO:0047844),8
deoxyribonuclease activity (GO:0004536),14
deoxyribonuclease I activity (GO:0004530),5
deubiquitinase activity (GO:0101005),112
diacylglycerol kinase activity (GO:0004143),11
dicarboxylic acid transmembrane transporter activity (GO:0005310),29
dihydropyrimidinase activity (GO:0004157),6
dipeptidase activity (GO:0016805),9
dipeptidyl-peptidase activity (GO:0008239),11
diphosphoinositol-polyphosphate diphosphatase activity (GO:0008486),5
diphosphotransferase activity (GO:0016778),6
disordered domain specific binding (GO:0097718),23
disulfide oxidoreductase activity (GO:0015036),8
DNA binding (GO:0003677),811
"DNA binding, bending (GO:0008301)",16
DNA insertion or deletion binding (GO:0032135),5
DNA N-glycosylase activity (GO:0019104),8
DNA polymerase activity (GO:0034061),22
DNA polymerase binding (GO:0070182),18
DNA replication origin binding (GO:0003688),23
DNA secondary structure binding (GO:0000217),33
DNA-(apurinic or apyrimidinic site) endonuclease activity (GO:0003906),11
"DNA-binding transcription activator activity, RNA polymerase II-specific (GO:0001228)",333
DNA-binding transcription factor binding (GO:0140297),208
"DNA-binding transcription repressor activity, RNA polymerase II-specific (GO:0001227)",256
DNA-directed 5'-3' RNA polymerase activity (GO:0003899),29
DNA-directed DNA polymerase activity (GO:0003887),21
DNA-methyltransferase activity (GO:0009008),6
dolichyl-diphosphooligosaccharide-protein glycotransferase activity (GO:0004579),5
dopamine neurotransmitter receptor activity (GO:0004952),5
dopamine receptor binding (GO:0050780),6
double-stranded DNA binding (GO:0003690),651
double-stranded methylated DNA binding (GO:0010385),6
double-stranded RNA adenosine deaminase activity (GO:0003726),5
double-stranded RNA binding (GO:0003725),73
double-stranded telomeric DNA binding (GO:0003691),9
dynactin binding (GO:0034452),12
E-box binding (GO:0070888),41
endodeoxyribonuclease activity (GO:0004520),20
"endodeoxyribonuclease activity, producing 3'-phosphomonoesters (GO:0016889)",9
"endodeoxyribonuclease activity, producing 5'-phosphomonoesters (GO:0016888)",14
endogenous lipid antigen binding (GO:0030883),5
endonuclease activity (GO:0004519),51
endopeptidase activator activity (GO:0061133),10
endopeptidase activity (GO:0004175),315
endopeptidase inhibitor activity (GO:0004866),115
endopeptidase regulator activity (GO:0061135),46
endopolyphosphatase activity (GO:0000298),5
endoribonuclease activity (GO:0004521),34
"endoribonuclease activity, producing 3'-phosphomonoesters (GO:0016892)",5
"endoribonuclease activity, producing 5'-phosphomonoesters (GO:0016891)",28
enoyl-CoA hydratase activity (GO:0004300),10
ephrin receptor activity (GO:0005003),17
ephrin receptor binding (GO:0046875),21
epidermal growth factor receptor binding (GO:0005154),26
epinephrine binding (GO:0051379),6
epoxide hydrolase activity (GO:0004301),5
ER retention sequence binding (GO:0046923),5
ErbB-3 class receptor binding (GO:0043125),5
estradiol 17-beta-dehydrogenase activity (GO:0004303),8
estrogen 16-alpha-hydroxylase activity (GO:0101020),8
estrogen 2-hydroxylase activity (GO:0101021),5
estrogen receptor binding (GO:0030331),35
ether hydrolase activity (GO:0016803),8
eukaryotic initiation factor 4E binding (GO:0008190),10
excitatory extracellular ligand-gated ion channel activity (GO:0005231),21
"exodeoxyribonuclease activity, producing 5'-phosphomonoesters (GO:0016895)",12
exogenous lipid antigen binding (GO:0030884),5
exonuclease activity (GO:0004527),49
exopeptidase activity (GO:0008238),53
exopolyphosphatase activity (GO:0004309),5
exoribonuclease activity (GO:0004532),13
"exoribonuclease activity, producing 5'-phosphomonoesters (GO:0016896)",33
extracellular ligand-gated ion channel activity (GO:0005230),11
extracellularly ATP-gated cation channel activity (GO:0004931),7
FAD binding (GO:0071949),25
fatty acid elongase activity (GO:0009922),7
fatty acid synthase activity (GO:0004312),10
fatty-acyl-CoA synthase activity (GO:0004321),7
FATZ binding (GO:0051373),5
ferric iron binding (GO:0008199),7
ferrous iron binding (GO:0008198),24
ferroxidase activity (GO:0004322),7
fibroblast growth factor binding (GO:0017134),21
fibroblast growth factor receptor binding (GO:0005104),23
fibroblast growth factor-activated receptor activity (GO:0005007),5
filamin binding (GO:0031005),11
flap endonuclease activity (GO:0048256),9
flavin adenine dinucleotide binding (GO:0050660),55
FMN binding (GO:0010181),11
folic acid transmembrane transporter activity (GO:0008517),5
four-way junction DNA binding (GO:0000400),17
four-way junction helicase activity (GO:0009378),6
frizzled binding (GO:0005109),34
fructokinase activity (GO:0008865),5
fructose binding (GO:0070061),6
fructose transmembrane transporter activity (GO:0005353),5
"fructose-2,6-bisphosphate 2-phosphatase activity (GO:0004331)",5
fucose binding (GO:0042806),5
fucosyltransferase activity (GO:0008417),12
G protein-coupled acetylcholine receptor activity (GO:0016907),7
G protein-coupled amine receptor activity (GO:0008227),39
G protein-coupled chemoattractant receptor activity (GO:0001637),17
G protein-coupled glutamate receptor activity (GO:0098988),9
G protein-coupled glutamate receptor binding (GO:0035256),8
G protein-coupled neurotransmitter receptor activity (GO:0099528),7
G protein-coupled opioid receptor activity (GO:0004985),6
G protein-coupled peptide receptor activity (GO:0008528),82
G protein-coupled photoreceptor activity (GO:0008020),15
G protein-coupled purinergic nucleotide receptor activity (GO:0045028),10
G protein-coupled receptor activity (GO:0004930),283
G protein-coupled receptor binding (GO:0001664),143
G protein-coupled serotonin receptor activity (GO:0004993),33
G protein-coupled serotonin receptor binding (GO:0031821),6
G-quadruplex DNA binding (GO:0051880),10
G-quadruplex RNA binding (GO:0002151),6
G-rich strand telomeric DNA binding (GO:0098505),10
GABA receptor activity (GO:0016917),22
GABA receptor binding (GO:0050811),11
GABA-A receptor activity (GO:0004890),19
GABA-gated chloride ion channel activity (GO:0022851),13
galactosidase activity (GO:0015925),7
galactosyltransferase activity (GO:0008378),11
gamma-aminobutyric acid transmembrane transporter activity (GO:0015185),7
gamma-tubulin binding (GO:0043015),23
ganglioside binding (GO:0035594),5
gap junction channel activity (GO:0005243),24
gap junction channel activity involved in cardiac conduction electrical coupling (GO:0086075),5
gap junction channel activity involved in cell communication by electrical coupling (GO:1903763),6
gap junction hemi-channel activity (GO:0055077),6
gated channel activity (GO:0022836),14
GDP binding (GO:0019003),67
GDP-dissociation inhibitor activity (GO:0005092),13
general transcription initiation factor binding (GO:0140296),26
glial cell-derived neurotrophic factor receptor activity (GO:0016167),5
glucocorticoid receptor binding (GO:0035259),9
glucokinase activity (GO:0004340),5
glucose transmembrane transporter activity (GO:0005355),21
glucose:sodium symporter activity (GO:0005412),7
glucosidase activity (GO:0015926),8
glucosyltransferase activity (GO:0046527),9
glucuronosyl-N-acetylgalactosaminyl-proteoglycan 4-beta-N-acetylgalactosaminyltransferase activity (GO:0047238),6
glucuronosyltransferase activity (GO:0015020),31
glutamate receptor activity (GO:0008066),19
glutamate receptor binding (GO:0035254),17
glutamate-gated calcium ion channel activity (GO:0022849),5
glutathione transferase activity (GO:0004364),27
glutathione transmembrane transporter activity (GO:0034634),5
glycerol channel activity (GO:0015254),5
glycerol transmembrane transporter activity (GO:0015168),7
glycerophospholipid flippase activity (GO:0140333),12
glycine binding (GO:0016594),11
glycine transmembrane transporter activity (GO:0015187),8
glycogen binding (GO:2001069),8
GPI anchor binding (GO:0034235),7
GPI-linked ephrin receptor activity (GO:0005004),5
growth factor activity (GO:0008083),87
growth factor receptor binding (GO:0070851),105
growth hormone receptor binding (GO:0005131),9
GTP binding (GO:0005525),189
GTPase activator activity (GO:0005096),336
GTPase activity (GO:0003924),216
GTPase binding (GO:0051020),201
GTPase inhibitor activity (GO:0005095),13
GTPase regulator activity (GO:0030695),233
guanosine-diphosphatase activity (GO:0004382),9
guanyl ribonucleotide binding (GO:0032561),214
guanyl-nucleotide exchange factor activity (GO:0005085),149
guanylate cyclase activator activity (GO:0030250),5
guanylate kinase activity (GO:0004385),9
H3 histone acetyltransferase activity (GO:0010484),9
H4 histone acetyltransferase activity (GO:0010485),10
heme binding (GO:0020037),91
hemoglobin alpha binding (GO:0031721),5
heparan sulfate sulfotransferase activity (GO:0034483),15
hexokinase activity (GO:0004396),5
hexosaminidase activity (GO:0015929),12
hexose transmembrane transporter activity (GO:0015149),15
hexosyltransferase activity (GO:0016758),119
high voltage-gated calcium channel activity (GO:0008331),10
high-density lipoprotein particle binding (GO:0008035),6
histone acetyltransferase activity (GO:0004402),31
histone acetyltransferase activity (H3-K23 specific) (GO:0043994),5
histone acetyltransferase binding (GO:0035035),21
