Pathway,Count
protein tyrosine/threonine phosphatase activity (GO:0008330),10
protein-arginine deiminase activity (GO:0004668),5
protein-arginine N-methyltransferase activity (GO:0016274),11
protein-arginine omega-N monomethyltransferase activity (GO:0035241),5
protein-cysteine S-palmitoyltransferase activity (GO:0019706),25
protein-glutamine gamma-glutamyltransferase activity (GO:0003810),9
protein-lysine N-methyltransferase activity (GO:0016279),35
proton channel activity (GO:0015252),6
proton transmembrane transporter activity (GO:0015078),40
"proton-transporting ATPase activity, rotational mechanism (GO:0046961)",16
pseudouridine synthase activity (GO:0009982),13
purine nucleobase transmembrane transporter activity (GO:0005345),6
purine nucleotide transmembrane transporter activity (GO:0015216),5
purine ribonucleoside triphosphate binding (GO:0035639),460
purine ribonucleotide transmembrane transporter activity (GO:0005346),11
purinergic nucleotide receptor activity (GO:0001614),15
pyridoxal phosphate binding (GO:0030170),21
pyrimidine nucleoside transmembrane transporter activity (GO:0015214),7
pyrimidine nucleotide-sugar transmembrane transporter activity (GO:0015165),8
pyrophosphatase activity (GO:0016462),54
pyrophosphate hydrolysis-driven proton transmembrane transporter activity (GO:0009678),23
pyruvate dehydrogenase (acetyl-transferring) kinase activity (GO:0004740),5
pyruvate transmembrane transporter activity (GO:0050833),5
quaternary ammonium group transmembrane transporter activity (GO:0015651),11
R-SMAD binding (GO:0070412),19
"racemase and epimerase activity, acting on carbohydrates and derivatives (GO:0016857)",11
RAGE receptor binding (GO:0050786),9
rDNA binding (GO:0000182),5
receptor antagonist activity (GO:0048019),28
receptor ligand activity (GO:0048018),307
receptor tyrosine kinase binding (GO:0030971),56
regulatory RNA binding (GO:0061980),40
retinal binding (GO:0016918),9
retinal dehydrogenase activity (GO:0001758),8
retinoic acid 4-hydroxylase activity (GO:0008401),9
retinoic acid binding (GO:0001972),22
retinoic acid receptor binding (GO:0042974),18
retinoid binding (GO:0005501),34
retinoid X receptor binding (GO:0046965),11
retinol binding (GO:0019841),7
riboflavin transmembrane transporter activity (GO:0032217),5
ribonuclease activity (GO:0004540),66
ribonuclease P activity (GO:0004526),11
ribonuclease P RNA binding (GO:0033204),10
ribose phosphate diphosphokinase activity (GO:0004749),5
ribosomal large subunit binding (GO:0043023),12
ribosomal protein S6 kinase activity (GO:0004711),7
ribosomal small subunit binding (GO:0043024),17
ribosome binding (GO:0043022),48
RNA 2'-O-methyltransferase activity (GO:0062105),5
RNA 7-methylguanosine cap binding (GO:0000340),13
RNA adenylyltransferase activity (GO:1990817),6
RNA binding (GO:0003723),1406
RNA cap binding (GO:0000339),19
RNA methyltransferase activity (GO:0008173),19
RNA polymerase binding (GO:0070063),18
RNA polymerase core enzyme binding (GO:0043175),33
RNA polymerase I core promoter sequence-specific DNA binding (GO:0001164),8
RNA polymerase I transcription regulatory region sequence-specific DNA binding (GO:0001163),8
RNA polymerase II C-terminal domain binding (GO:0099122),8
RNA polymerase II C-terminal domain phosphoserine binding (GO:1990269),5
RNA polymerase II cis-regulatory region sequence-specific DNA binding (GO:0000978),1149
RNA polymerase II complex binding (GO:0000993),32
RNA polymerase II core promoter sequence-specific DNA binding (GO:0000979),14
RNA polymerase II CTD heptapeptide repeat kinase activity (GO:0008353),12
RNA polymerase II CTD heptapeptide repeat phosphatase activity (GO:0008420),7
RNA polymerase II general transcription initiation factor binding (GO:0001091),5
RNA polymerase II transcription regulatory region sequence-specific DNA binding (GO:0000977),1359
RNA polymerase II-specific DNA-binding transcription factor binding (GO:0061629),190
RNA polymerase III cis-regulatory region sequence-specific DNA binding (GO:0000992),6
RNA polymerase III type 3 promoter sequence-specific DNA binding (GO:0001006),6
RNA stem-loop binding (GO:0035613),12
RNA strand annealing activity (GO:0033592),5
RNA-directed DNA polymerase activity (GO:0003964),6
RNA-DNA hybrid ribonuclease activity (GO:0004523),5
Roundabout binding (GO:0048495),8
rRNA (adenine) methyltransferase activity (GO:0016433),7
rRNA binding (GO:0019843),42
rRNA methyltransferase activity (GO:0008649),7
S-adenosylmethionine-dependent methyltransferase activity (GO:0008757),43
S-methyltransferase activity (GO:0008172),7
secondary active transmembrane transporter activity (GO:0015291),56
semaphorin receptor activity (GO:0017154),11
semaphorin receptor binding (GO:0030215),23
sequence-specific DNA binding (GO:0043565),707
sequence-specific double-stranded DNA binding (GO:1990837),712
sequence-specific mRNA binding (GO:1990825),10
sequence-specific single stranded DNA binding (GO:0098847),5
serine C-palmitoyltransferase activity (GO:0004758),5
serine transmembrane transporter activity (GO:0022889),8
serine-type endopeptidase activity (GO:0004252),105
serine-type endopeptidase inhibitor activity (GO:0004867),60
serine-type exopeptidase activity (GO:0070008),7
serine-type peptidase activity (GO:0008236),125
serotonin receptor activity (GO:0099589),33
serotonin-gated cation-selective channel activity (GO:0022850),5
SH2 domain binding (GO:0042169),32
SH3 domain binding (GO:0017124),62
sialic acid transmembrane transporter activity (GO:0015136),5
sialyltransferase activity (GO:0008373),21
signal recognition particle binding (GO:0005047),7
signal sequence binding (GO:0005048),42
signaling receptor complex adaptor activity (GO:0030159),39
single-stranded DNA 3'-5' exodeoxyribonuclease activity (GO:0008310),5
single-stranded DNA binding (GO:0003697),97
single-stranded DNA endodeoxyribonuclease activity (GO:0000014),9
single-stranded DNA exodeoxyribonuclease activity (GO:0008297),9
single-stranded DNA helicase activity (GO:0017116),19
single-stranded RNA binding (GO:0003727),45
single-stranded telomeric DNA binding (GO:0043047),12
siRNA binding (GO:0035197),8
small GTPase binding (GO:0031267),175
small protein activating enzyme binding (GO:0044388),5
small ribosomal subunit rRNA binding (GO:0070181),9
snoRNA binding (GO:0030515),30
snRNA binding (GO:0017069),43
sodium channel activity (GO:0005272),38
sodium channel inhibitor activity (GO:0019871),8
sodium channel regulator activity (GO:0017080),37
sodium ion binding (GO:0031402),6
sodium ion transmembrane transporter activity (GO:0015081),28
sodium-independent organic anion transmembrane transporter activity (GO:0015347),15
sodium:bicarbonate symporter activity (GO:0008510),6
sodium:chloride symporter activity (GO:0015378),9
sodium:phosphate symporter activity (GO:0005436),11
sodium:proton antiporter activity (GO:0015385),12
solute:anion antiporter activity (GO:0140323),15
solute:bicarbonate symporter activity (GO:0140410),6
solute:cation antiporter activity (GO:0015298),8
solute:cation symporter activity (GO:0015294),6
solute:proton antiporter activity (GO:0015299),5
solute:proton symporter activity (GO:0015295),16
solute:sodium symporter activity (GO:0015370),30
sphingomyelin phosphodiesterase activity (GO:0004767),5
sphingosine N-acyltransferase activity (GO:0050291),7
sphingosine-1-phosphate phosphatase activity (GO:0042392),7
sphingosine-1-phosphate receptor activity (GO:0038036),5
STAT family protein binding (GO:0097677),6
"steroid dehydrogenase activity, acting on the CH-OH group of donors, NAD or NADP as acceptor (GO:0033764)",21
steroid hydroxylase activity (GO:0008395),36
sterol binding (GO:0032934),60
sterol transfer activity (GO:0120015),19
store-operated calcium channel activity (GO:0015279),10
structural constituent of tooth enamel (GO:0030345),5
succinate transmembrane transporter activity (GO:0015141),7
sugar-phosphatase activity (GO:0050308),7
sulfate transmembrane transporter activity (GO:0015116),14
sulfatide binding (GO:0120146),6
sulfotransferase activity (GO:0008146),40
sulfur amino acid transmembrane transporter activity (GO:0000099),6
sulfuric ester hydrolase activity (GO:0008484),17
sulfurtransferase activity (GO:0016783),8
SUMO binding (GO:0032183),13
SUMO ligase activity (GO:0061665),10
SUMO transferase activity (GO:0019789),19
SUMO-specific protease activity (GO:0016929),7
supercoiled DNA binding (GO:0097100),6
superoxide-generating NAD(P)H oxidase activity (GO:0016175),11
superoxide-generating NADPH oxidase activator activity (GO:0016176),8
symporter activity (GO:0015293),10
syndecan binding (GO:0045545),5
syntaxin binding (GO:0019905),62
syntaxin-1 binding (GO:0017075),22
TAP1 binding (GO:0046978),5
taste receptor activity (GO:0008527),31
Tat protein binding (GO:0030957),10
tau protein binding (GO:0048156),40
tau-protein kinase activity (GO:0050321),20
TBP-class protein binding (GO:0017025),22
telethonin binding (GO:0031433),7
telomerase activity (GO:0003720),6
telomerase RNA binding (GO:0070034),22
telomeric DNA binding (GO:0042162),33
testosterone dehydrogenase [NAD(P)] activity (GO:0030283),5
thioesterase binding (GO:0031996),11
thiol oxidase activity (GO:0016972),6
thiol-dependent deubiquitinase (GO:0004843),106
thiolester hydrolase activity (GO:0016790),5
threonine-type peptidase activity (GO:0070003),7
thyroid hormone receptor binding (GO:0046966),28
thyroid hormone transmembrane transporter activity (GO:0015349),6
titin binding (GO:0031432),13
Toll-like receptor binding (GO:0035325),11
TPR domain binding (GO:0030911),5
trace-amine receptor activity (GO:0001594),6
transaminase activity (GO:0008483),11
transcription cis-regulatory region binding (GO:0000976),549
transcription coactivator binding (GO:0001223),20
transcription coregulator binding (GO:0001221),53
transcription corepressor binding (GO:0001222),29
transcription regulatory region nucleic acid binding (GO:0001067),212
transferrin receptor binding (GO:1990459),11
transforming growth factor beta binding (GO:0050431),24
"transforming growth factor beta receptor activity, type I (GO:0005025)",5
transforming growth factor beta receptor binding (GO:0005160),18
transforming growth factor beta-activated receptor activity (GO:0005024),12
transition metal ion binding (GO:0046914),445
transition metal ion transmembrane transporter activity (GO:0046915),30
translation elongation factor activity (GO:0003746),14
translation initiation factor activity (GO:0003743),41
transmembrane receptor protein kinase activity (GO:0019199),60
transmembrane receptor protein phosphatase activity (GO:0019198),16
transmembrane receptor protein serine/threonine kinase activity (GO:0004675),18
transmembrane receptor protein serine/threonine kinase binding (GO:0070696),16
transmembrane receptor protein tyrosine kinase activator activity (GO:0030297),7
transmembrane receptor protein tyrosine kinase activity (GO:0004714),60
transmembrane receptor protein tyrosine kinase adaptor activity (GO:0005068),12
transmembrane receptor protein tyrosine phosphatase activity (GO:0005001),16
transmembrane-ephrin receptor activity (GO:0005005),17
transmitter-gated ion channel activity (GO:0022824),34
transmitter-gated ion channel activity involved in regulation of postsynaptic membrane potential (GO:1904315),30
triglyceride lipase activity (GO:0004806),23
tripeptide transmembrane transporter activity (GO:0042937),6
tRNA (cytosine) methyltransferase activity (GO:0016427),9
tRNA (guanine) methyltransferase activity (GO:0016423),13
tRNA binding (GO:0000049),49
tRNA methyltransferase activity (GO:0008175),16
tRNA-specific adenosine deaminase activity (GO:0008251),8
tRNA-specific ribonuclease activity (GO:0004549),14
tropomyosin binding (GO:0005523),16
troponin I binding (GO:0031013),5
tubulin binding (GO:0015631),307
tubulin-glutamic acid ligase activity (GO:0070740),8
tumor necrosis factor binding (GO:0043120),5
tumor necrosis factor receptor binding (GO:0005164),12
tumor necrosis factor receptor superfamily binding (GO:0032813),28
tumor necrosis factor-activated receptor activity (GO:0005031),9
type 1 fibroblast growth factor receptor binding (GO:0005105),5
type 2 fibroblast growth factor receptor binding (GO:0005111),5
type I transforming growth factor beta receptor binding (GO:0034713),9
type II transforming growth factor beta receptor binding (GO:0005114),8
U1 snRNA binding (GO:0030619),8
U2 snRNA binding (GO:0030620),5
U3 snoRNA binding (GO:0034511),9
U4 snRNA binding (GO:0030621),6
U6 snRNA binding (GO:0017070),14
ubiquinol-cytochrome-c reductase activity (GO:0008121),6
ubiquitin binding (GO:0043130),74
ubiquitin conjugating enzyme activity (GO:0061631),35
ubiquitin conjugating enzyme binding (GO:0031624),29
ubiquitin ligase inhibitor activity (GO:1990948),8
ubiquitin protein ligase activity (GO:0061630),263
ubiquitin protein ligase binding (GO:0031625),265
ubiquitin-dependent protein binding (GO:0140036),11
ubiquitin-like protein conjugating enzyme activity (GO:0061650),38
ubiquitin-like protein conjugating enzyme binding (GO:0044390),35
ubiquitin-like protein ligase activity (GO:0061659),270
ubiquitin-like protein ligase binding (GO:0044389),282
ubiquitin-like protein-specific protease activity (GO:0019783),20
ubiquitin-protein transferase activator activity (GO:0097027),7
ubiquitin-protein transferase activity (GO:0004842),392
ubiquitin-protein transferase inhibitor activity (GO:0055105),9
ubiquitin-specific protease binding (GO:1990381),21
ubiquitin-ubiquitin ligase activity (GO:0034450),11
ubiquitination-like modification-dependent protein binding (GO:0140035),10
UDP-galactosyltransferase activity (GO:0035250),11
UDP-glucosyltransferase activity (GO:0035251),10
UDP-glycosyltransferase activity (GO:0008194),84
UDP-N-acetylglucosamine transmembrane transporter activity (GO:0005462),5
UDP-xylosyltransferase activity (GO:0035252),7
unmethylated CpG binding (GO:0045322),8
urate transmembrane transporter activity (GO:0015143),5
urea transmembrane transporter activity (GO:0015204),6
uridine transmembrane transporter activity (GO:0015213),5
uridine-diphosphatase activity (GO:0045134),9
uridylyltransferase activity (GO:0070569),6
vascular endothelial growth factor receptor 2 binding (GO:0043184),8
vascular endothelial growth factor receptor binding (GO:0005172),12
vascular endothelial growth factor-activated receptor activity (GO:0005021),7
vasopressin receptor activity (GO:0005000),6
vinculin binding (GO:0017166),11
vitamin D receptor binding (GO:0042809),14
voltage-gated anion channel activity (GO:0008308),16
voltage-gated calcium channel activity (GO:0005245),37
voltage-gated calcium channel activity involved in cardiac muscle cell action potential (GO:0086007),5
voltage-gated cation channel activity (GO:0022843),97
voltage-gated channel activity (GO:0022832),7
voltage-gated chloride channel activity (GO:0005247),10
voltage-gated ion channel activity (GO:0005244),16
voltage-gated potassium channel activity (GO:0005249),82
voltage-gated potassium channel activity involved in cardiac muscle cell action potential repolarization (GO:0086008),15
voltage-gated potassium channel activity involved in ventricular cardiac muscle cell action potential repolarization (GO:1902282),12
voltage-gated sodium channel activity (GO:0005248),22
voltage-gated sodium channel activity involved in cardiac muscle cell action potential (GO:0086006),5
volume-sensitive anion channel activity (GO:0005225),9
water channel activity (GO:0015250),13
water transmembrane transporter activity (GO:0005372),15
wide pore channel activity (GO:0022829),25
Wnt-activated receptor activity (GO:0042813),15
WW domain binding (GO:0050699),30
xylosyltransferase activity (GO:0042285),8
Y-form DNA binding (GO:0000403),5
zinc ion binding (GO:0008270),336
zinc ion transmembrane transporter activity (GO:0005385),20
