Pathway,Count
Rao Rajesh C (University Of Michigan),30
Rao Rajini (Johns Hopkins University),32
Rao Uma (University Of California-Irvine),91
Rao Xiaoquan (Case Western Reserve University),33
Raper Jonathan A (University Of Pennsylvania),14
Raphael Yehoash (University Of Michigan),62
Rapoport Tom A (Harvard Medical School),28
Rappaport Jay (Temple Univ Of The Commonwealth),54
Rapraeger Alan C (University Of Wisconsin-Madison),33
Rasband Matthew N (Baylor College Of Medicine),49
Rasenick Mark M (University Of Illinois At Chicago),13
Rasgon Natalie L (Stanford University),7
Rasin Mladen-Roko (Rbhs-Robert Wood Johnson Medical School),24
Rasineni Karuna (University Of Nebraska Medical Center),11
Raskind Wendy H (University Of Washington),67
Rasmussen Steven A (Brown University),18
Rastogi Deepa (Albert Einstein College Of Medicine),32
Rastogi Suchita (Stanford University),9
Ratain Mark J (University Of Chicago),106
Ratajczak Mariusz Z (University Of Louisville),158
Rathinam Vijay (University Of Connecticut Sch Of Med/Dnt),46
Rathmell Jeffrey C (Vanderbilt University),81
Ratner Lee (Washington University),70
Rattan Satish (Thomas Jefferson University),42
Rau Rachel E (Baylor College Of Medicine),6
Raucci Frank J (Vanderbilt University),10
Raufman Jean-Pierre (University Of Maryland Baltimore),46
Ravel Jacques (University Of Maryland Baltimore),26
Ravichandran Kodi S (University Of Virginia),82
Ravid Katya (Boston University Medical Campus),77
Ravits John (University Of California San Diego),41
Rawls John F (Duke University),18
Rawls Scott M (Temple Univ Of The Commonwealth),24
Ray Anuradha (University Of Pittsburgh At Pittsburgh),78
Ray Krishanu (University Of Maryland Baltimore),25
Ray Prabir (University Of Pittsburgh At Pittsburgh),76
Ray Ranjit (Saint Louis University),89
Ray Ratna B (Saint Louis University),107
Ray Russell S (Baylor College Of Medicine),15
Ray Thomas (Duke University),26
Ray Wayne A (Vanderbilt University),9
Ray Wilson Z (Washington University),17
Raybould Helen E (University Of California At Davis),28
Raychaudhuri Pradip (University Of Illinois At Chicago),87
Raz Eyal (University Of California San Diego),55
Razani Babak (Washington University),143
Rea Shane L (University Of Texas Hsc San Antonio),11
Read Laurie K (State University Of New York At Buffalo),9
Read Renee D (Emory University),13
Read Timothy D (Emory University),13
Ready Joseph M (Ut Southwestern Medical Center),23
Rebane Aleksander (Yale University),9
Rebay Ilaria (University Of Chicago),13
Rebeck G William (Georgetown University),48
Reboussin Beth A (Wake Forest University Health Sciences),10
Reboussin David M (Wake Forest University Health Sciences),28
Recchia Fabio A (Temple Univ Of The Commonwealth),39
Recht Lawrence D (Stanford University),24
Reck-Peterson Samara L (University Of California San Diego),9
Reckelhoff Jane F (University Of Mississippi Med Ctr),21
Reddy Doodipala Samba (Texas A&M University Health Science Ctr),9
Reddy Krishna (Weill Medical Coll Of Cornell Univ),58
Reddy P Hemachandra (Texas Tech University Health Scis Center),50
Reddy Pavan (University Of Michigan),79
Reddy Raju C (University Of Pittsburgh At Pittsburgh),39
Reddy Ravinder (University Of Pennsylvania),24
Reddy Sekhar P (University Of Illinois At Chicago),101
Reddy Sita (University Of Southern California),54
Reddy Srinivasa (University Of California Los Angeles),113
Reddy Sushma (Stanford University),54
Reddy Timothy E (Duke University),26
Redell Michele S (Baylor College Of Medicine),13
Redfield Margaret M (Mayo Clinic Rochester),51
Redmond Eileen M (University Of Rochester),47
Redmond Stephanie (University Of California),8
Redner Robert L (University Of Pittsburgh At Pittsburgh),15
Redondo Maria Jose (Baylor College Of Medicine),5
Reece E Albert (University Of Maryland Baltimore),67
Reed Ann M (Duke University),75
Reed Elaine F (University Of California Los Angeles),79
Reed Guy L (University Of Arizona),20
Reed May J (University Of Washington),22
Reed Randall R (Johns Hopkins University),37
Reed Sharon L (University Of California San Diego),10
Reeder Scott B (University Of Wisconsin-Madison),17
Reeds Dominic N (Washington University),22
Reenan Robert A (Brown University),9
Reeves Gloria M (University Of Maryland Baltimore),5
Reeves Roger H (Johns Hopkins University),56
Reeves Thomas M (Virginia Commonwealth University),12
Reeves Westley H (University Of Florida),92
Reeves William Brian (University Of Texas Hsc San Antonio),5
Reeves-Daniel Amber (Wake Forest University Health Sciences),12
Refetoff Samuel (University Of Chicago),80
Regan Raymond F (Thomas Jefferson University),25
Regehr Wade G (Harvard Medical School),21
Regensteiner Judith G (University Of Colorado Denver),56
Regner Kevin R (Medical College Of Wisconsin),21
Regnier Michael (University Of Washington),28
Reh Thomas A (University Of Washington),85
Rehkopf David H (Stanford University),9
Reich Nancy C (State University New York Stony Brook),40
Reichenberg Abraham (Icahn School Of Medicine At Mount Sinai),37
Reijmers Leon (Tufts University Boston),6
Reilly Muredach P (Columbia University Health Sciences),406
Reimann Keith A (Univ Of Massachusetts Med Sch Worcester),16
Reinberg Danny (New York University School Of Medicine),147
Reiner David John (Texas A&M University Health Science Ctr),82
Reiner Steven L (Columbia University Health Sciences),66
Reines Daniel (Emory University),9
Reinholt Brad (Icahn School Of Medicine At Mount Sinai),14
Reinisch Karin M (Yale University),28
Reis Steven E (University Of Pittsburgh At Pittsburgh),31
Reis Tania (University Of Colorado Denver),10
Reisdorph Nichole A (University Of Colorado Denver),7
Reiser Jochen (Rush University Medical Center),99
Reiss Allan L (Stanford University),27
Reiss Krzysztof (Lsu Health Sciences Center New Orleans),73
Reiter Jeremy F (University Of California),96
Reiter Katherine (University Of Washington),15
Reiter Lawrence T (University Of Tennessee Health Sci Ctr),17
Reiter Nicholas J (Vanderbilt University),5
Reiter Robert E (University Of California Los Angeles),43
Reizis Boris (New York University School Of Medicine),106
Relman David A (Stanford University),39
Remick Daniel G (Boston University Medical Campus),51
Ren Hongxia (Indiana Univ-Purdue Univ At Indianapolis),18
Ren Lei (Duke University),73
Ren Tianying (Oregon Health & Science University),10
Renbarger Jamie L (Indiana Univ-Purdue Univ At Indianapolis),11
Rendl Michael (Icahn School Of Medicine At Mount Sinai),43
Reneker Lixing W (University Of Missouri-Columbia),31
Renfrow Matthew B (University Of Alabama At Birmingham),26
Rengarajan Jyothi (Emory University),26
Repine John E (University Of Colorado Denver),10
Resar Linda M S (Johns Hopkins University),17
Resnick James L (University Of Florida),16
Resnick Neil M (University Of Pittsburgh At Pittsburgh),5
Ressom Habtom W (Georgetown University),29
Resta Thomas C (University Of New Mexico Health Scis Ctr),31
Restrepo Diego (University Of Colorado Denver),26
Reti Irving M (Johns Hopkins University),5
Rettig Michael (Washington University),24
Reuben David B (University Of California Los Angeles),9
Revzin Alexander (Mayo Clinic Rochester),38
Rewers Marian J (University Of Colorado Denver),40
Reya Tannishtha (University Of California San Diego),45
Reyes Nancy J (Duke University),12
Reyes Teresa M (University Of Cincinnati),19
Reyes-Gordillo Karina (George Washington University),31
Reynolds Brent (University Of Florida),60
Reynolds Charles F (University Of Pittsburgh At Pittsburgh),34
Reynolds Harmony R (New York University School Of Medicine),7
Reynolds Lindsay M (Wake Forest University Health Sciences),32
Reynolds Matthew R (University Of Wisconsin-Madison),36
Reynoso Eduardo (Ut Southwestern Medical Center),6
Rezaee Fariba (Cleveland Clinic Lerner Com-Cwru),13
Rezvan Amir (Emory University),19
Rhee Christopher J (Baylor College Of Medicine),5
Rhee Douglas J (Case Western Reserve University),26
Rhee Rennie (University Of Pennsylvania),5
Rhoads Jon Marc (University Of Texas Hlth Sci Ctr Houston),12
Rhodes Christopher J (University Of Chicago),121
Riazuddin Saima (University Of Maryland Baltimore),107
Ribas Antoni (University Of California Los Angeles),138
Ribera Angeles (University Of Colorado Denver),12
Ricci Anthony J (Stanford University),23
Ricciardi Adele (Yale University),10
Rice Andrew P (Baylor College Of Medicine),56
Rice Carol (University Of Cincinnati),6
Rice John P (Washington University),145
Rice Margaret E (New York University School Of Medicine),12
Rice Peter A (Univ Of Massachusetts Med Sch Worcester),19
Rice Phoebe A (University Of Chicago),9
Rice Todd W (Vanderbilt University),19
Rice Treva K (Washington University),108
Rich Mark M (Wright State University),27
Rich Matthew T (University Of Pittsburgh At Pittsburgh),12
Rich Thomas C (University Of South Alabama),13
Richards Alexsia L (Northwestern University At Chicago),7
Richards Joanne S (Baylor College Of Medicine),173
Richardson Anthony R (University Of Pittsburgh At Pittsburgh),5
Richardson Arlan G (University Of Oklahoma Hlth Sciences Ctr),11
Richardson Bruce C (University Of Michigan),54
Richardson Lynne D (Icahn School Of Medicine At Mount Sinai),6
Richer-Mouchantat Jennifer (University Of Colorado Denver),138
Richerson George B (University Of Iowa),10
Richey Joyce M (University Of Southern California),5
Richie Ellen R (University Of Tx Md Anderson Can Ctr),26
Richman Douglas D (University Of California San Diego),51
Richmond Ann (Vanderbilt University),125
Richter Holly E (University Of Alabama At Birmingham),23
Richter Joel D (Univ Of Massachusetts Med Sch Worcester),52
Richter Kimber P (University Of Kansas Medical Center),7
Ricke William A (University Of Wisconsin-Madison),30
Rickels Michael R (University Of Pennsylvania),30
Ricker Edd C (Weill Medical Coll Of Cornell Univ),5
Rickman David S (Weill Medical Coll Of Cornell Univ),86
Riddle Mark A (Johns Hopkins University),33
Riddle Ryan C (Johns Hopkins University),31
Riddler Sharon (University Of Pittsburgh At Pittsburgh),29
Ridge Karen M (Northwestern University At Chicago),37
Rieder Florian (Cleveland Clinic Lerner Com-Cwru),44
Rieg Timo (University Of South Florida),40
Riegel Anna Tate (Georgetown University),9
Riehle Kimberly J (University Of Washington),40
Rietsch Arne (Case Western Reserve University),12
Rifkin Robert (Icahn School Of Medicine At Mount Sinai),16
Rifkind Arleen B (Weill Medical Coll Of Cornell Univ),10
Rigas Basil (State University New York Stony Brook),54
Rigoutsos Isidore (Thomas Jefferson University),80
Riley Brien P (Virginia Commonwealth University),73
Riley Elise D (University Of California),8
Riley James L (University Of Pennsylvania),89
Rimer Mendell (Texas A&M University Health Science Ctr),13
Rinaudo Paolo (University Of California),20
Rincon Mercedes (University Of Vermont & St Agric College),79
Rincon-Limas Diego E (University Of Florida),13
Rinehart Jesse (Yale University),43
Ringel Matthew D (Ohio State University),85
Ringkamp Matthias (Johns Hopkins University),9
Ringman John M (University Of Southern California),83
Ringstad Niels (New York University School Of Medicine),6
Rios Eduardo (Rush University Medical Center),15
Rios Maribel (Tufts University Boston),15
Rios-Pilier Jennifer (University Of Louisville),6
Ripplinger Crystal May (University Of California At Davis),16
Risacher Shannon L (Indiana Univ-Purdue Univ At Indianapolis),89
Risbrough Victoria B (University Of California San Diego),28
Risbud Makarand V (Thomas Jefferson University),110
Risques Rosa Ana (University Of Washington),13
Rissman Robert A (University Of California San Diego),52
Ritter Joseph K (Virginia Commonwealth University),40
Ritzel Rodney (University Of Maryland Baltimore),14
Rivara Frederick P (University Of Washington),14
Rivera Amariliz (Rbhs-New Jersey Medical School),20
Rivera-Nieves Jesus (University Of California San Diego),38
Rivera-Perez Jaime A (Univ Of Massachusetts Med Sch Worcester),23
Rivers Angela (University Of Illinois At Chicago),9
Rizi Rahim R (University Of Pennsylvania),5
Rizorey Jose (Ut Southwestern Medical Center),104
Rizvi Naiyer A (Columbia University Health Sciences),30
Rizzo Mark A (University Of Maryland Baltimore),17
Rizzo William B (University Of Nebraska Medical Center),8
Ro Seungil (University Of Nevada Reno),28
Roach Peter J (Indiana Univ-Purdue Univ At Indianapolis),117
Roalf David R (University Of Pennsylvania),6
Roan Nadia R (University Of California),13
Roback John D (Emory University),22
Robakis Nikolaos K (Icahn School Of Medicine At Mount Sinai),39
Robbins David J (University Of Miami School Of Medicine),53
Robek Michael (Albany Medical College),23
Robert Jacques (University Of Rochester),87
Roberts Brandon M (University Of Alabama At Birmingham),9
Roberts Cynthia J (Ohio State University),8
Roberts David W (Dartmouth College),26
Roberts Rosalinda C (University Of Alabama At Birmingham),34
Robertson Danielle M (Ut Southwestern Medical Center),11
Robertson David Herlie (Vanderbilt University),145
Robertson Erle S (University Of Pennsylvania),122
Robertson Gail A (University Of Wisconsin-Madison),14
Robertson Keith D (Mayo Clinic Rochester),76
Robichaux Michael (Baylor College Of Medicine),9
Robinson Douglas N (Johns Hopkins University),27
Robinson Fred L (Oregon Health & Science University),14
Robinson Jason D (University Of Tx Md Anderson Can Ctr),13
Robinson June K (Northwestern University At Chicago),7
Robinson Keven (University Of Pittsburgh At Pittsburgh),11
Robinson Richard (Medical College Of Wisconsin),86
Robinson William H (Stanford University),113
Robinson-Cohen Cassianne (Vanderbilt University),43
Robishaw Janet D (Florida Atlantic University),16
Robison Patrick (University Of Pennsylvania),9
Robling Alexander G (Indiana Univ-Purdue Univ At Indianapolis),51
Roby Katherine F (University Of Kansas Medical Center),74
Rocca Walter A (Mayo Clinic Rochester),32
Rocic Petra (New York Medical College),50
Rock Kenneth L (Univ Of Massachusetts Med Sch Worcester),43
Rockey Don C (Medical University Of South Carolina),72
Rockman Howard A (Duke University),64
Rodeheffer Matthew S (Yale University),21
Roden Dan M (Vanderbilt University),219
Rodgers Karla K (University Of Oklahoma Hlth Sciences Ctr),24
Rodney George G (Baylor College Of Medicine),29
Rodriguez Ana (New York University School Of Medicine),183
Rodriguez Annabelle (University Of Connecticut Sch Of Med/Dnt),30
Rodriguez Bravo Veronica (Icahn School Of Medicine At Mount Sinai),28
Rodriguez Carolyn I (Stanford University),8
Rodriguez Henry (University Of South Florida),57
Rodriguez Karl A (University Of Texas Hsc San Antonio),8
Rodriguez-Boulan Enrique J (Weill Medical Coll Of Cornell Univ),8
Rodriguez-Diaz Rayner (University Of Miami School Of Medicine),6
Rodriguez-Porcel Martin (Mayo Clinic Rochester),17
Roe Catherine M (Washington University),22
Roepe Paul D (Georgetown University),5
Roeske John (Loyola University Chicago),8
Rogaev Evgeny I (Univ Of Massachusetts Med Sch Worcester),29
Rogawski Michael A (University Of California At Davis),44
Rogers Angela J (Stanford University),13
Rogers Jeffrey A (Baylor College Of Medicine),61
Rogers Melissa B (Rbhs-New Jersey Medical School),11
Rogers Sally J (University Of California At Davis),7
Roghair Robert D (University Of Iowa),7
Rohacs Tibor (Rbhs-New Jersey Medical School),33
Rohan Thomas E (Albert Einstein College Of Medicine),30
Rohatgi Rajat (Stanford University),60
Rohde Kyle H (University Of Central Florida),7
Roitbak Tamara (University Of New Mexico Health Scis Ctr),22
Rojas Camilo (Johns Hopkins University),27
Rojas Mauricio (University Of Pittsburgh At Pittsburgh),153
Roller Richard J (University Of Iowa),7
Roman Kenny (Northwestern University At Chicago),8
Roman Richard J (University Of Mississippi Med Ctr),73
Romanoski Casey E (University Of Arizona),29
Romerio Fabio (University Of Maryland Baltimore),24
Romero Damian G (University Of Mississippi Med Ctr),59
Romero Michael F (Mayo Clinic Rochester),52
Ron Dorit (University Of California),36
Rondina Matthew Thomas (University Of Utah),12
Ronis Martin J J (Lsu Health Sciences Center New Orleans),96
Roop Dennis (University Of Colorado Denver),102
Roopra Avtar S (University Of Wisconsin-Madison),19
Roose Jeroen (University Of California),46
Roper Stephen D (University Of Miami School Of Medicine),33
Rosa Maria Jose (Icahn School Of Medicine At Mount Sinai),21
Roscoe Joseph A (University Of Rochester),6
Rose Jed E (Duke University),16
Rose Lesilee (University Of California At Davis),8
Rose Sherri (Harvard Medical School),11
Rose-Nussbaumer Jennifer (University Of California),5
Roselli Charles E (Oregon Health & Science University),14
Rosen Antony (Johns Hopkins University),77
Rosen Barry P (Florida International University),28
Rosen Howard J (University Of California),142
Rosen Marc I (Yale University),6
Rosen Michael K (Ut Southwestern Medical Center),59
Rosenbaum Daniel (Ut Southwestern Medical Center),41
Rosenbaum James T (Oregon Health & Science University),115
Rosenbaum Michael (Columbia University Health Sciences),31
Rosenberg Ari (University Of Wisconsin-Madison),6
Rosenberg David R (Wayne State University),17
Rosenberg Oren S (University Of California),6
Rosenberg Susan M (Baylor College Of Medicine),12
Rosenblatt Mark I (University Of Illinois At Chicago),21
Rosene Douglas L (Boston University Medical Campus),22
Rosenfeld Michael E (University Of Washington),52
Rosenfeld Michael G (University Of California San Diego),231
Rosengart Todd K (Baylor College Of Medicine),19
Rosenquist Thomas A (State University New York Stony Brook),18
Rosenspire Allen J (Wayne State University),17
Rosenthal Eben L (Stanford University),35
Rosenthal Philip (University Of California),66
Rosi Susanna (University Of California),26
Rosko Ashley E (Ohio State University),6
Rosloniec Edward F (University Of Tennessee Health Sci Ctr),15
Rosner Marsha R (University Of Chicago),16
Ross Brian D (University Of Michigan),54
Ross Callum F (University Of Chicago),5
Ross Christopher A (Johns Hopkins University),100
Ross Elliott M (Ut Southwestern Medical Center),24
Ross Jonathan (Albert Einstein College Of Medicine),17
Ross Margaret Elizabeth (Weill Medical Coll Of Cornell Univ),7
Ross Michael J (Albert Einstein College Of Medicine),33
Ross Susan R (University Of Illinois At Chicago),30
Ross Theodora S (Ut Southwestern Medical Center),27
Rostami Am (Thomas Jefferson University),15
Roth Bryan L (Univ Of North Carolina Chapel Hill),88
Roth David L (Johns Hopkins University),8
Roth Michael D (University Of California Los Angeles),37
Roth Monica J (Rbhs-Robert Wood Johnson Medical School),12
Roth Steven (University Of Illinois At Chicago),14
Rothenberg Eli (New York University School Of Medicine),48
Rothenburg Stefan (University Of California At Davis),13
Rothenfluh Adrian (University Of Utah),11
Rotheram-Borus Mary Jane (University Of California Los Angeles),11
Rothlin Carla (Yale University),35
Rothman James (Yale University),43
Rothman Russell L (Vanderbilt University),7
Rothstein David M (University Of Pittsburgh At Pittsburgh),36
Rothstein Jeffrey D (Johns Hopkins University),96
Rousseau Bernard (Vanderbilt University),23
Rousseau Denis L (Albert Einstein College Of Medicine),5
Roussos Panagiotis (Icahn School Of Medicine At Mount Sinai),11
Routh Jonathan C (Duke University),12
Routh Vanessa H (Rbhs-New Jersey Medical School),15
Roux Benoit (University Of Chicago),36
Rovin Brad H (Ohio State University),72
Rovner Barry W (Thomas Jefferson University),15
Rowe Peter S (University Of Kansas Medical Center),24
Rowicka-Kudlicka Malgorzata (University Of Texas Med Br Galveston),277
Rowitch David H (University Of California),133
Rowland Laura M (University Of Maryland Baltimore),9
Rowlett James K (University Of Mississippi Med Ctr),18
Rowton Megan (University Of Chicago),11
Roy Craig R (Yale University),54
Roy Jason A (University Of Pennsylvania),6
Roy Monika (University Of California),8
Roy Sabita (University Of Miami School Of Medicine),75
Roy Subhojit (University Of Wisconsin-Madison),18
Roy Sushmita (University Of Wisconsin-Madison),24
Roy-O'Reilly Meaghan A (University Of Texas Hlth Sci Ctr Houston),13
Royal Walter (University Of Maryland Baltimore),31
Roychoudhury Shrabasti (University Of Nebraska Medical Center),15
Roychowdhury Sameek (Ohio State University),39
Royer William E (Univ Of Massachusetts Med Sch Worcester),14
Ruan Sanbao (Lsu Health Sciences Center New Orleans),6
Rubenstein John L  R (University Of California),160
Rubin Daniel L (Stanford University),37
Rubin Deborah C (Washington University),55
Rubin J Peter (University Of Pittsburgh At Pittsburgh),49
Rubin Joshua B (Washington University),68
Rubin Leah Helane (Johns Hopkins University),21
Rubin Mark A (Weill Medical Coll Of Cornell Univ),341
Rubinstein Jay T (University Of Washington),5
Rudemiller Nathan P (Duke University),12
Ruderfer Douglas (Vanderbilt University),117
Rudic R Daniel (Augusta University),26
Rudolph Michael C (University Of Colorado Denver),36
Rudolph Stephanie (Harvard Medical School),6
Rudra Jai (University Of Texas Med Br Galveston),16
Rudy Bernardo (New York University School Of Medicine),21
Ruella Marco (University Of Pennsylvania),18
Ruggero Davide (University Of California),38
Rui Hallgeir (Medical College Of Wisconsin),85
Rui Liangyou (University Of Michigan),73
Rui Lixin (University Of Wisconsin-Madison),57
Rumbaut Rolando E (Baylor College Of Medicine),32
Runge Kurt W (Cleveland Clinic Lerner Com-Cwru),15
Runge-Morris Melissa A (Wayne State University),40
Ruohola-Baker Hannele (University Of Washington),51
Ruotolo Brandon T (University Of Michigan),17
Russell David W (University Of Washington),67
Russell J Eric (University Of Pennsylvania),17
Russell James W (University Of Maryland Baltimore),24
Russell Joshua (University Of Washington),17
Russell Stephen J (Mayo Clinic Rochester),66
Russell William E (Vanderbilt University),39
Russo Alexandra (Washington University),19
Russo Scott J (Icahn School Of Medicine At Mount Sinai),66
Russo Thomas A (State University Of New York At Buffalo),12
Rust Michael (University Of Chicago),7
Rustgi Anil K (University Of Pennsylvania),223
Rutkowski D Thomas (University Of Iowa),42
Rutledge Nakisha (Northwestern University At Chicago),5
Ryabinin Andrey E (Oregon Health & Science University),35
Ryan Allen F (University Of California San Diego),73
Ryan John P (University Of Pittsburgh At Pittsburgh),7
Ryan Michael (University Of Mississippi Med Ctr),246
Ryan Molly (Yale University),9
Ryan Neal D (University Of Pittsburgh At Pittsburgh),6
Ryan Terence E (East Carolina University),33
Ryba David M (University Of Illinois At Chicago),6
Rybak Ilya A (Drexel University),8
Rybak Leonard P (Southern Illinois University Sch Of Med),19
Rye David B (Emory University),14
Ryeom Sandra W (University Of Pennsylvania),12
Rynders Corey (University Of Colorado Denver),7
Ryu Byungwoo (Boston University Medical Campus),47
Rzhetsky Andrey (University Of Chicago),5
Saade George R (University Of Texas Med Br Galveston),73
Saadi Irfan (University Of Kansas Medical Center),24
Saag Kenneth G (University Of Alabama At Birmingham),23
Saag Michael S (University Of Alabama At Birmingham),31
Sabatini Bernardo L (Harvard Medical School),45
Saberi Parya (University Of California),7
Sabino Valentina (Boston University Medical Campus),13
Sabri Abdelkarim (Temple Univ Of The Commonwealth),33
Sacco Ralph L (University Of Miami School Of Medicine),138
Sachs David H (Columbia University Health Sciences),50
Sadayappan Sakthivel (University Of Cincinnati),47
Sadegh-Nasseri Scheherazade (Johns Hopkins University),15
Sadeghi Mehran M (Yale University),35
Sadeghi Saman (University Of California Los Angeles),7
Sadek Hesham (Ut Southwestern Medical Center),28
Sadhasivam Senthilkumar (Indiana Univ-Purdue Univ At Indianapolis),14
Sadler Georgia Robins (University Of California San Diego),8
Sadler J Evan (Washington University),22
Sadoshima Junichi (Rbhs-New Jersey Medical School),234
Sadygov Rovshan G (University Of Texas Med Br Galveston),15
Safak Mahmut (Temple Univ Of The Commonwealth),22
Safford Monika M (Weill Medical Coll Of Cornell Univ),26
Sage Julien (Stanford University),99
Sagerstrom Charles G (Univ Of Massachusetts Med Sch Worcester),43
Sah Rajan (University Of Iowa),26
Saha Subhrajit (University Of Kansas Medical Center),20
Sahin Ergun (Baylor College Of Medicine),24
Sahni Sanjeev K (University Of Texas Med Br Galveston),44
Sahoo Daisy (Medical College Of Wisconsin),25
Sahoo Susmita (Icahn School Of Medicine At Mount Sinai),14
Said Hamid M (University Of California-Irvine),56
Said Neveen (Wake Forest University Health Sciences),21
Saigusa Takamitsu (University Of Alabama At Birmingham),25
Saiman Lisa (Columbia University Health Sciences),17
Saini Sameer (University Of Michigan),5
Saito Hiroshi (University Of Kentucky),150
Saito Takeshi (University Of Southern California),153
Sajjan Umadevi Sivanappa (Temple Univ Of The Commonwealth),50
Sakaguchi Takuya (Cleveland Clinic Lerner Com-Cwru),24
Sakamoto Kathleen M (Stanford University),76
Sakhaee Khashayar (Ut Southwestern Medical Center),16
Salardini Arash (Yale University),8
Salathe Matthias A (University Of Miami School Of Medicine),16
Sale Winfield S (Emory University),14
Saleheen Danish (University Of Pennsylvania),278
Salem Rany (University Of California San Diego),70
Salemi Marco (University Of Florida),24
Salerno Michael (University Of Virginia),16
Salgame Padmini (Rbhs-New Jersey Medical School),35
Salhia Bodour (University Of Southern California),79
Salic Adrian (Harvard Medical School),30
Salinas Yasmmyn (Yale University),7
Salipante Stephen J (University Of Washington),46
Sall Jeffrey W (University Of California),10
Sallam Karim (Stanford University),13
Sallam Tamer (University Of California Los Angeles),17
Salloum Fadi N (Virginia Commonwealth University),56
Salmon Adam (University Of Texas Hsc San Antonio),38
