Pathway,Count
Feldman Howard (University Of California San Diego),109
Feldman Jack L (University Of California Los Angeles),11
Feldman Jessica (Univ Of Massachusetts Med Sch Worcester),24
Feldman Jonathan M (Albert Einstein College Of Medicine),6
Feldman Mario (Washington University),6
Feldser David (University Of Pennsylvania),24
Feldstein Ariel (University Of California San Diego),81
Felger Jennifer C (Emory University),18
Felling Ryan J (Johns Hopkins University),10
Felsher Dean W (Stanford University),90
Feltri M Laura (State University Of New York At Buffalo),57
Feng Gen-Sheng (University Of California San Diego),138
Feng Hui (Boston University Medical Campus),143
Feng Jian (State University Of New York At Buffalo),276
Feng Liang (Stanford University),242
Feng Liping (Duke University),33
Feng Ning (Johns Hopkins University),23
Feng Pinghui (University Of Southern California),48
Feng Qin (Baylor College Of Medicine),172
Feng Qiping (Vanderbilt University),39
Feng Sandy (University Of California),28
Feng Wenke (University Of Louisville),60
Feng Wenyi (Upstate Medical University),7
Feng Xin-Hua (Baylor College Of Medicine),157
Feng Yuanyi (Northwestern University At Chicago),23
Feng Yue (Emory University),305
Feng Yumei (University Of Nevada Reno),40
Fenton Aron W (University Of Kansas Medical Center),5
Fenyo David (New York University School Of Medicine),82
Feranchak Andrew P (Ut Southwestern Medical Center),12
Ferguson Adam R (University Of California),28
Ferguson David O (University Of Michigan),47
Ferguson Deveroux (University Of Arizona),27
Ferguson Kathryn M (Yale University),23
Ferguson Polly J (University Of Iowa),37
Ferguson Shawn (Yale University),41
Ferlito Marcella (Johns Hopkins University),20
Fernandes Russell J (University Of Washington),18
Fernandez Alicia (University Of California),18
Fernandez Hernando Carlos (Yale University),121
Fernandez-Funez Pedro (University Of Minnesota),16
Fernandez-Sesma Ana (Icahn School Of Medicine At Mount Sinai),47
Ferrando Adolfo A (Columbia University Health Sciences),113
Ferrante Anthony W (Columbia University Health Sciences),28
Ferrara James L  M (Icahn School Of Medicine At Mount Sinai),48
Ferrari Giovanni (University Of Pennsylvania),47
Ferrari Guido (Duke University),48
Ferrario Carlos M (Wake Forest University Health Sciences),44
Ferreira Adriana B (Northwestern University At Chicago),6
Ferreira Fernanda (University Of California At Davis),24
Ferreira Viviana P (University Of Toledo Health Sci Campus),19
Ferrell James E (Stanford University),31
Ferrell Nicholas (Vanderbilt University),5
Ferreri Nicholas R (New York Medical College),27
Ferriero Donna M (University Of California),53
Ferris Robert L (University Of Pittsburgh At Pittsburgh),187
Ferro-Novick Susan (University Of California San Diego),18
Feschotte Cedric (University Of Utah),21
Fesik Stephen W (Vanderbilt University),43
Feske Stefan (New York University School Of Medicine),67
Fettiplace Robert (University Of Wisconsin-Madison),14
Fetz Eberhard E (University Of Washington),5
Feusner Jamie (University Of California Los Angeles),8
Fidelis Krzysztof A (University Of California At Davis),11
Fiehn Oliver (University Of California At Davis),106
Field Loren J (Indiana Univ-Purdue Univ At Indianapolis),52
Field Seth J (University Of California San Diego),32
Fields Kenneth A (University Of Kentucky),11
Fields Ryan C (Washington University),49
Fiellin David (Yale University),23
Fieremans Els (New York University School Of Medicine),10
Fife Brian T (University Of Minnesota),33
Figueroa Maria Eugenia (University Of Miami School Of Medicine),6
Fikrig Erol (Yale University),127
Filizola Marta (Icahn School Of Medicine At Mount Sinai),22
Fill Michael (Rush University Medical Center),11
Filosa Jessica A (Augusta University),14
Finan Patrick (Johns Hopkins University),10
Finck Brian N (Washington University),72
Findlay Gregory (University Of Washington),13
Fine Howard A (Weill Medical Coll Of Cornell Univ),131
Fine Rebecca (Harvard Medical School),19
Fineman Jeffrey R (University Of California),48
Fingar Diane C (University Of Michigan),39
Finger Thomas E (University Of Colorado Denver),41
Fingert John H (University Of Iowa),209
Fini M Elizabeth (University Of Southern California),48
Fink Jeffrey C (University Of Maryland Baltimore),15
Fink Pamela J (University Of Washington),40
Finke James H (Cleveland Clinic Lerner Com-Cwru),31
Finlayson Emily (University Of California),8
Finn Deborah A (Oregon Health & Science University),40
Finn Kelsey (Harvard Medical School),5
Finn Olivera J (University Of Pittsburgh At Pittsburgh),40
Finn Patricia W (University Of Illinois At Chicago),44
Finnell Richard H (University Of Texas),174
Fiocchi Claudio (Cleveland Clinic Lerner Com-Cwru),63
Fioravante Diasynou (University Of California At Davis),7
Fiore Michael C (University Of Wisconsin-Madison),13
Fire Andrew Z (Stanford University),36
Firestein Gary S (University Of California San Diego),129
Firestone Ross (Albert Einstein College Of Medicine),5
Firulli Anthony B (Indiana Univ-Purdue Univ At Indianapolis),52
Fiscella Kevin (University Of Rochester),19
Fischer Andy J (Ohio State University),59
Fischer William (Univ Of North Carolina Chapel Hill),12
Fischl Margaret A (University Of Miami School Of Medicine),35
Fiser Andras (Albert Einstein College Of Medicine),49
Fishel Richard (Ohio State University),49
Fisher Aron B (University Of Pennsylvania),42
Fisher Daniel W (Northwestern University At Chicago),7
Fisher Edward A (New York University School Of Medicine),116
Fisher Gary J (University Of Michigan),76
Fisher Lawrence (University Of California),14
Fisher Paul B (Virginia Commonwealth University),272
Fisher Robert P (Icahn School Of Medicine At Mount Sinai),42
Fisher Shannon (Boston University Medical Campus),23
Fisher Simon J (University Of Utah),15
Fisher Susan J (University Of California),104
Fisher William E (Baylor College Of Medicine),77
Fisher-Wellman Kelsey (Duke University),11
Fishman Glenn I (New York University School Of Medicine),52
Fiskum Gary M (University Of Maryland Baltimore),6
Fitch Briana (University Of California),8
Fitzgerald Daniel W (Weill Medical Coll Of Cornell Univ),23
Fitzgerald Garret A (University Of Pennsylvania),107
Fitzgerald Katherine A (Univ Of Massachusetts Med Sch Worcester),161
Fitzgerald-Bocarsly Patricia (Rbhs-New Jersey Medical School),44
Fitzpatrick Annette L (University Of Washington),62
Fitzpatrick Paul F (University Of Texas Hsc San Antonio),9
Flaherty Erin (Icahn School Of Medicine At Mount Sinai),7
Flaherty Kevin R (University Of Michigan),43
Flaherty Lawrence E (Wayne State University),12
Flajnik Martin F (University Of Maryland Baltimore),33
Flanagan John G (Harvard Medical School),53
Flanigan Timothy P (Brown University),8
Flavahan Nicholas A (Johns Hopkins University),30
Fleming Robert E (Saint Louis University),29
Fleming William H (Oregon Health & Science University),32
Flemington Erik K (Tulane University Of Louisiana),98
Fletcher Craig A (Univ Of North Carolina Chapel Hill),7
Fletcher Hansel M (Loma Linda University),8
Fletcher Justin (Ut Southwestern Medical Center),19
Flevaris Panagiotis (Northwestern University At Chicago),9
Flocke Susan A (Case Western Reserve University),7
Floden Darlene (Cleveland Clinic Lerner Com-Cwru),5
Flood Veronica H (Medical College Of Wisconsin),6
Flotte Terence R (Univ Of Massachusetts Med Sch Worcester),50
Flowers Christopher R (Emory University),79
Floyd James S (University Of Washington),58
Flum David R (University Of Washington),18
Flynn Joanne L (University Of Pittsburgh At Pittsburgh),43
Foerster Bradley (University Of Michigan),13
Fogel Evan (Indiana Univ-Purdue Univ At Indianapolis),8
Fogelman Alan M (University Of California Los Angeles),77
Fogerty Joseph (Cleveland Clinic Lerner Com-Cwru),16
Fok Alice (New York University School Of Medicine),10
Foley Kristie L (Wake Forest University Health Sciences),10
Folsch Heike (Northwestern University At Chicago),22
Fondufe-Mittendorf Yvonne Nsokika (University Of Kentucky),11
Fong Guo-Hua (University Of Connecticut Sch Of Med/Dnt),47
Fong Lawrence (University Of California),54
Fong Louise Y Y (Thomas Jefferson University),25
Fontana Robert J (University Of Michigan),54
Fontenot Andrew P (University Of Colorado Denver),43
Fontenot Miles (Ut Southwestern Medical Center),9
Fooksman David R (Albert Einstein College Of Medicine),11
Forbes Erika E (University Of Pittsburgh At Pittsburgh),8
Ford Andria Lee (Washington University),11
Ford Byron D (University Of California Riverside),35
Ford David A (Saint Louis University),55
Ford Heide L (University Of Colorado Denver),52
Ford Mandy L (Emory University),51
Foreman Brandon (University Of Cincinnati),6
Foreyt John P (Baylor College Of Medicine),33
Fornace Albert J (Georgetown University),116
Fornage Myriam (University Of Texas Hlth Sci Ctr Houston),124
Forno Erick (University Of Pittsburgh At Pittsburgh),36
Fornoni Alessia (University Of Miami School Of Medicine),58
Foroud Tatiana M (Indiana Univ-Purdue Univ At Indianapolis),178
Forrest John N (Yale University),9
Forsberg Flemming (Thomas Jefferson University),11
Forsmark Christopher E (University Of Florida),13
Forster Gina L (University Of South Dakota),8
Forsyth Katherine (University Of Pennsylvania),6
Fort Patrice E (University Of Michigan),23
Forthal Donald N (University Of California-Irvine),21
Foshage Audra M (Vanderbilt University),8
Foskett J Kevin (University Of Pennsylvania),55
Foster David J (Johns Hopkins University),24
Foster Mary H (Duke University),16
Foster Thomas C (University Of Florida),36
Fouad Mona N (University Of Alabama At Birmingham),7
Foung Steven (Stanford University),9
Fowell Deborah J (University Of Rochester),30
Fowke Jay H (University Of Tennessee Health Sci Ctr),40
Fowler Douglas M (University Of Washington),25
Fowler Mary Glenn (Johns Hopkins University),11
Fowler Nicole R (Indiana Univ-Purdue Univ At Indianapolis),5
Fowler Vance G (Duke University),62
Fox Aaron P (University Of Chicago),13
Fox Brandon M (University Of Alabama At Birmingham),7
Fox Catherine A (University Of Wisconsin-Madison),10
Fox Donald (Duke University),30
Fox Ervin R (University Of Mississippi Med Ctr),161
Fox Howard S (University Of Nebraska Medical Center),97
Fox Ira J (University Of Pittsburgh At Pittsburgh),38
Fox Paul L (Cleveland Clinic Lerner Com-Cwru),106
Fox Robert J (Cleveland Clinic Lerner Com-Cwru),30
Fraenkel Liana (Yale University),12
Fraidenburg Dustin (University Of Illinois At Chicago),19
Frame Alissa A (Boston University Medical Campus),12
France Charles P (University Of Texas Hsc San Antonio),12
Francesconi Anna (Albert Einstein College Of Medicine),16
Francis David O (Vanderbilt University),5
Francis Heather L (Texas A&M University Health Science Ctr),11
Francis Michael M (Univ Of Massachusetts Med Sch Worcester),6
Francklyn Christopher S (University Of Vermont & St Agric College),6
Frangogiannis Nikolaos G (Albert Einstein College Of Medicine),57
Frangou Sophia (Icahn School Of Medicine At Mount Sinai),17
Frank Dara W (Medical College Of Wisconsin),10
Frank Joachim (Columbia University Health Sciences),26
Frank Lawrence R (University Of California San Diego),12
Frank Loren M (University Of California),7
Frank Marcos G (Washington State University),9
Frank Stuart J (University Of Alabama At Birmingham),58
Frankel Michael Ross (Emory University),5
Frankel Wayne N (Columbia University Health Sciences),42
Franklin Patricia D (Univ Of Massachusetts Med Sch Worcester),6
Franklin Sarah (University Of Utah),36
Franks Kevin (Duke University),12
Frantz Robert (Mayo Clinic Rochester),37
Fraser Christopher S (University Of California At Davis),23
Fraser Claire M (University Of Maryland Baltimore),19
Fraser Matthew O (Duke University),14
Frasor Jonna (University Of Illinois At Chicago),47
Freda Pamela U (Columbia University Health Sciences),10
Freddolino Peter L (University Of Michigan),8
Frederick Mitchell J (Baylor College Of Medicine),64
Fredman Gabrielle (Albany Medical College),29
Freedberg Daniel E (Columbia University Health Sciences),5
Freedland Kenneth E (Washington University),18
Freedman Jane E (Univ Of Massachusetts Med Sch Worcester),95
Freedman Neil J (Duke University),52
Freedman Tanya S (University Of Minnesota),11
Freel Meyers Caren L (Johns Hopkins University),8
Freeman James (Yale University),57
Freeman Kalev (University Of Vermont & St Agric College),7
Freeman Kevin B (University Of Mississippi Med Ctr),14
Freeman Marc R (Univ Of Massachusetts Med Sch Worcester),32
Fregoso Oliver I (University Of California Los Angeles),14
Freiberg Matthew S (Vanderbilt University),16
Freimer Nelson B (University Of California Los Angeles),188
French Anthony R (Washington University),35
French Jarrod B (State University New York Stony Brook),8
Frenette Paul S (Albert Einstein College Of Medicine),61
Frenkel Baruch (University Of Southern California),114
Freud Aharon G (Ohio State University),48
Freudenthal Bret D (University Of Kansas Medical Center),10
Freund Karen (Tufts University Boston),6
Frey Erin (Washington University),5
Frey Kirk A (University Of Michigan),22
Frias Antonio E (Oregon Health & Science University),9
Fridovich-Keil Judith L (Emory University),10
Fried Itzhak (University Of California Los Angeles),9
Fried Michael W (Univ Of North Carolina Chapel Hill),30
Fried Susan K (Icahn School Of Medicine At Mount Sinai),67
Friedberg Jonathan W (University Of Rochester),53
Friedl Andreas (University Of Wisconsin-Madison),46
Friedman Alan D (Johns Hopkins University),81
Friedman Alexander M (Columbia University Health Sciences),5
Friedman Jacob E (University Of Colorado Denver),86
Friedman Jonathan R (University Of California At Davis),11
Friedman Peter A (University Of Pittsburgh At Pittsburgh),53
Friedman Scott L (Icahn School Of Medicine At Mount Sinai),279
Friedman Theodore C (Charles R. Drew University Of Med & Sci),21
Fries Bettina (State University New York Stony Brook),6
Friess Stuart H (Washington University),5
Frizzell Norma (University Of South Carolina At Columbia),31
Frizzell Raymond A (University Of Pittsburgh At Pittsburgh),48
Froehler Michael T (Vanderbilt University),17
Frohlich Flavio (Univ Of North Carolina Chapel Hill),10
Frohman Michael A (State University New York Stony Brook),58
Frolenkov Gregory I (University Of Kentucky),25
Frolov Maxim (University Of Illinois At Chicago),18
Frolova Elena I (University Of Alabama At Birmingham),31
Frost Jeffrey A (University Of Texas Hlth Sci Ctr Houston),38
Frymoyer Adam (Stanford University),11
Fu Dax (Johns Hopkins University),5
Fu Haian (Emory University),116
Fu Hongjun (Columbia University Health Sciences),29
Fu Hongxia (University Of Washington),12
Fu Shu Man (University Of Virginia),57
Fu Xiang-Dong (University Of California San Diego),118
Fu Yang-Xin (Ut Southwestern Medical Center),130
Fu Ying-Hui (University Of California),45
Fu Zhuo (University Of Virginia),16
Fuccillo Marc V (University Of Pennsylvania),8
Fuchs Charles S (Yale University),234
Fuchs Paul A (Johns Hopkins University),12
Fudge Julie L (University Of Rochester),8
Fuhrmann Sabine (Vanderbilt University),24
Fujimori Danica Galonic (University Of California),7
Fujinaga Koh (University Of California),38
Fujinami Robert S (University Of Utah),32
Fujisaki Joji (Columbia University Health Sciences),11
Fujise Ken (University Of Texas Med Br Galveston),25
Fujita Mayumi (University Of Colorado Denver),69
Fukamachi Kiyotaka (Cleveland Clinic Lerner Com-Cwru),7
Fukuchi Ken-Ichiro (University Of Illinois At Chicago),21
Fukuda Makoto (Baylor College Of Medicine),30
Fukunaga Ryuya (Johns Hopkins University),9
Fuller Deborah H (University Of Washington),12
Fuller Margaret T (Stanford University),37
Fuller Robert S (University Of Michigan),11
Fulton David J (Augusta University),74
Funai Katsuhiko (East Carolina University),17
Funderburg Nicholas T (Ohio State University),44
Funderburgh James L (University Of Pittsburgh At Pittsburgh),58
Fung Constance (University Of California Los Angeles),5
Fung Jennifer C (University Of California),20
Funk Janet L (University Of Arizona),8
Fuqua Suzanne Aw (Baylor College Of Medicine),11
Furenlid Lars R (University Of Arizona),9
Furth Priscilla A (Georgetown University),54
Furuta Glenn T (University Of Colorado Denver),48
Fuschiotti Patrizia (University Of Pittsburgh At Pittsburgh),8
Fuss Babette (Virginia Commonwealth University),24
Futai Kensuke (Univ Of Massachusetts Med Sch Worcester),28
Futch Hunter (University Of Florida),9
Fyodorov Dmitry V (Albert Einstein College Of Medicine),10
Gabel Christopher V (Boston University Medical Campus),12
Gabryszewski Stanislaw J (Columbia University Health Sciences),6
Gaddy Jennifer A (Vanderbilt University),17
Gade Terence P (University Of Pennsylvania),14
Gaffen Sarah L (University Of Pittsburgh At Pittsburgh),99
Gaffney David K (University Of Utah),19
Gaffrey Michael S (Washington University),7
Gage Philip J (University Of Michigan),43
Gahring Lorise C (University Of Utah),25
Gahtan Vivian (Upstate Medical University),21
Gailani David (Vanderbilt University),23
Gaillard Dany (University Of Colorado Denver),10
Gajewski Thomas F (University Of Chicago),110
Gal Jozsef (University Of Kentucky),32
Galan Jorge E (Yale University),47
Galanis Evanthia (Mayo Clinic Rochester),56
Galanopoulou Aristea S (Albert Einstein College Of Medicine),22
Galanzha Ekaterina I (Univ Of Arkansas For Med Scis),8
Galbiati Ferruccio (University Of Pittsburgh At Pittsburgh),32
Gale Michael J (University Of Washington),15
Galen James E (University Of Maryland Baltimore),6
Galgiani John N (University Of Arizona),11
Galindo Rafael (Washington University),7
Galindo Rene L (Ut Southwestern Medical Center),12
Galipeau Jacques (University Of Wisconsin-Madison),115
Gallagher Emily Jane (Icahn School Of Medicine At Mount Sinai),10
Gallagher Patrick G (Yale University),88
Gallant Jean-Nicolas (Vanderbilt University),12
Gallardo Gilbert (Washington University),12
Gallego-Perez Daniel (Ohio State University),18
Galletto Roberto (Washington University),8
Galli Aurelio (Vanderbilt University),21
Galligan James J (Michigan State University),42
Gallo Gianluca (Temple Univ Of The Commonwealth),21
Gallo Richard L (University Of California San Diego),150
Gallo Robert C (University Of Maryland Baltimore),37
Gallos George (Columbia University Health Sciences),25
Gallucci Stefania (Temple Univ Of The Commonwealth),36
Galperin Emilia (University Of Kentucky),18
Galvan Adriana (Emory University),13
Galvani Alison P (Yale University),11
Gama Vivian (Vanderbilt University),21
Gambello Michael J (Emory University),37
Gambetti Pierluigi (Case Western Reserve University),19
Gambhir Sanjiv S (Stanford University),96
Gamble Karen L (University Of Alabama At Birmingham),43
Gamble Matthew J (Albert Einstein College Of Medicine),17
Gambotto Andrea (University Of Pittsburgh At Pittsburgh),57
Gamero Ana M (Temple Univ Of The Commonwealth),44
Gamm David M (University Of Wisconsin-Madison),20
Gan Lin (University Of Rochester),172
Ganapathy Vadivel (Texas Tech University Health Scis Center),169
Ganda Anjali (Columbia University Health Sciences),14
Gandara David R (University Of California At Davis),103
Gandhi Monica (University Of California),20
Ganem Neil J (Boston University Medical Campus),20
Ganesan Anand K (University Of California-Irvine),106
Ganesh Santhi K (University Of Michigan),261
Ganesh Thota (Emory University),18
Ganey Patricia E (Michigan State University),44
Ganguli Mary (University Of Pittsburgh At Pittsburgh),56
Ganju Ramesh K (Ohio State University),85
Ganz Peter (University Of California),46
Ganz Tomas (University Of California Los Angeles),77
Gao Allen C (University Of California At Davis),93
Gao Dingcheng (Weill Medical Coll Of Cornell Univ),17
Gao Fen-Biao (Univ Of Massachusetts Med Sch Worcester),135
Gao Feng (Duke University),129
Gao Jie (University Of California Los Angeles),153
Gao Jinming (Ut Southwestern Medical Center),42
Gao Peisong (Johns Hopkins University),58
Gao Shou-Jiang (University Of Southern California),71
Gao Tianyan (University Of Kentucky),67
Gao Wen-Jun (Drexel University),21
Gao Xiao-Bing (Yale University),37
Gapin Laurent (University Of Colorado Denver),38
Garabedian Michael J (New York University School Of Medicine),83
Garber Judy (Vanderbilt University),161
Garbett Damien (Stanford University),10
Garbett Nichola C (University Of Louisville),7
Garcia Benjamin A (University Of Pennsylvania),198
Garcia Christine Kim (Ut Southwestern Medical Center),22
Garcia Joe G  N (University Of Arizona),237
Garcia-Anoveros Jaime (Northwestern University At Chicago),27
Garcia-Beltran Wilfredo F (Harvard Medical School),20
Garcia-Diaz Miguel (State University New York Stony Brook),22
Garcia-Marcos Mikel (Boston University Medical Campus),41
Garcia-Martinez J Victor (Univ Of North Carolina Chapel Hill),9
Garcia-Ocana Adolfo (Icahn School Of Medicine At Mount Sinai),40
Garcia-Sastre Adolfo (Icahn School Of Medicine At Mount Sinai),168
Garden Gwenn A (University Of Washington),41
Gardiner Edith M (University Of Washington),13
Gardiner Katheleen (University Of Colorado Denver),30
Gardner Christopher D (Stanford University),7
Gardner Jason D (Lsu Health Sciences Center New Orleans),32
Gardner Raquel C (University Of California),8
Gardner Thomas W (University Of Michigan),29
Garfein Richard S (University Of California San Diego),9
Garg Abhimanyu (Ut Southwestern Medical Center),55
Garg Nisha Jain (University Of Texas Med Br Galveston),48
Garg Puneet (University Of Michigan),23
Garman Katherine (Duke University),29
Garofalo Roberto P (University Of Texas Med Br Galveston),84
Garon Edward B (University Of California Los Angeles),40
Garris Christopher S (Harvard Medical School),11
Garry Daniel J (University Of Minnesota),114
Garry Robert F (Tulane University Of Louisiana),31
Garsin Danielle A (University Of Texas Hlth Sci Ctr Houston),7
Garvin Jeffrey L (Case Western Reserve University),42
Garzon Ramiro (Ohio State University),113
Gaspers Lawrence D (Rbhs-New Jersey Medical School),12
Gass Justin T (Medical University Of South Carolina),12
Gassman Jennifer J (Cleveland Clinic Lerner Com-Cwru),6
Gaston Benjamin (Case Western Reserve University),45
Gater David R (Pennsylvania State Univ Hershey Med Ctr),17
Gatza Michael L (Rbhs -Cancer Institute Of New Jersey),59
Gaudilliere Brice (Stanford University),25
Gaultier Alban P (University Of Virginia),7
Gaulton Glen N (University Of Pennsylvania),11
Gauthier Marc (University Of Pittsburgh At Pittsburgh),13
Gautier Jean (Columbia University Health Sciences),66
Gavathiotis Evripidis (Albert Einstein College Of Medicine),110
Gavin David P (University Of Illinois At Chicago),31
Gawrieh Samer (Indiana Univ-Purdue Univ At Indianapolis),23
Gazzinelli Ricardo (Univ Of Massachusetts Med Sch Worcester),109
Ge Shaoyu (State University New York Stony Brook),20
Ge Woo-Ping (Ut Southwestern Medical Center),16
Geddes James W (University Of Kentucky),28
Gedeon Patrick C (Duke University),7
Gee James C (University Of Pennsylvania),13
Gee Kelvin W (University Of California-Irvine),7
Gee Marvin Ho-Yan (Stanford University),8
Gehlenborg Nils (Harvard Medical School),149
Geiger Jonathan David (University Of North Dakota),5
Geisler Stefanie (Washington University),18
Geisler William M (University Of Alabama At Birmingham),14
Gelb Bruce D (Icahn School Of Medicine At Mount Sinai),121
Gelbard Harris A (University Of Rochester),44
Gelernter Joel (Yale University),230
Gelfand Joel M (University Of Pennsylvania),30
Gelfand Vladimir I (Northwestern University At Chicago),27
Geliebter Allan (Icahn School Of Medicine At Mount Sinai),13
Gellad Walid F (University Of Pittsburgh At Pittsburgh),15
Geller Alfred I (Lsu Health Sciences Center New Orleans),8
Gelles-Hurwitz Jesse (Icahn School Of Medicine At Mount Sinai),114
Gelman Benjamin B (University Of Texas Med Br Galveston),68
Genco Caroline A (Tufts University Boston),32
Gendelman Howard E (University Of Nebraska Medical Center),115
Geng Elvin H (University Of California),6
Gennaro Maria Laura (Rbhs-New Jersey Medical School),12
Gensel John C (University Of Kentucky),32
Gentile Nina T (Temple Univ Of The Commonwealth),5
Gentry Matthew S (University Of Kentucky),18
Georas Steve N (University Of Rochester),46
Georgakopoulos Anastasios (Icahn School Of Medicine At Mount Sinai),24
George Alfred L (Northwestern University At Chicago),88
George Paul (Stanford University),33
George Steven Z (Duke University),25
Georgieff Michael K (University Of Minnesota),56
Georgiev Ivelin (Vanderbilt University),12
Geraci Mark W (Indiana Univ-Purdue Univ At Indianapolis),53
Gerasimovskaya Evgenia V (University Of Colorado Denver),10
Gerber Scott A (Dartmouth College),84
Gerbi Susan A (Brown University),8
Gereau Robert (Washington University),39
Gerken Thomas A (Case Western Reserve University),21
Gerkovich Mary M (University Of Missouri Kansas City),5
Germain Doris A (Icahn School Of Medicine At Mount Sinai),34
Germain-Lee Emily L (University Of Connecticut Sch Of Med/Dnt),15
German Michael S (University Of California),77
German Rebecca Z (Northeast Ohio Medical University),5
Gern James E (University Of Wisconsin-Madison),72
Gerner Michael (University Of Washington),16
Gernsheimer Terry B (University Of Washington),6
Gerschenson Mariana (University Of Hawaii At Manoa),12
Gershon Anne A (Columbia University Health Sciences),7
Gershon Elliot S (University Of Chicago),126
Gershon Timothy (Univ Of North Carolina Chapel Hill),35
Gerson Stanton L (Case Western Reserve University),62
Gerthoffer William T (University Of South Alabama),63
Gertsman Ilya (University Of California San Diego),7
Gertz Jason (University Of Utah),49
Geschwind Daniel H (University Of California Los Angeles),291
Geschwind Michael D (University Of California),29
Gestwicki Jason E (University Of California),144
Geula Changiz (Northwestern University At Chicago),47
Gevaert Olivier (Stanford University),84
