Pathway,Count
Li Na (Baylor College Of Medicine),105
Li Ningjun (Virginia Commonwealth University),60
Li Nuo (Baylor College Of Medicine),26
Li Qiaoli (Thomas Jefferson University),89
Li Qijing (Duke University),5
Li Qing (University Of Michigan),128
Li Qingjie (University Of Texas Med Br Galveston),69
Li Qiuhong (University Of Florida),70
Li Qiutang (University Of Louisville),51
Li Renhao (Emory University),18
Li Ruijiang (Stanford University),20
Li Shaoguang (Univ Of Massachusetts Med Sch Worcester),65
Li Shaohua (Rbhs-Robert Wood Johnson Medical School),112
Li Sheng (University Of Texas Hlth Sci Ctr Houston),140
Li Shi-Hua (Emory University),23
Li Shi-Jiang (Medical College Of Wisconsin),17
Li Shuxin (Temple Univ Of The Commonwealth),35
Li Shuzhao (Emory University),17
Li Stephen (Ut Southwestern Medical Center),35
Li Suzhao (University Of Colorado Denver),31
Li Tiangang (University Of Kansas Medical Center),58
Li Wan-Ju (University Of Wisconsin-Madison),20
Li Weikai (Washington University),9
Li Wenbo (University Of Texas Hlth Sci Ctr Houston),84
Li Wenjun (Univ Of Massachusetts Med Sch Worcester),210
Li Willis X (University Of California San Diego),20
Li Xiang-An (University Of Kentucky),26
Li Xiao-Jiang (Emory University),74
Li Xiaogang (University Of Kansas Medical Center),111
Li Xiaoman (University Of Central Florida),67
Li Xiaoxia (Cleveland Clinic Lerner Com-Cwru),101
Li Xin (University Of Rochester),101
Li Xingde (Johns Hopkins University),12
Li Yan (University Of California),103
Li Yi (Baylor College Of Medicine),100
Li Yifan (University Of South Dakota),114
Li Yong (Cleveland Clinic Lerner Com-Cwru),104
Li Yu-Long (University Of Nebraska Medical Center),37
Li Yuanpei (University Of California At Davis),28
Li Yuanyuan (University Of Alabama At Birmingham),127
Li Yun (Univ Of North Carolina Chapel Hill),127
Li Yuqing (University Of Florida),104
Li Zhenyu (University Of Kentucky),194
Li Zhigang (Dartmouth College),162
Li Zibo (Univ Of North Carolina Chapel Hill),65
Li Zihai (Medical University Of South Carolina),110
Li Ziyin (University Of Texas Hlth Sci Ctr Houston),33
Li Zong-Ming (Cleveland Clinic Lerner Com-Cwru),11
Lian Jane B (University Of Vermont & St Agric College),213
Lian Min (Washington University),65
Liang Chengyu (University Of Southern California),137
Liang Jie (University Of Illinois At Chicago),212
Liang Mingyu (Medical College Of Wisconsin),81
Liang Ying (University Of Kentucky),288
Liangpunsakul Suthat (Indiana Univ-Purdue Univ At Indianapolis),65
Liao Dezhi (University Of Minnesota),6
Liao Francesca-Fang (University Of Tennessee Health Sci Ctr),36
Liao James Kuang-Jan (University Of Chicago),139
Liao Maofu (Harvard Medical School),16
Liao Wilson (University Of California),78
Liarski Vladimir M (University Of Chicago),8
Liau Linda M (University Of California Los Angeles),83
Libby Richard T (University Of Rochester),69
Licatalosi Donny (Case Western Reserve University),7
Licht Jonathan D (University Of Florida),145
Lichtarge Olivier (Baylor College Of Medicine),84
Lichtenberger Lenard M (University Of Texas Hlth Sci Ctr Houston),8
Lichtman Judith H (Yale University),13
Liddle Rodger A (Duke University),20
Lieber Michael R (University Of Southern California),48
Lieberman Andrew P (University Of Michigan),208
Lieberman Jay R (University Of Southern California),26
Liebman Susan W (University Of Nevada Reno),10
Liechty Edward A (Indiana Univ-Purdue Univ At Indianapolis),6
Liechty Kenneth W (University Of Colorado Denver),25
Liem Karel F (Yale University),20
Liem Ronald K (Columbia University Health Sciences),34
Lien Egil (Univ Of Massachusetts Med Sch Worcester),71
Lieske John C (Mayo Clinic Rochester),59
Lietman Thomas M (University Of California),14
Liew Chong Wee (University Of Illinois At Chicago),46
Lifton Richard P (Yale University),100
Liggett Stephen B (University Of South Florida),49
Light Alan R (University Of Utah),43
Light Kathleen C (University Of Utah),39
Lillard James W (Morehouse School Of Medicine),80
Lilly Michael B (Medical University Of South Carolina),44
Lim Daniel A (University Of California),33
Lim Janghoo (Yale University),22
Lim Joohyun (Baylor College Of Medicine),35
Lim Kelvin O (University Of Minnesota),20
Lim Steve (University Of South Alabama),6
Lim Wendell A (University Of California),33
Limberg Jacqueline K (Mayo Clinic Rochester),6
Limdi Nita A (University Of Alabama At Birmingham),34
Limoli Charles (University Of California-Irvine),38
Limper Andrew H (Mayo Clinic Rochester),55
Lin Ai-Ling (University Of Kentucky),32
Lin Anning (University Of Chicago),58
Lin Charles Yang (Baylor College Of Medicine),24
Lin Cheng (Boston University Medical Campus),266
Lin Chien-Liang Glenn (Ohio State University),9
Lin Christine Maylyn (University Of Colorado Denver),10
Lin Chunqing (University Of California Los Angeles),5
Lin Dayu (New York University School Of Medicine),7
Lin Eugene (Stanford University),177
Lin Fangming (Columbia University Health Sciences),115
Lin Feng C (Cleveland Clinic Lerner Com-Cwru),180
Lin Frank R (Johns Hopkins University),7
Lin Gang (Weill Medical Coll Of Cornell Univ),88
Lin Gufa (University Of Minnesota),20
Lin Haifan (Yale University),58
Lin Haiqun (Yale University),16
Lin Hui-Kuan (Wake Forest University Health Sciences),101
Lin Hung Wen (Louisiana State Univ Hsc Shreveport),11
Lin Jean (Boston University Medical Campus),24
Lin Jenny J (Icahn School Of Medicine At Mount Sinai),5
Lin Jessica (Univ Of North Carolina Chapel Hill),39
Lin Jiandie D (University Of Michigan),60
Lin Jiayuh (University Of Maryland Baltimore),72
Lin Jonathan (University Of California San Diego),66
Lin Kai (Northwestern University At Chicago),76
Lin Lan (University Of California Los Angeles),86
Lin Michael Z (Stanford University),17
Lin Philana Ling (University Of Pittsburgh At Pittsburgh),15
Lin Phoebe (Oregon Health & Science University),18
Lin Richard Z (State University New York Stony Brook),48
Lin Rueyling (Ut Southwestern Medical Center),10
Lin Shiao Enrique (University Of Pennsylvania),8
Lin Shin (University Of Washington),29
Lin Su-Ju (University Of California At Davis),9
Lin Vivian Y (University Of Alabama At Birmingham),17
Lin Weei-Chin (Baylor College Of Medicine),72
Lin Weichun (Ut Southwestern Medical Center),30
Lin Weili (Univ Of North Carolina Chapel Hill),38
Lin Wensheng (University Of Minnesota),31
Lin Xi (Emory University),213
Lin Yi (Mayo Clinic Rochester),119
Lin Zhiyong (Case Western Reserve University),36
Lindberg Iris (University Of Maryland Baltimore),33
Lindborg Jane (Case Western Reserve University),5
Linden David J (Johns Hopkins University),37
Linden David R (Mayo Clinic Rochester),29
Lindenbach Brett D (Yale University),25
Lindner Jonathan R (Oregon Health & Science University),41
Lindsey Merry L (University Of Mississippi Med Ctr),89
Lindsey Sarah H (Tulane University Of Louisiana),12
Lindsley Craig (Vanderbilt University),129
Linehan David C (University Of Rochester),52
Linette Gerald P (University Of Pennsylvania),48
Ling Jiqiang (University Of Texas Hlth Sci Ctr Houston),10
Ling Pamela May (University Of California),9
Lingappan Krithika (Baylor College Of Medicine),16
Lingle Christopher J (Washington University),15
Link Brian A (Medical College Of Wisconsin),51
Link Daniel C (Washington University),118
Link Thomas M (University Of California),16
Linnemann Amelia K (Indiana Univ-Purdue Univ At Indianapolis),24
Linninger Andreas A (University Of Illinois At Chicago),6
Linton Macrae F (Vanderbilt University),94
Liou Jen (Ut Southwestern Medical Center),20
Liou Theodore Geh-Lu (University Of Utah),13
Liphardt Jan T (Stanford University),6
Lipinski Marta M (University Of Maryland Baltimore),113
Lippman Scott M (University Of California San Diego),199
Lipscomb John D (University Of Minnesota),14
Lipscombe Diane (Brown University),21
Lipshutz Gerald S (University Of California Los Angeles),15
Lipton Richard B (Albert Einstein College Of Medicine),40
Lipuma John J (University Of Michigan),33
Lira Sergio A (Icahn School Of Medicine At Mount Sinai),121
Liton Paloma (Duke University),108
Litovchick Larisa (Virginia Commonwealth University),37
Litt Brian (University Of Pennsylvania),5
Litt Michael (Vanderbilt University),22
Little Hannah (Johns Hopkins University),6
Little Jane (Case Western Reserve University),17
Little Randie (University Of Missouri-Columbia),16
Littman Dan (New York University School Of Medicine),159
Liu Bei (Medical University Of South Carolina),201
Liu Bindong (Meharry Medical College),17
Liu Bo (University Of Wisconsin-Madison),112
Liu Bolin (University Of Colorado Denver),59
Liu Chen (Ut Southwestern Medical Center),104
Liu Chi (Yale University),78
Liu Chuanju (New York University School Of Medicine),38
Liu Chunming (University Of Kentucky),104
Liu Chunyu (University Of Illinois At Chicago),337
Liu Da Zhi (University Of California At Davis),56
Liu Dajiang (Pennsylvania State Univ Hershey Med Ctr),84
Liu Dong (Morehouse School Of Medicine),175
Liu Feng (University Of Texas Hsc San Antonio),141
Liu Fudong (University Of Texas Hlth Sci Ctr Houston),21
Liu Gang (University Of Alabama At Birmingham),106
Liu Guanghao (University Of Iowa),34
Liu Haoping (University Of California-Irvine),11
Liu Hongfang (Mayo Clinic Rochester),51
Liu Huiping (Northwestern University At Chicago),34
Liu Jiandong (Univ Of North Carolina Chapel Hill),57
Liu Jing (Northwestern University At Chicago),106
Liu Jun O (Johns Hopkins University),118
Liu Kang (Columbia University Health Sciences),236
Liu Kathleen D (University Of California),45
Liu Kebin (Augusta University),117
Liu Liang (Columbia University Health Sciences),167
Liu Meilian (University Of New Mexico Health Scis Ctr),43
Liu Meng (Medical University Of South Carolina),207
Liu Michael Bon-Hao (University Of California Los Angeles),57
Liu Mingen (University Of Pennsylvania),17
Liu Peiying (Johns Hopkins University),7
Liu Pengda (Univ Of North Carolina Chapel Hill),62
Liu Qin (Washington University),112
Liu Qing-Song (Medical College Of Wisconsin),29
Liu Qinghang (University Of Washington),33
Liu Qinghua (Ut Southwestern Medical Center),133
Liu Qinglian (Virginia Commonwealth University),14
Liu Renyu (University Of Pennsylvania),7
Liu Ruisheng (University Of South Florida),35
Liu Ruiwu (University Of California At Davis),32
Liu Shaolin (University Of Maryland Baltimore),5
Liu Thomas T (University Of California San Diego),12
Liu Wei (Albert Einstein College Of Medicine),116
Liu Xin (Ut Southwestern Medical Center),111
Liu Xiu (University Of Mississippi Med Ctr),63
Liu Xue Z (University Of Miami School Of Medicine),19
Liu Yan (Indiana Univ-Purdue Univ At Indianapolis),113
Liu Yang (University Of Pittsburgh At Pittsburgh),112
Liu Yanhong (Baylor College Of Medicine),223
Liu Yanjun (Charles R. Drew University Of Med & Sci),94
Liu Yanni (University Of Michigan),13
Liu Yao (University Of Wisconsin-Madison),304
Liu Yi (Ut Southwestern Medical Center),106
Liu Yin (Wake Forest University Health Sciences),301
Liu Yongjian (Washington University),82
Liu Yongmei (Wake Forest University Health Sciences),150
Liu Youhua (University Of Pittsburgh At Pittsburgh),122
Liu Yunlong (Indiana Univ-Purdue Univ At Indianapolis),257
Liu Yuru (University Of Illinois At Chicago),21
Liu Zhang-Xu (University Of Southern California),21
Liu Zhenguo (Ohio State University),108
Liu Zhenqi (University Of Virginia),51
Liu Zhi (Univ Of North Carolina Chapel Hill),335
Liu-Chen Lee-Yuan (Temple Univ Of The Commonwealth),41
Liu-Smith Feng (University Of California-Irvine),16
Lizama Carlos (University Of California),31
Ljungman Mats (University Of Michigan),91
Lloyd Joyce A (Virginia Commonwealth University),37
Lloyd Richard E (Baylor College Of Medicine),45
Lloyd-Jones Donald M (Northwestern University At Chicago),38
Lo Cecilia W (University Of Pittsburgh At Pittsburgh),70
Lo David D (University Of California Riverside),35
Lo Donald C (Duke University),40
Lo Grace (Baylor College Of Medicine),16
Lo Hui-Wen (Wake Forest University Health Sciences),52
Lo James C (Weill Medical Coll Of Cornell Univ),25
Lo Re Vincent (University Of Pennsylvania),11
Lo Roger S (University Of California Los Angeles),56
Lo Yuan-Hung (Stanford University),25
Lobingier Braden (University Of California),6
Lobo Mary Kay (University Of Maryland Baltimore),33
Locasale Jason W (Duke University),66
Locksley Richard M (University Of California),91
Lodge Daniel (University Of Texas Hsc San Antonio),17
Lodge Jennifer K (Washington University),17
Loeb David M (Johns Hopkins University),37
Loeb Lawrence A (University Of Washington),34
Loeb Stacy (New York University School Of Medicine),13
Loehrer Patrick J (Indiana Univ-Purdue Univ At Indianapolis),33
Loeser Richard F (Univ Of North Carolina Chapel Hill),45
Loew Leslie M (University Of Connecticut Sch Of Med/Dnt),19
Loewenstein David (University Of Miami School Of Medicine),22
Logan Ryan W (University Of Pittsburgh At Pittsburgh),12
Logan Susan K (New York University School Of Medicine),41
Loh Horace (University Of Minnesota),87
Loh Kyle M (Stanford University),31
Loh Stewart N (Upstate Medical University),11
Lohman Timothy M (Washington University),6
Loiselle Alayna (University Of Rochester),25
Lok Anna S F (University Of Michigan),19
Loke Png (New York University School Of Medicine),5
Lokensgard James R (University Of Minnesota),52
Lokshin Anna E (University Of Pittsburgh At Pittsburgh),57
Lolis Elias (Yale University),41
Lombard Julian H (Medical College Of Wisconsin),25
Lomberk Gwen (Medical College Of Wisconsin),99
Lominadze David (University Of Louisville),29
Lomova Anastasia (University Of California Los Angeles),5
Lomvardas Stavros (Columbia University Health Sciences),35
London Edythe D (University Of California Los Angeles),20
Long Fanxin (Washington University),108
Long Joanna R (University Of Florida),5
Long Michael A (New York University School Of Medicine),11
Long Qi (University Of Pennsylvania),93
Long Weiwen (Wright State University),43
Long Xiaochun (Albany Medical College),45
Longaker Michael T (Stanford University),176
Longhurst John C (University Of California-Irvine),9
Longman Randy S (Weill Medical Coll Of Cornell Univ),16
Longmore Gregory D (Washington University),74
Longnecker Richard M (Northwestern University At Chicago),11
Longo Frank M (Stanford University),36
Longo Nicola (University Of Utah),55
Longobardi Lara (Univ Of North Carolina Chapel Hill),23
Loo Joseph A (University Of California Los Angeles),89
Loo Sandra K (University Of California Los Angeles),39
Loos Ruth Jf (Icahn School Of Medicine At Mount Sinai),38
Lopatin Anatoli N (University Of Michigan),7
Loperena Roxana (Vanderbilt University),12
Lopes-Virella Maria F (Medical University Of South Carolina),50
Lopez Alejandro I (Weill Medical Coll Of Cornell Univ),42
Lopez Marcelo F (Medical University Of South Carolina),19
Lopez Oscar L (University Of Pittsburgh At Pittsburgh),200
Lopezpajares Vanessa (Stanford University),329
Lord Catherine (Weill Medical Coll Of Cornell Univ),58
Lord Edith M (University Of Rochester),24
Lorenz Michael C (University Of Texas Hlth Sci Ctr Houston),5
Lorenzo Joseph A (University Of Connecticut Sch Of Med/Dnt),27
Loros Jennifer J (Dartmouth College),29
Lory Stephen (Harvard Medical School),12
Losacco Justin T (University Of Colorado Denver),6
Losonczy Attila (Columbia University Health Sciences),5
Lotan Tamara L (Johns Hopkins University),68
Lotti Francesco (Columbia University Health Sciences),14
Lotz Jeffrey C (University Of California),28
Lou Xuelin (University Of Wisconsin-Madison),10
Lou Zhenkun (Mayo Clinic Rochester),84
Lough Kendall (Univ Of North Carolina Chapel Hill),7
Louis Elan D (Yale University),62
Louvi Angeliki (Yale University),51
Lovallo William R (University Of Oklahoma Hlth Sciences Ctr),8
Love Tiffany (University Of Utah),12
Lovell Jonathan F (State University Of New York At Buffalo),17
Loverde Philip T (University Of Texas Hsc San Antonio),22
Lovering Richard M (University Of Maryland Baltimore),27
Lovett-Racke Amy E (Ohio State University),45
Lovewell Rustin R (Univ Of Massachusetts Med Sch Worcester),6
Low Carissa A (University Of Pittsburgh At Pittsburgh),6
Low Phillip A (Mayo Clinic Rochester),31
Lowe Dawn A (University Of Minnesota),32
Lowe Mark E (Washington University),22
Lowe William L (Northwestern University At Chicago),69
Lowell Clifford A (University Of California),143
Lowenstein Pedro R (University Of Michigan),69
Lowery Erin (Loyola University Chicago),5
Lowsky Robert (Stanford University),9
Lowy Andrew M (University Of California San Diego),65
Loyd James E (Vanderbilt University),76
Lozupone Catherine (University Of Colorado Denver),17
Lu Binfeng (University Of Pittsburgh At Pittsburgh),159
Lu Bingwei (Stanford University),43
Lu Dan (Stanford University),194
Lu Hanzhang (Johns Hopkins University),11
Lu Hua (Tulane University Of Louisiana),251
Lu Hui (George Washington University),165
Lu Jining (Columbia University Health Sciences),58
Lu Junxuan (Pennsylvania State Univ Hershey Med Ctr),60
Lu Kevin Lu (University Of Michigan),15
Lu Kurt (Case Western Reserve University),8
Lu Lichun (Mayo Clinic Rochester),15
Lu Min (Rosalind Franklin Univ Of Medicine & Sci),119
Lu Qing (Michigan State University),107
Lu Rong (University Of Southern California),5
Lu Songjian (University Of Pittsburgh At Pittsburgh),23
Lu Tao (Indiana Univ-Purdue Univ At Indianapolis),187
Lu Wuyuan (University Of Maryland Baltimore),79
Lu Xiaowei (University Of Virginia),52
Lu Xin-Yun (University Of Texas Hsc San Antonio),22
Lu Xinghua (University Of Pittsburgh At Pittsburgh),63
Lu Xiongbin (Indiana Univ-Purdue Univ At Indianapolis),62
Lu Zhe (University Of Pennsylvania),43
Lu Zhipeng (Stanford University),8
Luban Jeremy (Univ Of Massachusetts Med Sch Worcester),66
Lubbers Ellen (Ohio State University),9
Lubman David M (University Of Michigan),64
Luby Joan L (Washington University),13
Luca Francesca (Wayne State University),39
Lucas Carrie L (Yale University),20
Lucas Gregory M (Johns Hopkins University),15
Lucas Peter C (University Of Pittsburgh At Pittsburgh),63
Lucas Rudolf (Augusta University),56
Lucchini Roberto G (Icahn School Of Medicine At Mount Sinai),9
Luchsinger Jose (Columbia University Health Sciences),18
Lucia M Scott (University Of Colorado Denver),81
Luck Steven J (University Of California At Davis),5
Luderer Ulrike (University Of California-Irvine),19
Ludtke Steven J (Baylor College Of Medicine),30
Lue Neal F (Weill Medical Coll Of Cornell Univ),19
Lue Tom F (University Of California),102
Luebke Anne E (University Of Rochester),13
Luense Lacey J (University Of Pennsylvania),10
Luepker Russell V (University Of Minnesota),12
Lui Asona (University Of Kansas Medical Center),10
Lui Yvonne W (New York University School Of Medicine),7
Luikart Bryan W (Dartmouth College),16
Luk Kelvin C (University Of Pennsylvania),13
Lukacher Aron (Pennsylvania State Univ Hershey Med Ctr),19
Lukacs Nicholas W (University Of Michigan),205
Lukehart Sheila A (University Of Washington),12
Luker Gary D (University Of Michigan),32
Lukiw Walter J (Lsu Health Sciences Center New Orleans),73
Lum Hillary (University Of Colorado Denver),11
Lum Lawrence G (University Of Virginia),39
Lumeng Carey N (University Of Michigan),59
Lumpkin Ellen A (Columbia University Health Sciences),20
Luna Beatriz (University Of Pittsburgh At Pittsburgh),6
Lund Frances E (University Of Alabama At Birmingham),68
Lund Troy C (University Of Minnesota),62
Luo Flora (Harvard Medical School),9
Luo Gang (University Of Washington),119
Luo Jia (University Of Kentucky),284
Luo Jun (Johns Hopkins University),101
Luo Weibo (Ut Southwestern Medical Center),61
Luo Wenqin (University Of Pennsylvania),26
Luo Xu (University Of Nebraska Medical Center),81
Luo Xunrong (Northwestern University At Chicago),38
Luo Yi (University Of Iowa),117
Luo Yu (Case Western Reserve University),146
Luo Yuan (Northwestern University At Chicago),130
Lupashin Vladimir V (Univ Of Arkansas For Med Scis),27
Lupski James R (Baylor College Of Medicine),481
Lurie Jon D (Dartmouth College),7
Lutsenko Svetlana (Johns Hopkins University),24
Luttrell Louis M (Medical University Of South Carolina),61
Lutz Amelie (Stanford University),11
Lydon John P (Baylor College Of Medicine),148
Lyerly Herbert Kim (Duke University),14
Lyketsos Constantine G (Johns Hopkins University),62
Lyle Alicia N (Emory University),27
Lyles Douglas S (Wake Forest University Health Sciences),31
Lynch John P (University Of Pennsylvania),49
Lynch Kevin R (University Of Virginia),46
Lynch Kristen W (University Of Pennsylvania),41
Lyons Karen M (University Of California Los Angeles),81
Lyons Traci (University Of Colorado Denver),15
Lyshchik Andrej (Thomas Jefferson University),10
Lysiak Jeffrey J (University Of Virginia),26
Lytton William W (Suny Downstate Medical Center),8
Ma Dengke (University Of California),22
Ma He-Ping (Emory University),33
Ma Jian-Xing (University Of Oklahoma Hlth Sciences Ctr),112
Ma Jianjie (Ohio State University),161
Ma Jun (University Of California),109
Ma Le (Thomas Jefferson University),81
Ma Li (Morehouse School Of Medicine),108
Ma Liang (Washington University),101
Ma Minghong (University Of Pennsylvania),13
Ma Shuangge (Yale University),38
Ma Stephen (Columbia University Health Sciences),14
Ma Tao (Wake Forest University Health Sciences),215
Ma Thomas Y (University Of New Mexico Health Scis Ctr),40
Ma Xin-Liang (Thomas Jefferson University),46
Ma'Ayan Avi (Icahn School Of Medicine At Mount Sinai),104
Maalouf Naim M (Ut Southwestern Medical Center),13
Macara Ian G (Vanderbilt University),103
Maccaferri Gianmaria (Northwestern University At Chicago),8
Maccoss Michael (University Of Washington),88
Macdonald Matthew L (University Of Pittsburgh At Pittsburgh),14
Macdonald Paul N (Case Western Reserve University),17
Macdonald Raymond J (Ut Southwestern Medical Center),36
Macdougald Ormond A (University Of Michigan),91
Macfarlane Peter (Case Western Reserve University),54
Macglashan Donald W (Johns Hopkins University),22
Macgurn Jason A (Vanderbilt University),6
Mach Robert H (University Of Pennsylvania),47
Machado Heather L (Tulane University Of Louisiana),5
Machado Roberto F (University Of Illinois At Chicago),98
Machamer Carolyn E (Johns Hopkins University),21
Machida Keigo (University Of Southern California),98
Machida Yuichi (Mayo Clinic Rochester),41
Machtay Mitchell (Case Western Reserve University),20
Macian Fernando (Albert Einstein College Of Medicine),144
Maciejewski Jaroslaw P (Cleveland Clinic Lerner Com-Cwru),153
Maciejewski Matthew L (Duke University),32
Maciver Nancie (Duke University),14
Mack Christopher P (Univ Of North Carolina Chapel Hill),46
Mack Ethan (University Of Pennsylvania),12
Mack William J (University Of Southern California),36
Mackeigan Jeffrey (Michigan State University),156
Mackelprang Romel D (University Of Washington),20
Mackenzie Tippi (University Of California),14
Mackinnon Susan E (Washington University),36
Macklin Wendy B (University Of Colorado Denver),75
Mackman Nigel (Univ Of North Carolina Chapel Hill),99
Mackow Erich R (State University New York Stony Brook),38
Maclean Andrew G (Tulane University Of Louisiana),14
Maclean Paul S (University Of Colorado Denver),35
Macleod Amanda S (Duke University),16
Macleod Kay F (University Of Chicago),119
Macmicking John David (Yale University),84
Macmillan John B (Ut Southwestern Medical Center),22
Macmillan-Crow Lee A (Univ Of Arkansas For Med Scis),98
Macnamara Katherine C (Albany Medical College),13
Macones George A (Washington University),28
Macrae Trisha (University Of California),9
Madan Rajat (University Of Cincinnati),26
Maddala Rupalatha (Duke University),28
Madden Dean R (Dartmouth College),16
Madden Pamela Ann (Washington University),16
Maddipati Ravikanth (University Of Pennsylvania),16
Madhani Hiten D (University Of California),19
Madhavan Subha (Georgetown University),58
Madhyastha Tara (University Of Washington),7
Madireddy Advaitha (Albert Einstein College Of Medicine),13
Madrid Andy (University Of Wisconsin-Madison),10
Maecker Holden T (Stanford University),56
Maeda Nobuyo (Univ Of North Carolina Chapel Hill),118
Maezawa Izumi (University Of California At Davis),24
Maffei Arianna (State University New York Stony Brook),6
Magaziner Jay (University Of Maryland Baltimore),11
Magee John C (University Of Michigan),17
Maggirwar Sanjay B (University Of Rochester),50
Magill Stephen T (University Of California),17
Magness Ronald R (University Of South Florida),43
Magness Scott T (Univ Of North Carolina Chapel Hill),53
Magnotta Vincent A (University Of Iowa),17
Magnuson Terry R (Univ Of North Carolina Chapel Hill),11
Maguire Maureen G (University Of Pennsylvania),31
Mahabaleshwar Ganapati Holanagadde (Case Western Reserve University),7
Mahajan Prashant (University Of Michigan),10
Mahajan Vinit B (University Of Iowa),81
Mahendroo Mala S (Ut Southwestern Medical Center),22
Maher Christopher A (Washington University),114
Maher Jacquelyn J (University Of California),33
Maher Joseph F (University Of Mississippi Med Ctr),25
Maher Louis James (Mayo Clinic Rochester),17
Maheshwari Akhil (University Of South Florida),52
Maheshwari Atul (Baylor College Of Medicine),8
Mahle William T (Emory University),16
Mahmud Nadim (University Of Illinois At Chicago),55
Mai Nguyen (University Of Rochester),123
Maidment Nigel T (University Of California Los Angeles),18
Maillard Ivan (University Of Michigan),128
Mains Richard E (University Of Connecticut Sch Of Med/Dnt),55
Maiseyeu Andrei (Case Western Reserve University),32
Maity Amit (University Of Pennsylvania),41
Maizels Nancy (University Of Washington),50
Majeti Ravindra (Stanford University),63
Majetschak Matthias (Loyola University Chicago),31
Major Amy S (Vanderbilt University),34
Majumdar Sharmila (University Of California),25
Majumder Rinku (Lsu Health Sciences Center New Orleans),7
Mak Don-On Daniel (University Of Pennsylvania),19
