Pathway,Count
Aakalu Vinay (University Of Illinois At Chicago),6
Aarons Gregory (University Of California San Diego),8
Aaronson Stuart A (Icahn School Of Medicine At Mount Sinai),100
Abaci Hasan Erbil (Columbia University Health Sciences),7
Abadir Peter M (Johns Hopkins University),5
Abais-Battad Justine M (Medical College Of Wisconsin),7
Aballay Alejandro (Duke University),13
Abate-Shen Cory (Columbia University Health Sciences),54
Abbate Antonio (Virginia Commonwealth University),97
Abbott Derek W (Case Western Reserve University),55
Abbott Geoffrey W (University Of California-Irvine),48
Abboud Francois M (University Of Iowa),22
Abdallah Chadi (Yale University),13
Abdel-Latif Ahmed (University Of Kentucky),39
Abdel-Mageed Asim B (Tulane University Of Louisiana),78
Abdellatif Maha (Rbhs-New Jersey Medical School),49
Abdul-Ghani Muhammad (University Of Texas Hsc San Antonio),32
Abdulkadir Sarki A (Northwestern University At Chicago),36
Abdullah Christopher (Oregon Health & Science University),7
Abdulreda Midhat H (University Of Miami School Of Medicine),11
Abecassis Michael M (Northwestern University At Chicago),24
Abee Christian R (University Of Tx Md Anderson Can Ctr),11
Abel E Dale (University Of Iowa),131
Abel E Jason (University Of Wisconsin-Madison),15
Abeliovich Asa (Columbia University Health Sciences),43
Abi-Dargham Anissa (State University New York Stony Brook),10
Abkowitz Janis L (University Of Washington),37
Abood Mary E (Temple Univ Of The Commonwealth),25
Abou Alaiwa Mahmoud (University Of Iowa),15
Abounader Roger (University Of Virginia),56
Abraham Clara (Yale University),120
Abraham Dennis (Duke University),13
Abraham Jonathan (Harvard Medical School),5
Abraham Soman N (Duke University),49
Abrahams Vikki M (Yale University),70
Abrahamson Dale R (University Of Kansas Medical Center),29
Abramowitz Matthew K (Albert Einstein College Of Medicine),10
Abrams Charles K (University Of Illinois At Chicago),13
Abrams Charles S (University Of Pennsylvania),49
Abrams John M (Ut Southwestern Medical Center),16
Abramson Steven B (New York University School Of Medicine),51
Abu Kwaik Yousef A (University Of Louisville),26
Abu-Amer Yousef (Washington University),50
Abumrad Nada A (Washington University),79
Abumrad Naji N (Vanderbilt University),49
Accardi Alessio (Weill Medical Coll Of Cornell Univ),21
Accili Domenico (Columbia University Health Sciences),100
Accornero Federica (Ohio State University),21
Aceves Seema S (University Of California San Diego),16
Acharya Usha R (Univ Of Massachusetts Med Sch Worcester),5
Achilefu Samuel (Washington University),53
Achim Cristian L (University Of California San Diego),50
Ackerman Joseph J  H (Washington University),12
Ackerman Susan L (University Of California San Diego),46
Ackermann Maegen Allysum (Ohio State University),12
Ackermann Ronald T (Northwestern University At Chicago),7
Acott Ted S (Oregon Health & Science University),44
Adams Andrew B (Emory University),20
Adams Christopher M (University Of Iowa),148
Adams Douglas J (University Of Connecticut Sch Of Med/Dnt),46
Adams John S (University Of California Los Angeles),45
Adams Joseph (University Of California San Diego),33
Adams Robert J (Johns Hopkins University),62
Adane Biniam (University Of Colorado Denver),9
Adebiyi Adebowale (University Of Tennessee Health Sci Ctr),35
Adey Andrew (Oregon Health & Science University),24
Adimora Adaora A (Univ Of North Carolina Chapel Hill),6
Adler Adrienne (Wake Forest University Health Sciences),10
Adler Jeremy (University Of Michigan),26
Adler Nancy E (University Of California),12
Adli Mazhar (University Of Virginia),41
Adoro Stanley (Case Western Reserve University),22
Adunyah Samuel E (Meharry Medical College),29
Advani Sunil J (University Of California San Diego),18
Afaq Farrukh (University Of Alabama At Birmingham),85
Afkarian Maryam (University Of California At Davis),24
Afolayan Adeleye J (Medical College Of Wisconsin),6
Afshar Majid (Loyola University Chicago),11
Afshinnia Farsad (University Of Michigan),9
Aft Rebecca L (Washington University),23
Agak George W (University Of California Los Angeles),12
Agalliu Dritan (Columbia University Health Sciences),21
Agard David A (University Of California),26
Agarwal Anupam (University Of Alabama At Birmingham),77
Agarwal Rajiv (Indiana Univ-Purdue Univ At Indianapolis),30
Agbandje-Mckenna Mavis (University Of Florida),23
Agelidis Alex (University Of Illinois At Chicago),7
Aggarwal Aneel K (Icahn School Of Medicine At Mount Sinai),57
Aggarwal Manisha (Johns Hopkins University),7
Aghi Manish (University Of California),138
Agoulnik Alexander I (Florida International University),62
Agrawal Alok (East Tennessee State University),26
Agrawal Anshu (University Of California-Irvine),53
Agrawal Arpana (Washington University),87
Agrawal Devendra K (Creighton University),169
Agrawal Yuri (Johns Hopkins University),5
Agudelo Marisela (Florida International University),40
Aguiniga Lizath Monserrath (Northwestern University At Chicago),9
Aguirre Adan A (State University New York Stony Brook),7
Aguirre-Ghiso Julio A (Icahn School Of Medicine At Mount Sinai),62
Agwu Allison L (Johns Hopkins University),5
Ahern Christopher A (University Of Iowa),26
Aherne Carol (University Of Colorado Denver),19
Ahmad Aftab (University Of Alabama At Birmingham),59
Ahmad Nihal (University Of Wisconsin-Madison),111
Ahmad Shama (University Of Alabama At Birmingham),22
Ahmad Zahid (Ut Southwestern Medical Center),20
Ahmed Atique (Northwestern University At Chicago),37
Ahmed Rafi (Emory University),109
Ahmed Yasmath (Dartmouth College),103
Ahmed Zubair M (University Of Maryland Baltimore),107
Ahmer Brian M (Ohio State University),12
Ahn Danielle (Columbia University Health Sciences),18
Ahn Jinwoo (University Of Pittsburgh At Pittsburgh),63
Ahn Jiyoung (New York University School Of Medicine),77
Ahrens Eric T (University Of California San Diego),12
Ahsan Habibul (University Of Chicago),144
Ahuja Nita (Johns Hopkins University),88
Ai Xun (Rush University Medical Center),21
Aifantis Iannis (New York University School Of Medicine),154
Aihara Hideki (University Of Minnesota),23
Aikhionbare Felix O (Morehouse School Of Medicine),17
Ailawadi Gorav (University Of Virginia),35
Ailion Michael (University Of Washington),16
Airan Raag D (Stanford University),5
Airik Rannar (University Of Pittsburgh At Pittsburgh),104
Aisen Paul S (University Of Southern California),46
Aizenman Carlos D (Brown University),6
Aizenman Elias (University Of Pittsburgh At Pittsburgh),25
Aizenstein Howard J (University Of Pittsburgh At Pittsburgh),18
Ajijola Olujimi A (University Of California Los Angeles),13
Ajilore Olusola (University Of Illinois At Chicago),7
Ajit Seena (Drexel University),29
Akabas Myles H (Albert Einstein College Of Medicine),10
Akbarali Hamid I (Virginia Commonwealth University),37
Akbari Omid (University Of Southern California),39
Akbarian Schahram (Icahn School Of Medicine At Mount Sinai),107
Akey Christopher W (Boston University Medical Campus),8
Akhirome Ehiole Ogboma (Washington University),5
Akhtar Rizwan Smeer (University Of Pennsylvania),10
Akhurst Rosemary J (University Of California),35
Akil Huda (University Of Michigan),107
Akimzhanov Askar (University Of Texas Hlth Sci Ctr Houston),12
Akk Gustav (Washington University),21
Aksoy Serap (Yale University),16
Akuthota Praveen (University Of California San Diego),15
Akyuz Nurunisa (Harvard Medical School),8
Al'Absi Mustafa N (University Of Minnesota),7
Al-Awqati Qais (Columbia University Health Sciences),28
Al-Bataineh Mohammad (University Of Pittsburgh At Pittsburgh),19
Al-Harthi Lena (Rush University Medical Center),51
Al-Hashimi Hashim M (Duke University),12
Al-Hendy Ayman (Augusta University),106
Al-Ramahi Ismael (Baylor College Of Medicine),31
Alaedini Armin (Columbia University Health Sciences),24
Alagesan Brinda (State University New York Stony Brook),11
Alam Hasan B (University Of Michigan),70
Alam M Ashfaqul (Emory University),102
Alarcon Vernadeth B (University Of Hawaii At Manoa),43
Albanesi Joseph P (Ut Southwestern Medical Center),21
Albeck John G (University Of California At Davis),24
Albers Gregory W (Stanford University),27
Albert Jeffrey M (Case Western Reserve University),26
Albert Marilyn S (Johns Hopkins University),72
Alberts David S (University Of Arizona),53
Alberts Steven R (Mayo Clinic Rochester),31
Albin Roger L (University Of Michigan),95
Albrecht Eugene D (University Of Maryland Baltimore),24
Albrecht Jeffrey H (University Of Minnesota),29
Alcorn John F (University Of Pittsburgh At Pittsburgh),50
Alder Janet (Rbhs-Robert Wood Johnson Medical School),15
Aldhamen Yasser (Michigan State University),21
Aldred Micheala A (Cleveland Clinic Lerner Com-Cwru),40
Aldrich Melinda (Vanderbilt University),121
Aldrich Melissa B (University Of Texas Hlth Sci Ctr Houston),13
Aldrovandi Grace M (University Of California Los Angeles),27
Alegre Maria-Luisa (University Of Chicago),73
Alejandro Emilyn (University Of Minnesota),20
Alessio Adam M (University Of Washington),5
Alexander Barbara D (Duke University),29
Alexander C M (University Of Wisconsin-Madison),69
Alexander Ryan K (Harvard Medical School),7
Alexander-Brett Jennifer (Washington University),12
Alexandropoulos Konstantina (Icahn School Of Medicine At Mount Sinai),27
Alexandrov Andrei (Yale University),30
Alexandrova Evguenia (State University New York Stony Brook),20
Alexeyev Mikhail F (University Of South Alabama),17
Alexopoulos George S (Weill Medical Coll Of Cornell Univ),9
Ali Moiez (Duke University),5
Ali Syed Rydwan (Yale University),281
Alizad Azra (Mayo Clinic Rochester),5
Alkayed Nabil J (Oregon Health & Science University),52
Alkema Mark (Univ Of Massachusetts Med Sch Worcester),10
Allan Andrea M (University Of New Mexico Health Scis Ctr),47
Alland David (Rbhs-New Jersey Medical School),14
Allayee Hooman (University Of Southern California),148
Allen Benjamin (University Of Michigan),51
Allen David B (University Of Wisconsin-Madison),11
Allen Lee-Ann H (University Of Iowa),53
Alli Elizabeth (Wake Forest University Health Sciences),11
Allie S Rameeza (University Of Alabama At Birmingham),9
Allison Kelly C (University Of Pennsylvania),7
Allison Matthew A (University Of California San Diego),84
Allman David M (University Of Pennsylvania),11
Almaca Joana (University Of Miami School Of Medicine),16
Almasan Alexandru (Cleveland Clinic Lerner Com-Cwru),141
Almo Steven C (Albert Einstein College Of Medicine),100
Alnemri Emad S (Thomas Jefferson University),139
Aloman Costica (Rush University Medical Center),24
Alonso Laura C (Univ Of Massachusetts Med Sch Worcester),25
Alonzo Francis (Loyola University Chicago),19
Alosco Michael (Boston University Medical Campus),12
Alpini Gianfranco D (Texas A&M University Health Science Ctr),7
Alrefai Waddah A (University Of Illinois At Chicago),62
Alspaugh Andrew (Duke University),13
Altaweel Michael M (University Of Wisconsin-Madison),16
Altemeier William A (University Of Washington),64
Altman Molly K (Vanderbilt University),13
Altunbas Cem (University Of Colorado Denver),6
Alvarado Gabriela (Vanderbilt University),10
Alvarez Diego F (University Of South Alabama),19
Alvarez Francisco J (Emory University),29
Alvarez James V (Duke University),32
Alvarez-Buylla Arturo (University Of California),75
Alverdy John C (University Of Chicago),16
Amadio Peter C (Mayo Clinic Rochester),29
Amann Markus (University Of Utah),17
Amans Matthew (University Of California),11
Amar Salomon (New York Medical College),47
Amara Rama Rao (Emory University),27
Amaral David G (University Of California At Davis),41
Amarasinghe Gaya K (Washington University),35
Amaravadi Ravi K (University Of Pennsylvania),82
Amaro Rommie E (University Of California San Diego),23
Ambalavanan Namasivayam (University Of Alabama At Birmingham),111
Ambati Balamurali K (University Of Utah),56
Ambati Jayakrishna (University Of Virginia),55
Ambros Victor (Univ Of Massachusetts Med Sch Worcester),10
Ambrose Zandrea (University Of Pittsburgh At Pittsburgh),8
Ambrosio Fabrisia (University Of Pittsburgh At Pittsburgh),10
Ameen Nadia A (Yale University),19
Amer Amal O (Ohio State University),111
Ameredes Bill T (University Of Texas Med Br Galveston),25
Amieva Manuel R (Stanford University),16
Amor-Coarasa Alejandro (Weill Medical Coll Of Cornell Univ),8
Amory John K (University Of Washington),31
Amos Christopher I (Dartmouth College),121
Amstadter Ananda B (Virginia Commonwealth University),14
Amundsen Cindy (Duke University),6
An Gary (University Of Chicago),20
An Hongyu (Washington University),9
An Woojin (University Of Southern California),59
Anaclet Christelle (Univ Of Massachusetts Med Sch Worcester),5
Anand Amit (Cleveland Clinic Lerner Com-Cwru),23
Anand Shuchi (Stanford University),8
Anand Sudarshan (Oregon Health & Science University),43
Anand-Apte Bela (Cleveland Clinic Lerner Com-Cwru),52
Anandasabapathy Sharmila (Baylor College Of Medicine),10
Anania Frank A (Emory University),131
Anant Shrikant (University Of Kansas Medical Center),130
Anantharam Arun (University Of Michigan),14
Anastasio Noelle C (University Of Texas Med Br Galveston),9
Anathy Vikas (University Of Vermont & St Agric College),38
Ances Beau M (Washington University),8
Andersen Bogi (University Of California-Irvine),42
Andersen Olaf S (Weill Medical Coll Of Cornell Univ),14
Anderson Albert (Emory University),7
Anderson Amanda Hyre (University Of Pennsylvania),9
Anderson Ariana (University Of California Los Angeles),5
Anderson Carolyn J (University Of Pittsburgh At Pittsburgh),29
Anderson Courtney (Brown University),14
Anderson Deborah J (Boston University Medical Campus),22
Anderson Grace R (Duke University),11
Anderson Jean (Johns Hopkins University),8
Anderson Karen S (Yale University),95
Anderson Mark E (Johns Hopkins University),87
Anderson Mark S (University Of California),61
Anderson Melissa Lee (Univ Of Massachusetts Med Sch Worcester),5
Anderson Michael G (University Of Iowa),28
Anderson Richard A (University Of Wisconsin-Madison),260
Anderson Robert E (University Of Oklahoma Hlth Sciences Ctr),59
Anderst William J (University Of Pittsburgh At Pittsburgh),6
Andes David R (University Of Wisconsin-Madison),21
Andino Raul (University Of California),19
Andley Usha P (Washington University),105
Andor Noemi (Stanford University),8
Andrabi Shaida A (University Of Alabama At Birmingham),22
Andrade Felipe (Johns Hopkins University),23
Andrade Rodrigo (Wayne State University),36
Andrade Rosa M (University Of California-Irvine),14
Andreasson Katrin I (Stanford University),22
Andres Sarah (University Of Pennsylvania),66
Andrew Deborah J (Johns Hopkins University),12
Andrews Jared (Washington University),6
Andrews Philip C (University Of Michigan),38
Andrews-Polymenis Helene L (Texas A&M University Health Science Ctr),10
Andriole Gerald Louis (Washington University),36
Androphy Elliot J (Indiana Univ-Purdue Univ At Indianapolis),45
Angelos Mathew (University Of Minnesota),11
Annex Brian H (University Of Virginia),57
Anokhin Andrey P (Washington University),5
Anrather Josef (Weill Medical Coll Of Cornell Univ),53
Ansari Sameer A (Northwestern University At Chicago),8
Anstrom Kevin J (Duke University),27
Antalis Toni M (University Of Maryland Baltimore),31
Antic Srdjan D (University Of Connecticut Sch Of Med/Dnt),16
Anticevic Alan (Yale University),7
Anton Raymond F (Medical University Of South Carolina),34
Anton Stephen D (University Of Florida),15
Antonellis Anthony (University Of Michigan),69
Antonetti David (University Of Michigan),38
Anumonwo Justus M (University Of Michigan),9
Anwar Talha (University Of Michigan),10
Aoto Jason (University Of Colorado Denver),18
Apetrei Cristian (University Of Pittsburgh At Pittsburgh),41
Aplin Andrew E (Thomas Jefferson University),75
Apodaca Gerard L (University Of Pittsburgh At Pittsburgh),7
Apostolova Liana G (Indiana Univ-Purdue Univ At Indianapolis),89
Appel Bruce H (University Of Colorado Denver),39
Appelhans Bradley M (Rush University Medical Center),6
Appleyard Caroline B (Ponce School Of Medicine),31
Apte Rajendra S (Washington University),47
Apte Suneel S (Cleveland Clinic Lerner Com-Cwru),80
Apte Udayan (University Of Kansas Medical Center),68
Apter Andrea J (University Of Pennsylvania),14
Arac-Ozkan Demet (University Of Chicago),30
Arancio Ottavio (Columbia University Health Sciences),92
Arany Zoltan P (University Of Pennsylvania),8
Araque Alfonso (University Of Minnesota),12
Arbelaez Ana Maria (Washington University),6
Arbiser Jack L (Emory University),132
Archin Nancie M (Univ Of North Carolina Chapel Hill),21
Ardehali Hossein (Northwestern University At Chicago),58
Ardeljan Daniel (Johns Hopkins University),16
Ardell Jeffrey L (University Of California Los Angeles),19
Area Gomez Estela (Columbia University Health Sciences),14
Arean Patricia A (University Of Washington),9
Arenkiel Benjamin R (Baylor College Of Medicine),33
Arens Raanan (Albert Einstein College Of Medicine),17
Arikkath Jyothi (University Of Nebraska Medical Center),17
Arkin Michelle R (University Of California),41
Arking Dan E (Johns Hopkins University),271
Arlt Martin F (University Of Michigan),15
Armato Samuel G (University Of Chicago),7
Armstead William M (University Of Pennsylvania),12
Armstrong William E (University Of Tennessee Health Sci Ctr),12
Arnaout Rima (University Of California),9
Arnold L Eugene (Ohio State University),21
Arnold William D (Ohio State University),6
Arnsten Amy F T (Yale University),20
Aroian Raffi V (Univ Of Massachusetts Med Sch Worcester),18
Aronin Neil (Univ Of Massachusetts Med Sch Worcester),45
Aronoff David M (Vanderbilt University),55
Aronoff-Spencer Eliah S (University Of California San Diego),6
Aronowski Jaroslaw (University Of Texas Hlth Sci Ctr Houston),38
Aronson Peter S (Yale University),30
Arora Manish (Icahn School Of Medicine At Mount Sinai),12
Arora Rishi (Northwestern University At Chicago),19
Arora Vineet (University Of Chicago),6
Aroumougame Asaithamby (Ut Southwestern Medical Center),34
Arpaia Nicholas (Columbia University Health Sciences),11
Arribere Joshua (Stanford University),5
Arshavsky Vadim Y (Duke University),25
Artandi Steven E (Stanford University),28
Arteaga Carlos L (Ut Southwestern Medical Center),130
Arteaga-Solis Emilio (Columbia University Health Sciences),12
Arteel Gavin E (University Of Louisville),47
Artemov Dmitri (Johns Hopkins University),17
Artemyev Nikolai O (University Of Iowa),29
Arthur Janelle C (Univ Of North Carolina Chapel Hill),23
Arthur John M (Univ Of Arkansas For Med Scis),31
Artis David (Weill Medical Coll Of Cornell Univ),92
Arvan Peter (University Of Michigan),57
Arvanitakis Zoe (Rush University Medical Center),11
Arvin Ann (Stanford University),47
Arya Shipra (Emory University),6
Asahina Kinji (University Of Southern California),62
Asakura Atsushi (University Of Minnesota),36
Asangani Irfan Ahmed (University Of Pennsylvania),5
Asano Eishi (Wayne State University),18
Asbell Penny (Icahn School Of Medicine At Mount Sinai),18
Asbury Charles (University Of Washington),14
Ascano Manuel (Vanderbilt University),21
Asch David A (University Of Pennsylvania),14
Ascherman Dana P (University Of Miami School Of Medicine),20
Aschner Michael (Albert Einstein College Of Medicine),123
Ash John D (University Of Florida),48
Ashare Alix (Dartmouth College),9
Ashare Rebecca (University Of Pennsylvania),9
Ashikaga Hiroshi (Johns Hopkins University),6
Ashley Euan A (Stanford University),78
Ashley-Koch Allison E (Duke University),113
Ashraf Muhammad (University Of Illinois At Chicago),176
Ashrafi Kaveh (University Of California),16
Ashtari Manzar (University Of Pennsylvania),5
Ashwood Paul (University Of California At Davis),53
Ashworth Alan (University Of California),374
Askew David S (University Of Cincinnati),10
Askwith Candice C (Ohio State University),18
Aslanidi George V (University Of Florida),7
Asokan Aravind (Univ Of North Carolina Chapel Hill),19
Aspinwall Craig A (University Of Arizona),8
Assis David (Yale University),8
Assoian Richard (University Of Pennsylvania),35
Asthana Sanjay (University Of Wisconsin-Madison),119
Astor Brad C (University Of Wisconsin-Madison),62
Astrof Sophie (Thomas Jefferson University),15
Asturias Francisco J (University Of Colorado Denver),15
Atabai Kamran (University Of California),30
Ataga Kenneth I (Univ Of North Carolina Chapel Hill),36
Atala Anthony (Wake Forest University Health Sciences),161
Atallah Ehab L (Medical College Of Wisconsin),5
Atamas Sergei P (University Of Maryland Baltimore),65
Atasoy Ulus (University Of Missouri-Columbia),30
Atfi Azeddine (University Of Mississippi Med Ctr),63
Athar Mohammad (University Of Alabama At Birmingham),126
Atkins Coleen M (University Of Miami School Of Medicine),25
Atkinson David (Boston University Medical Campus),29
Atkinson Jeffrey J (Washington University),36
Atkinson John (Washington University),89
Atkinson Mark A (University Of Florida),100
Atluri Pavan (University Of Pennsylvania),22
Atmar Robert L (Baylor College Of Medicine),29
Atreja Ashish (Icahn School Of Medicine At Mount Sinai),6
Atreya Chloe E (University Of California),12
Attardi Laura D (Stanford University),119
Atwood Walter J (Brown University),11
Atz Andrew M (Medical University Of South Carolina),15
Au David H (University Of Washington),7
Au Kin Fai (University Of Iowa),23
Au Kit Sing (University Of Texas Hlth Sci Ctr Houston),43
Au Rhoda (Boston University Medical Campus),52
Aubrecht Taryn G (University Of Maryland Baltimore),13
Auchampach John A (Medical College Of Wisconsin),22
Auchus Richard J (University Of Michigan),83
Audhya Anjon (University Of Wisconsin-Madison),66
Aufderheide Tom Paul (Medical College Of Wisconsin),6
Augenlicht Leonard H (Albert Einstein College Of Medicine),76
Aune Thomas M (Vanderbilt University),38
Aurora Rajeev (Saint Louis University),20
Austin Christine (Icahn School Of Medicine At Mount Sinai),7
Avantaggiati Maria L (Georgetown University),9
Avery Stephen (University Of Pennsylvania),13
Avis Nancy E (Wake Forest University Health Sciences),5
Aviv Abraham (Rbhs-New Jersey Medical School),24
Avram Dorina (University Of Florida),44
Avramopoulos Dimitrios (Johns Hopkins University),80
Awad Hani A (University Of Rochester),39
Axelrod Jeffrey D (Stanford University),38
Axthelm Michael K (Oregon Health & Science University),25
Ayad Nagi G (University Of Miami School Of Medicine),29
Ayers Leona W (Ohio State University),29
Ayyagari Radha (University Of California San Diego),83
Azad Abdu F (University Of Maryland Baltimore),8
Azar Dimitri T (University Of Illinois At Chicago),40
Azhar Mohamad (University Of South Carolina At Columbia),26
Azhdarinia Ali (University Of Texas Hlth Sci Ctr Houston),12
Baar Keith (University Of California At Davis),67
Baas Peter W (Drexel University),35
Baba Kenkichi (Morehouse School Of Medicine),30
Baba Shahid P (University Of Louisville),10
Babb Tony G (Ut Southwestern Medical Center),5
Babich John W (Weill Medical Coll Of Cornell Univ),18
Babulal Ganesh (Washington University),5
Babushok Daria (University Of Pennsylvania),31
Baccei Mark L (University Of Cincinnati),18
Bacchetta Rosa (Stanford University),53
Bach Erika A (New York University School Of Medicine),24
Bacharier Leonard B (Washington University),30
Bachmann Brian O (Vanderbilt University),10
Bachschmid Markus Michael (Boston University Medical Campus),6
Bachstetter Adam D (University Of Kentucky),26
Backer Jonathan M (Albert Einstein College Of Medicine),153
Backes Wayne L (Lsu Health Sciences Center New Orleans),11
Bada Henrietta S (University Of Kentucky),19
Badea Alexandra (Duke University),22
Bader David M (Vanderbilt University),26
Badley Andrew D (Mayo Clinic Rochester),59
Badovinac Vladimir P (University Of Iowa),34
Badr M Safwan (Wayne State University),6
Badve Sunil S (Indiana Univ-Purdue Univ At Indianapolis),33
Badylak Stephen F (University Of Pittsburgh At Pittsburgh),47
Bae Taeok (Indiana Univ-Purdue Univ At Indianapolis),7
Bae Won C (University Of California San Diego),8
Bae-Jump Victoria Lin (Univ Of North Carolina Chapel Hill),10
Baehr Wolfgang (University Of Utah),87
Baehrecke Eric H (Univ Of Massachusetts Med Sch Worcester),105
Baeten Jared (University Of Washington),27
Bagiella Emilia (Icahn School Of Medicine At Mount Sinai),38
Bagnall Martha W (Washington University),5
Bagnat Michel (Duke University),15
Bagriantsev Sviatoslav (Yale University),21
Bahar Ivet (University Of Pittsburgh At Pittsburgh),61
Bahou Wadie F (State University New York Stony Brook),32
Bahrami Hossein (University Of Southern California),22
Bai Xiaowen (Medical College Of Wisconsin),41
Bai Xiaoying (Ut Southwestern Medical Center),5
Bai Yidong (University Of Texas Hsc San Antonio),24
Baidal David (University Of Miami School Of Medicine),14
Bailey Howard H (University Of Wisconsin-Madison),23
Bailey Kent R (Mayo Clinic Rochester),112
Bailey Kristina L (University Of Nebraska Medical Center),23
Bailey Rachel M (Univ Of North Carolina Chapel Hill),11
Bailey Stefanie (Medical University Of South Carolina),24
Bajaj Jasmohan S (Virginia Commonwealth University),25
Bajwa Amandeep (University Of Virginia),33
Baker Brendon M (University Of Michigan),5
Baker Christopher D (University Of Colorado Denver),5
Baker Darren (Mayo Clinic Rochester),111
Baker David (University Of Washington),255
Baker Jessica (University Of Tennessee Health Sci Ctr),34
Baker Jessica H (Univ Of North Carolina Chapel Hill),18
Baker Julie C (Stanford University),31
Baker Laura D (Wake Forest University Health Sciences),12
Baker Linda A (Ut Southwestern Medical Center),30
Baker Nicholas E (Albert Einstein College Of Medicine),20
Baker Sheila A (University Of Iowa),30
Baker Susan C (Loyola University Chicago),32
Bakkenist Christopher J (University Of Pittsburgh At Pittsburgh),45
Bakkum-Gamez Jamie N (Mayo Clinic Rochester),36
Bakshi Chandra Shekhar (New York Medical College),12
Balasubramanyam Ashok (Baylor College Of Medicine),111
