Pathway,Count
Circrna Gallbladder Compared Matched GSE100363 1,250
Inversion Ctcf Alters Topology GSE71275 1,250
Ar-Wt Ligand-Independent Ar-V7 Splice GSE71334 1,250
Ehmt1 Ehmt2 Fetal Hemoglobin GSE71421 1,250
Prolyl Hydroxylation Synthesis Cardiomyocytes GSE71560 1,250
Fus Sequencing Anti-Fus Immunoprecipitation GSE71812 1,250
Gata3-Mediated Chromatin Reprogramming Breast GSE72141 1,250
Ro60 Autoantigen Binds Retroelements GSE72420 1,250
Moderate Dysplasia Mucosa Conversion GSE72627 1,250
H3K4 Reinforcement Activation-Induced Kinetics GSE73213 1,250
4H Il-1B Stimulation Chondrocytes GSE74220 1,250
Sequence Extracts Differentiated Podocytes GSE129666 1,250
Segregates X-Linked Intellectual Disability GSE74263 1,250
Xx-650-23 Creb-Cbp Interaction Myeloid GSE74928 1,250
Rna-Seq Analysis Arid1B Overexpression GSE75291 1,250
Unfolded Matrix Pre-Rna Processing GSE75410 1,250
Igf1 Contractility Single-Suture Craniosynostosis GSE75524 1,250
Satb2 Increased Anchorage-Independent Bronchial GSE75652 1,250
Estrogen Receptor Coregulator Modulators GSE75664 1,250
Generated H2O2 Hct116 Untreated GSE75962 1,250
Modeling Gata6 Haploinsufficiency Development GSE76025 1,250
Recapitulate Predilection Doxorubicin-Induced Cardiotoxicity GSE76314 1,250
Mettl3 Promotes Carcinogenesis Colorectal GSE130012 1,250
Mbnl1-Dependent Modulation Mda-Mb-231 Breast GSE76487 1,250
Methyltransferases Mll1 Cooperate Meningioma-1 GSE76747 1,250
Ints8 Cause Severe Neurodevelopmental GSE76878 1,250
Myocd Overexpression Hcasms GSE77120 1,250
Rescue Sumo Double Trim24 GSE77140 1,250
Arnica Montana Stimulates Wound-Healing GSE77382 1,250
Cd1C Encompass Cd5-High Cd5-Low GSE77649 1,250
Facilitates Quantitative Isl1 Regulated GSE77958 1,250
Multivalent Pwwp2A Z-Marked Organ GSE78003 1,250
Immunological Imbalance Fibrodysplasia Ossificans GSE78081 1,250
Enhancement Lymph Tlr9 Mgn1703 GSE130307 1,250
Effect Bb608 Hnscc Line GSE78178 1,250
Rna Sequencing Sisnrnp40 Breast GSE78527 1,250
Knockdown Adnp Hct116 Colon GSE79395 1,250
Bronchoalveolar Lavage M1 Radical GSE79544 1,250
Aberrant Alternative Huntington Disease GSE79666 1,250
Hek293 Heat-Shock Experiment GSE79680 1,250
Crebbp Results Repression Lymphoma GSE79684 1,250
Nkx2 Knockdown Pancreatic Islets GSE79724 1,250
Crig Phagocytic Cirrhosis Ascites GSE79833 1,250
Thz1 Cdk7 Stat Bcl2 GSE79955 1,250
Transcriptome-Wide Wild-Type Srsf3-Knockout Stem-Like GSE130501 1,250
Mononuclear Expression-Based Biomarkers Jia GSE79970 1,250
Dorsal Striatum Bipolar Disorder GSE80336 1,250
Messenger Mk2206 Dmso T47D GSE80591 1,250
Gene Expression Brafv600E Thyrocyte GSE81144 1,250
Methyltransferase Mettl14 Growth Progression GSE81164 1,250
Hesc Samples Loss Upf1 GSE81214 1,250
Microrna-28 Replacement Non-Hodgkin Lymphoma GSE81236 1,250
Monocyte Jia Poor Methotrexate GSE81259 1,250
Genome Contacts Lamin-Genome Implications GSE81671 1,250
Facilitates Patient Glioblastoma Gbm GSE82183 1,250
Hek 293 Quinolinol B23 GSE130876 1,250
Stroma Suppresses Mechanosensitive Jmjd1A-Mediated GSE83314 1,250
Dysregulated War Veterans Ptsd GSE83601 1,250
Validation Formalin-Fixed Paraffin-Embedded Ffpe GSE83717 1,250
Hnrnpa1 U2Af2 Association Alu-Derived GSE83923 1,250
Systems Kshv Reliance Peroxisome GSE84237 1,250
Kdm1A Induce Unfolded Upr GSE84603 1,250
Bcl11B T-Cell Lymphoblastic T-All GSE84675 1,250
Melanocytes Driven Cell-Derived Exosomes GSE84683 1,250
Exposed Lead Pb Associations GSE84712 1,250
Mesothelial-To-Mesenchymal Ascitic Fluid-Isolated Mesothelial GSE84829 1,250
Hairpin Binder Trim71 Mbnl1 GSE130898 1,250
Data Whsc1 Sirna Pc3 GSE84868 1,250
Astrocyte Following Borrelia Burgdorferi GSE85143 1,250
Discovering Mir-26A Targetome Prostate GSE85306 1,250
Dysregulated Vzv-Induced Cell-Cell Fusion GSE85493 1,250
Genomic Landscape Atypical Fibroxanthoma GSE85671 1,250
Molecular Renal Unclassfied Histology GSE85897 1,250
Vhl Deficiency Oncogenes Clear GSE86095 1,250
Tumour Growth Non-Coding Ghsros GSE86097 1,250
Erg Xenografts Molecule Yk-4-279 GSE86387 1,250
Microrna Sphk1 Papillary Thyroid GSE87307 1,250
Effects Chemokines Ccl2 Mda-Mb-231-Foxc1 GSE131383 1,250
Circuits Nek6 Transformed Super-Enhancer-Independent GSE87320 1,250
Systematic Driving Gbm Invasion GSE87535 1,250
Associate Fibroblasts Large Oncosomes GSE87563 1,250
Affecting Factors Stromal Endometriosis GSE87809 1,250
Monocyte Clinical Course Parkinson GSE88888 1,250
Screening Predicts Tyrosine Cardiotoxicity GSE88944 1,250
Sox5 Overexpressing Neuronal Progenitors GSE89057 1,250
Ddx54 Dynamics Damage 4Su-Seq GSE89365 1,250
Ddx54 Dynamics Damage Rna-Seq2 GSE89368 1,250
Natural Killer Phenotypes H3K27 GSE89484 1,250
Pegivirus Liver Transplantation Recipients GSE131504 1,250
Hues8 Tet1 Tko Hescs GSE89726 1,250
Identifying Deer Antler Mineralization GSE89796 1,250
Crebbp Clones U2932 Dlbcl GSE89879 1,250
Hbec-Shp53-Pchd7 GSE90013 1,250
Markers Screenedina Cell-Based Validated GSE90133 1,250
Bromodomain Brd4 Repressor Lysosomal GSE90444 1,250
Yeats2 Links Acetylation Non-Small GSE90781 1,250
Klf4 Overexpression Umbilical Vein GSE90982 1,250
Cystathionine-Β-Synthase Promotes Colon Carcinogenesis GSE91000 1,250
Virus-Like Sarcoma-Associated Lytic Triggering GSE91384 1,250
Mboat7 Clear Renal Ccrcc GSE131881 1,250
Knocking Ezh2 Tamr Mcf7L GSE92316 1,250
Profiling Kshv-Infected Periodontal Ligament GSE92341 1,250
Dermal Endothelial Type Diabetic GSE92724 1,250
Agonistic Tlr1 Tlr2 Mapk-Dependent GSE92744 1,250
Crizotinib Dmso Sw480 Cells GSE93124 1,250
Extracted Cd33 Car Donors GSE93386 1,250
Containing Tp73-As1 Sponge Mir-941 GSE93716 1,250
Mir941 Overexpression Experiment GSE93717 1,250
Sictrl Sinsun2 Alyref-Rip Hela GSE93750 1,250
Utility Natural Beta Agonists GSE93807 1,250
Lps-Induced Changes Phraryngeal Epithelial GSE132019 1,250
Stranded Er Paired Adjacent GSE103001 1,250
Exploiting Prmt5-Orchestrated Intron Detention GSE93813 1,250
Gene Profile Crc-Derived Hilec GSE93904 1,250
Sister Nanog Expressed Pre-Implantation GSE94053 1,250
Single Diverse Idiopathic Pulmonary GSE94555 1,250
Psilac Spectrometry Zfp91 Imid GSE94728 1,250
Rna-Seq Hdac2-Disrupted 293Ft Crispr-Cas9 GSE94947 1,250
Normal Cardiac Fibroblast Halofuginone GSE95059 1,250
Priming Erα Ordered Cooperative GSE95122 1,250
Be1 Be2 Transcriptionally Distinct GSE95282 1,250
Kdm4 Inhibition Targets Breast GSE95293 1,250
A549 Rb1 Wild-Type Knockout GSE132722 1,250
Mrnaseq Huntington Ipsc-Derived Neural GSE95343 1,250
Icf-Specific Dnmt3B Interferes Intragenic GSE95743 1,250
Histone Deacetylases Hdac1 Decrotonylases GSE96035 1,250
Cdk9-Dependent Polymerase Pausing Initiation GSE96056 1,250
Scale Mirna Preterm Labor GSE96077 1,250
Scale Mirna Preterm Labor GSE96083 1,250
Mebendazole Thp-1 Paired Samples GSE96544 1,250
Rnaseq Il-36 Stimulated Keratinocytes GSE96601 1,250
Interferon Regulating Pd-L1 Pd-L2 GSE96619 1,250
Osteogenic Programming Fungal Metabolite GSE96788 1,250
B-Cell Temporal Cd40L Stimulation GSE132835 1,250
Differentiating Thp-1 Monocytes Macrophages GSE96800 1,250
Cd14 Imc Treated Tgf-Beta GSE96885 1,250
Cytomegalovirus Lytic H3K9 Demethylases GSE97041 1,250
Mrnaseq Huntington Ipsc-Derived Microvascular GSE97100 1,250
Overgrown Interscapular Biallelic Mfn2 GSE97156 1,250
High-Throughput Rna Bladder Tissues GSE97239 1,250
Rhinovirus Infection Stronger Baseline GSE97668 1,250
Lung Fibroblasts Exposed Tgf-Β GSE97829 1,250
Self-Organized Predict Drugs Combat GSE97919 1,250
Retinoic Myb Adenoid Cystic GSE98007 1,250
Effect Fibulin-3 Malignant Mesothelioma GSE133933 1,250
Adolescent Fatigue Syndrom Cfs GSE98139 1,250
Endoplasmic Reticulum Aggregation Amyloidgenic GSE98580 1,250
Bms-470539 Human Synovial Fibroblasts GSE98658 1,250
Defining Microrna-Mrna Calcineurin Nephrotoxicity GSE98670 1,250
Ewsr1 Influences Direct Indirect GSE98836 1,250
Anti-Inflammatory Indoleacrylic Acid Ia GSE98884 1,250
Cd141 Dendritic Synovial Fluid GSE98950 1,250
Activity-Regulated Neuroligin-3 Dependency High-Grade GSE99045 1,250
Dual Hdmx Hdm2 Strategy GSE99255 1,250
Separation Ligand-Activated Licenses Cooperative GSE99539 1,250
Pc-3 Sirna Sicont Siell2 GSE134214 1,250
Sirt7 Antagonizes Tgf-Β Inhibits GSE99596 1,250
Repression Dicer-Independent Trna Fragments GSE99769 1,250
Methyltransferases Antiviral Suppress Pathogens GSE99839 1,250
Digoxin Splice Stem Mesenchymal GSE99944 1,250
Characterization Chronic Myeloid Leukemia GSE100026 1,250
Characterization Chronic Myeloid Leukemia GSE100026 2,250
4Su-Seq Hff Salt Heat GSE100469 1,250
4Su-Seq Hff Salt Heat GSE100469 2,250
Trim24 Conjugation Ineffectual Vhl GSE100572 1,250
Trim24 Conjugation Ineffectual Vhl GSE100572 2,250
Pd-L1 Knock Mda-Mb231 Ct26 GSE134510 1,250
Coronary Artery Nitrated Fatty GSE100676 1,250
Coronary Artery Nitrated Fatty GSE100676 2,250
Health Donors Sle Pbmc GSE101437 1,250
Health Donors Sle Pbmc GSE101437 2,250
Cal-101 Akti Primed Traditionally GSE101497 1,250
Cal-101 Akti Primed Traditionally GSE101497 2,250
Jo-1 Inclusion Body Myositis GSE102138 1,250
Jo-1 Inclusion Body Myositis GSE102138 2,250
Hsaec Virulent Strains Rift GSE102481 1,250
Hsaec Virulent Strains Rift GSE102481 2,250
Cycle-Dependent Ythdf2 Entry Wee1 GSE134700 1,250
Epigenetics Bacterial Membrane Vesicles GSE102923 1,250
Epigenetics Bacterial Membrane Vesicles GSE102923 2,250
Folate Chromosomal Instability Higher GSE103044 1,250
Folate Chromosomal Instability Higher GSE103044 2,250
Transcriptional Regulation Myt1 Myt1L GSE103790 1,250
Transcriptional Regulation Myt1 Myt1L GSE103790 2,250
Il-27 Osteolysis E-Blended Ultra-High GSE104589 1,250
Il-27 Osteolysis E-Blended Ultra-High GSE104589 2,250
Early-Stage Escc Non-Malignant Esophagitis GSE104926 1,250
Early-Stage Escc Non-Malignant Esophagitis GSE104926 2,250
H1 Derived Cd31 Hand1-Overexpression GSE134906 1,250
G-Quadruplexes Upstream Reading Frames GSE105082 1,250
G-Quadruplexes Upstream Reading Frames GSE105082 2,250
Mrnas Lncrnas Eosinophilic Asthmatics GSE106230 1,250
Mrnas Lncrnas Eosinophilic Asthmatics GSE106230 2,250
Mid-Secretory Endometrium Paired-Sample Cohort GSE106602 1,250
Mid-Secretory Endometrium Paired-Sample Cohort GSE106602 2,250
Determining Collaborates Setting Therapy-Resistant GSE106694 1,250
Determining Collaborates Setting Therapy-Resistant GSE106694 2,250
Antibodies Convert Trafficking Microglia-Like GSE107006 1,250
Antibodies Convert Trafficking Microglia-Like GSE107006 2,250
H3K79Me2 Pan-Cancer Prom1 Cd133 GSE135023 1,250
Concomitant Bcorl1 Braf Vemurafenib-Resistant GSE107370 1,250
Concomitant Bcorl1 Braf Vemurafenib-Resistant GSE107370 2,250
Skeletal Divergent Exercise Stimuli GSE107934 1,250
Skeletal Divergent Exercise Stimuli GSE107934 2,250
Gspt1 Phenotypically Heterobifunctional Phthalimide GSE108763 1,250
Gspt1 Phenotypically Heterobifunctional Phthalimide GSE108763 2,250
Setmar Sequence-Specific Histone-Methylase Broad GSE108773 1,250
Setmar Sequence-Specific Histone-Methylase Broad GSE108773 2,250
Clk3-Hmga2 Identity Bm Low-Input GSE109090 1,250
Clk3-Hmga2 Identity Bm Low-Input GSE109090 2,250
Gliotoxin Aspergillus Fumigatus Metabolites GSE135184 1,250
Chlorinated Retardants Tris Phosphate GSE109463 1,250
Chlorinated Retardants Tris Phosphate GSE109463 2,250
Trimethylation 36 H3K36Me3 Guides GSE110323 1,250
Trimethylation 36 H3K36Me3 Guides GSE110323 2,250
Ex-Vivo Expansion Requires Coordination GSE110968 1,250
Ex-Vivo Expansion Requires Coordination GSE110968 2,250
Pd1-High Pd1-Intermediate Pd1-Negative Tumor-Infiltrating GSE111389 1,250
Pd1-High Pd1-Intermediate Pd1-Negative Tumor-Infiltrating GSE111389 2,250
Screening Requirement Mevalonate Cardiomyocyte GSE111853 1,250
Screening Requirement Mevalonate Cardiomyocyte GSE111853 2,250
Noncoding Mrnas A549 Influenza GSE135482 1,250
Live Erythroblasts Trcn0000005418 Riok3 GSE103122 1,250
Gene Panc1 Treated Rakicidin GSE112058 1,250
Gene Panc1 Treated Rakicidin GSE112058 2,250
Leukaemic Ikzf1 Primes Malignancy GSE112124 1,250
Leukaemic Ikzf1 Primes Malignancy GSE112124 2,250
Xbp1S Globally N-Glycan Distribution GSE112589 1,250
Xbp1S Globally N-Glycan Distribution GSE112589 2,250
Hyperfractionated Irradiation Hfrt Preps GSE112686 1,250
Hyperfractionated Irradiation Hfrt Preps GSE112686 2,250
Fry Breast Malignancy Tumor-Suppressive GSE112910 1,250
Fry Breast Malignancy Tumor-Suppressive GSE112910 2,250
Mbnl2 Knockdown Hypoxic Breast GSE136231 1,250
Endogenous Ddx5 Coactivator Fra-1 GSE112962 1,250
Endogenous Ddx5 Coactivator Fra-1 GSE112962 2,250
Targeting Jnk Expands Hematopoietic GSE114524 1,250
Targeting Jnk Expands Hematopoietic GSE114524 2,250
Factors Jointly Regulate Epidermal GSE114529 1,250
Factors Jointly Regulate Epidermal GSE114529 2,250
Disruption Grin2B Impairs Neurons GSE114685 1,250
Disruption Grin2B Impairs Neurons GSE114685 2,250
Change Thp-1 Hsv-1Ul37Wt Hsv-1Ul37C819S GSE114966 1,250
Change Thp-1 Hsv-1Ul37Wt Hsv-1Ul37C819S GSE114966 2,250
Epo Progenitor Erythroid Hbbp1 GSE136235 1,250
Non-Inflammatory Diffuse Pontine Dipg GSE115397 1,250
Non-Inflammatory Diffuse Pontine Dipg GSE115397 2,250
Coordinate Chaperone Hnrnpa1 Ddx5 GSE115442 1,250
Coordinate Chaperone Hnrnpa1 Ddx5 GSE115442 2,250
Group Medulloblastoma Orthotopic Digoxin GSE115542 1,250
Group Medulloblastoma Orthotopic Digoxin GSE115542 2,250
Spatially Constrained Bolsters Sustained GSE115550 1,250
Spatially Constrained Bolsters Sustained GSE115550 2,250
Mst1 Foxo1 Umbilical Vein GSE116033 1,250
Mst1 Foxo1 Umbilical Vein GSE116033 2,250
Deep Gsk-126 Her2 Tumours GSE136300 1,250
Lymphoblastoid Ahr Ligand Treatments GSE116637 1,250
Lymphoblastoid Ahr Ligand Treatments GSE116637 2,250
Metallo-Endopeptidase Neprilysin White Preadipocytes GSE117270 1,250
Metallo-Endopeptidase Neprilysin White Preadipocytes GSE117270 2,250
Systems-Level Astrocytoma Resveratrol Delaying GSE117620 1,250
Systems-Level Astrocytoma Resveratrol Delaying GSE117620 2,250
Intestinal Organoids Following Norovirus GSE117911 1,250
Intestinal Organoids Following Norovirus GSE117911 2,250
Facilities Kmst6 Aug-Initiated C-Myc GSE118113 1,250
Facilities Kmst6 Aug-Initiated C-Myc GSE118113 2,250
Cytokines Β-Cell Provides Genetics GSE137136 1,250
Dic Q10 P10 Therapy-Related GSE118476 1,250
Dic Q10 P10 Therapy-Related GSE118476 2,250
U2Os Lines Transfected Microrna-571 GSE118998 1,250
U2Os Lines Transfected Microrna-571 GSE118998 2,250
Functional Slit2 Robo1 Trophoblasts GSE119101 1,250
Functional Slit2 Robo1 Trophoblasts GSE119101 2,250
Dux4-Induced H3 Mark Dux4 GSE119402 1,250
Dux4-Induced H3 Mark Dux4 GSE119402 2,250
Differential Peripheral Cervical Lesions GSE120691 1,250
Differential Peripheral Cervical Lesions GSE120691 2,250
Neutrophil Filifactor Alocis Challenge GSE137351 1,250
Survey Rearrangements Bcl2L14-Etv6 Fusions GSE120919 1,250
Survey Rearrangements Bcl2L14-Etv6 Fusions GSE120919 2,250
Flt3-Itd Flt3 Inhibitors Hours GSE121272 1,250
Flt3-Itd Flt3 Inhibitors Hours GSE121272 2,250
Epidermal Activates Β-Catenin Integrin-Linked GSE121697 1,250
Epidermal Activates Β-Catenin Integrin-Linked GSE121697 2,250
Spatial Clustering Lead Concerted GSE122093 1,250
Spatial Clustering Lead Concerted GSE122093 2,250
Anaphase-Promoting Complex-Dependent Control Identity GSE122298 1,250
Anaphase-Promoting Complex-Dependent Control Identity GSE122298 2,250
Precede Neuronal Pathology Cln3-Juvenile GSE137420 1,250
Smarca2 Lead Retargeting Smarca4 GSE122631 1,250
Smarca2 Lead Retargeting Smarca4 GSE122631 2,250
Convergence Cockayne Rrna Nucleolin GSE122736 1,250
Convergence Cockayne Rrna Nucleolin GSE122736 2,250
Cistromic Re-Programming Truncating Gata3 GSE122848 1,250
Cistromic Re-Programming Truncating Gata3 GSE122848 2,250
Cytokine Environment Influence Skin-Derived GSE123320 1,250
Cytokine Environment Influence Skin-Derived GSE123320 2,250
Beta-Catenin Ewing Angiogenic Switch GSE124523 1,250
Beta-Catenin Ewing Angiogenic Switch GSE124523 2,250
Glucocorticoids Paradoxically Steroid Ccrf-Cem GSE137893 1,250
Dhx9 Npm1 Silencing Rna-Seq GSE124626 1,250
Dhx9 Npm1 Silencing Rna-Seq GSE124626 2,250
Kras Wt G12D Overexpression GSE124627 1,250
Kras Wt G12D Overexpression GSE124627 2,250
Kimat1 Hif1A-As2 Silencing Rna-Seq GSE124628 1,250
Kimat1 Hif1A-As2 Silencing Rna-Seq GSE124628 2,250
Impact Erythroid Progenitor Differntiation GSE125196 1,250
Impact Erythroid Progenitor Differntiation GSE125196 2,250
Analysis Tr1 Tregs Il10Neg GSE125504 1,250
Analysis Tr1 Tregs Il10Neg GSE125504 2,250
Snhg12 Vein Ros Conditions GSE138219 1,250
Hif-1Α Pparα T3 Igf-1 GSE125862 1,250
Hif-1Α Pparα T3 Igf-1 GSE125862 2,250
Reconstruction Blood-Brain Apoe4 Pericytes GSE125869 1,250
Reconstruction Blood-Brain Apoe4 Pericytes GSE125869 2,250
Family Lmna-Related Implicated Pathogenesis GSE125990 1,250
Family Lmna-Related Implicated Pathogenesis GSE125990 2,250
Skeletal Controlling Body Humans GSE126101 1,250
Skeletal Controlling Body Humans GSE126101 2,250
Wdr5 Recruits Cohort Onset GSE126207 1,250
Wdr5 Recruits Cohort Onset GSE126207 2,250
Quantitative Transcriptomes Mtorc2-Suppressed Glioblastoma GSE138475 1,250
Receptors Coregulators Triple Negative GSE126276 1,250
Receptors Coregulators Triple Negative GSE126276 2,250
Myc-Associated Max Clock Network GSE127212 1,250
Myc-Associated Max Clock Network GSE127212 2,250
S6K2 Target Mapki-Resistant Nras-Mutant GSE127916 1,250
S6K2 Target Mapki-Resistant Nras-Mutant GSE127916 2,250
Food-Derived Apigenin Luteolin Introns GSE128097 1,250
Food-Derived Apigenin Luteolin Introns GSE128097 2,250
Bi-3406 Sos1 Effective Kras-Driven GSE128385 1,250
Bi-3406 Sos1 Effective Kras-Driven GSE128385 2,250
Visualization Accessible Cycle Post-Hdac GSE139253 1,250
Seq Pancreatic Beta Dedifferentiation GSE103383 1,250
Tubulin Microtubule Physiological Cues GSE128414 1,250
Tubulin Microtubule Physiological Cues GSE128414 2,250
Bone Size Height Fractures GSE128641 1,250
Bone Size Height Fractures GSE128641 2,250
Regulated Csa Csb Neuroblastoma GSE129002 1,250
Regulated Csa Csb Neuroblastoma GSE129002 2,250
Wild Wt Aag Elp1 GSE129009 1,250
Wild Wt Aag Elp1 GSE129009 2,250
Hgf Met Msp Ron GSE129075 1,250
Hgf Met Msp Ron GSE129075 2,250
Gene Profiles Gallbladder Cancer GSE139682 1,250
Ribosome Thapsigargin Tunicamycin-Treated Ln308 GSE129757 1,250
Ribosome Thapsigargin Tunicamycin-Treated Ln308 GSE129757 2,250
Hmga1 Foxm1 Synergistically Angiogenesis GSE129915 1,250
Hmga1 Foxm1 Synergistically Angiogenesis GSE129915 2,250
Er Muc1 Kidney Brd4780 GSE129942 1,250
Er Muc1 Kidney Brd4780 GSE129942 2,250
Usp28 Np63 Vulnerability Tumour GSE129982 1,250
Usp28 Np63 Vulnerability Tumour GSE129982 2,250
Mirna-30E-5P Innate Immunity Viral GSE130005 1,250
Mirna-30E-5P Innate Immunity Viral GSE130005 2,250
N6-Methyladenosine Regulates Remodeling Hec-1-A Seq Rna Nascent GSE140559 1,250
Mobilization Hair Permanent Alkylating GSE130054 1,250
Mobilization Hair Permanent Alkylating GSE130054 2,250
Ezhip Constrains Repressive Germ GSE130229 1,250
Ezhip Constrains Repressive Germ GSE130229 2,250
Total Sirna-Mediated Wtap Tpr GSE130873 1,250
Total Sirna-Mediated Wtap Tpr GSE130873 2,250
O-Glcnac-Regulated Performing O-Glcnac Level GSE131067 1,250
O-Glcnac-Regulated Performing O-Glcnac Level GSE131067 2,250
Remodelling Enhancers Deprivation Re-Stimulation GSE132207 1,250
Remodelling Enhancers Deprivation Re-Stimulation GSE132207 2,250
N6-Methyladenosine Regulates Remodeling Hec-1-A Seq Rna Nuclear GSE140560 1,250
Bcl6 Mediates Chemoresistance Myeloid GSE133112 1,250
Bcl6 Mediates Chemoresistance Myeloid GSE133112 2,250
Palbociclib Gsk3326595 A375 Palbociclib Gsk Rnaseq GSE133568 1,250
Palbociclib Gsk3326595 A375 Palbociclib Gsk Rnaseq GSE133568 2,250
GSE133674 1,250
GSE133674 2,250
Fmrp Export N6-Methyladenosine-Containing Mrnas GSE133724 1,250
Fmrp Export N6-Methyladenosine-Containing Mrnas GSE133724 2,250
Oxabicycloheptene Sulfonate Recombination Antagonism GSE133941 1,250
Oxabicycloheptene Sulfonate Recombination Antagonism GSE133941 2,250
Micrornas Hcv Hcc Biomarker GSE140845 1,250
Hnf4Α Localization Correlates Failure GSE134422 1,250
Hnf4Α Localization Correlates Failure GSE134422 2,250
Amino Change Underlies H2A GSE134532 1,250
Amino Change Underlies H2A GSE134532 2,250
Hippocampal Neocortex 17 Mesial GSE134697 1,250
Hippocampal Neocortex 17 Mesial GSE134697 2,250
Mild Enterovirus 71 Isolates GSE135964 1,250
Mild Enterovirus 71 Isolates GSE135964 2,250
Fibronectin Rescue Ccm3-Deficient Independent GSE137426 1,250
Fibronectin Rescue Ccm3-Deficient Independent GSE137426 2,250
Chd8 Elk1 Cooperativity Mapk GSE141085 1,250
Crispr-Assisted Detection Rna-Protein Living GSE137556 1,250
Crispr-Assisted Detection Rna-Protein Living GSE137556 2,250
24 Recovery Methionine Restriction GSE138574 1,250
24 Recovery Methionine Restriction GSE138574 2,250
Brsk2 Brsk1 Kinases Nrf2 GSE139135 1,250
Brsk2 Brsk1 Kinases Nrf2 GSE139135 2,250
Chronic Intermittent Ethanol Withdrawal GSE139408 1,250
Chronic Intermittent Ethanol Withdrawal GSE139408 2,250
Transcriptional Responses Children Sickle GSE139912 1,250
Transcriptional Responses Children Sickle GSE139912 2,250
Ago2 Impair Interference Neurological GSE141099 1,250
Indicates Prognosis Critically Ill GSE139913 1,250
Indicates Prognosis Critically Ill GSE139913 2,250
Astragalus Polysaccharide Berberine Ir-Hepg2 GSE139929 1,250
Astragalus Polysaccharide Berberine Ir-Hepg2 GSE139929 2,250
Th1 Tr1 Tneg Malaria GSE139990 1,250
Th1 Tr1 Tneg Malaria GSE139990 2,250
Robust Partitioning Microrna Downstream GSE140367 1,250
Robust Partitioning Microrna Downstream GSE140367 2,250
Urinary Sediment Longitudinal Decline GSE140627 1,250
Urinary Sediment Longitudinal Decline GSE140627 2,250
O-Glycan Initiation Directs Biological GSE141387 1,250
Immune-Centric Exploration Brca2 Germline GSE141142 1,250
Immune-Centric Exploration Brca2 Germline GSE141142 2,250
Symmetric Arginine Dimethylation Type GSE141645 1,250
Symmetric Arginine Dimethylation Type GSE141645 2,250
Targeted Degradation Non-Catalytic Aurora GSE141911 1,250
Targeted Degradation Non-Catalytic Aurora GSE141911 2,250
Evip2 Expression-Based Phenotyping Predict GSE141963 1,250
Evip2 Expression-Based Phenotyping Predict GSE141963 2,250
Overcoming Wee1 Azd1775 Es-2 GSE142124 1,250
Overcoming Wee1 Azd1775 Es-2 GSE142124 2,250
Cystic Fibrosis Non-Cystic 2D GSE141535 1,250
Stem-Cell 48H Transduction Adenoviruses GSE142131 1,250
Stem-Cell 48H Transduction Adenoviruses GSE142131 2,250
Landscapes Hepatoma Grown Scaffolds GSE142206 1,250
Landscapes Hepatoma Grown Scaffolds GSE142206 2,250
Rational Scalable Strategies Glue GSE142405 1,250
Rational Scalable Strategies Glue GSE142405 2,250
High-Throughput Transcriptome Clinical Psoriasis GSE142582 1,250
High-Throughput Transcriptome Clinical Psoriasis GSE142582 2,250
Hiltonol Prna Stimuli Cdc1S GSE142630 1,250
Hiltonol Prna Stimuli Cdc1S GSE142630 2,250
Fibrosis Arranged Connective Airways GSE141536 1,250
Ubr5 Depleted Myc Hela GSE143517 1,250
Ubr5 Depleted Myc Hela GSE143517 2,250
Prc2-Independent Ezh2 Rrna Ires-Dependent GSE143975 1,250
Prc2-Independent Ezh2 Rrna Ires-Dependent GSE143975 2,250
Alternative Epigenome Cml Remission GSE144119 1,250
Alternative Epigenome Cml Remission GSE144119 2,250
Transgenic Tnnt2 Variant Models GSE145042 1,250
Transgenic Tnnt2 Variant Models GSE145042 2,250
Lucat1 Feedback Iav Hsv GSE145449 1,250
Lucat1 Feedback Iav Hsv GSE145449 2,250
Helicase Ddx5 Supports Mitochondrial GSE142024 1,250
Omics Assisted N-Terminal Proteoform GSE103405 1,250
Srsf2-Numb-Notch Governs Hemogenic Progenitors GSE146147 1,250
Srsf2-Numb-Notch Governs Hemogenic Progenitors GSE146147 2,250
Emergent Restricted Ig-Transmembrane Vsig GSE146311 1,250
Emergent Restricted Ig-Transmembrane Vsig GSE146311 2,250
Evaluation Eribulin Irinotecan Pediatric GSE146687 1,250
Evaluation Eribulin Irinotecan Pediatric GSE146687 2,250
Mtorc2 Rac1 Predisposes Idh1-Mutated GSE147223 1,250
Mtorc2 Rac1 Predisposes Idh1-Mutated GSE147223 2,250
Active Inactive Systemic Juvenile GSE147608 1,250
Active Inactive Systemic Juvenile GSE147608 2,250
M6A Sorafenib-Resistance Foxo3-Mediated Autophagy GSE143233 1,250
Nalm Nalm6 Bko Hets GSE148137 1,250
Nalm Nalm6 Bko Hets GSE148137 2,250
Cord Susceptible Mll-Af4 Translocations GSE148714 1,250
Cord Susceptible Mll-Af4 Translocations GSE148714 2,250
Pharmacologic Ire1 Xbp1S Proteostasis GSE148802 1,250
Pharmacologic Ire1 Xbp1S Proteostasis GSE148802 2,250
Histone-Methyltransferase Dot1L Antileukemic Dataset GSE149184 1,250
Histone-Methyltransferase Dot1L Antileukemic Dataset GSE149184 2,250
Cellular Cell-Derived Cardiomyocytes Melphalan GSE150055 1,250
Cellular Cell-Derived Cardiomyocytes Melphalan GSE150055 2,250
Snhg5 Migration Invasion Epithelial-Mesenchymal GSE143766 1,250
Assessment Era 17A-E2 17B-E2 GSE151039 1,250
Assessment Era 17A-E2 17B-E2 GSE151039 2,250
Lmp1 Manipulates Content Recipient GSE155201 1,250
Lmp1 Manipulates Content Recipient GSE155201 2,250
Shscr Hsf1 Shhsf1 Shctcf GSE155541 1,250
Shscr Hsf1 Shhsf1 Shctcf GSE155541 2,250
Non-Structural Ns1 Operates Suppress GSE156152 1,250
Non-Structural Ns1 Operates Suppress GSE156152 2,250
Ier5 Required Notch-Mediated Induction GSE156487 1,250
Ier5 Required Notch-Mediated Induction GSE156487 2,250
Dcis Com Bcl9 Knockdown GSE143790 1,250
Voclosporin Tacrolimus Secretion Islets GSE156903 1,250
Voclosporin Tacrolimus Secretion Islets GSE156903 2,250
Mcf7 Treated Abemaciclib Sr11302 GSE157214 1,250
Mcf7 Treated Abemaciclib Sr11302 GSE157214 2,250
Insc-Derived Lysosomal Storage Niemann-Pick GSE157676 1,250
Insc-Derived Lysosomal Storage Niemann-Pick GSE157676 2,250
Master Cofactors Specification Singlefactor Rnaseq GSE159340 1,250
Master Cofactors Specification Singlefactor Rnaseq GSE159340 2,250
Amyotrophic Divergence Grade Involvement GSE161199 1,250
Amyotrophic Divergence Grade Involvement GSE161199 2,250
Classification Immunosuppression Mechanisms Correlation GSE143941 1,250
Compartment Transplant Cytomegalovirus Reactivation GSE161752 1,250
Compartment Transplant Cytomegalovirus Reactivation GSE161752 2,250
P300 Cbp Axis Lethal GSE162564 1,250
