Pathway,Count
Isp Cd28 Stimulated Immunocult GSE151080 1,250
Elevated Etv6 Aggressive Shorter GSE155052 1,250
Myosin 7B Adenovirus Myh7B Sp GSE157260 1,250
Expanding Space Runx1 Runx1T1-Mediated GSE160792 1,250
Stereotactic Radiotherapy Tumor Lung GSE162945 1,250
Macroh2A1-Depleted Imr90 Lung Fibroblasts GSE54846 1,250
Atopic Complicated Eczema Herpeticum GSE60481 1,250
Rna Analysis Jmjd1C Depletion GSE63485 1,250
Effect Chka Knockdown C4-2 GSE63700 1,250
Nucleosome Specimens Cnot3-Regulated Self-Renewal GSE66216 1,250
Sirt1-Centered Circuitry Stemness Metastasis GSE112365 1,250
Acps Cytosine-Rich Polypyrimidine Cassette GSE71569 1,250
Ags Helicobacter Pylori P12 GSE73226 1,250
Data Fl-Hspcs Hoxa7 Knockdown GSE76683 1,250
Hmtr4 Creating Balanced Pools GSE77641 1,250
Solid Tumours Dedifferentiation Demethylation GSE81817 1,250
Screening Discloses Involved Carcinogenesis GSE83520 1,250
Parvovirus B19 G2 Phase GSE83525 1,250
Zmynd11 Opposing Ras-Responsive Ets2 GSE86239 1,250
Airway Smokers Myo-Inositol Placebo GSE86422 1,250
Dux4-Induced Dsrna Stabilization Facioscapulohumeral GSE87495 1,250
Sirt1-Centered Circuitry Stemness Metastasis GSE112365 2,250
Anaplasma Phagocytophilum Impacts Group GSE107770 1,250
Tristetraprolin Disables Maintenance Impairing GSE87532 1,250
Identifying Ascl1 Gbm Cultures GSE87617 1,250
Cd95L Si Shrnas Kill GSE87817 1,250
Otx2 Distal Shapes Medulloblastoma GSE92583 1,250
Non Ilf2 Shrna-Transduced H929 GSE97323 1,250
Shsrc-1 Shnt Tamoxifen Ly2 GSE99647 1,250
G-Protein-Coupled Receptors Th17 Pathogenicity GSE99778 1,250
Tfiih Cdk7 Transcription-Associated Modification GSE100040 1,250
Optic Chiasm Multiple Sclerosis GSE100297 1,250
Lncrnas Mirnas Mrnas Leiomyoma GSE100338 1,250
Undergoing Mediated Activation Attenuation GSE117329 1,250
Curefast Accelerating Research Families GSE100427 1,250
Study Circadian Pineal Gland GSE100472 1,250
Rig-I Stimulated Old Young GSE100709 1,250
Ebola Virus Ebov Arpe-19 GSE100839 1,250
Samhd1 Recurrently Mutated Prolymphocytic GSE100882 1,250
Epigenetic Enhancer Oncogenic Transformation GSE101241 1,250
Tracking Species-Specific Experimental Hepatoblastoma GSE101413 1,250
Data Gbscc Patients India GSE101547 1,250
Existing Accurately Discriminate South GSE101705 1,250
Underly Diagnosed Atmosphere Oxygen GSE101799 1,250
Undergoing Mediated Activation Attenuation GSE117329 2,250
Effect Setd1A Global Mcf-7 GSE101860 1,250
Acetylation Cytidine Messenger Rna GSE102113 1,250
Henoch Schönlein Purpura Nephritis GSE102114 1,250
Wide Young Aged Endometrium GSE102131 1,250
Recapitulation Microenvironment Ipsc-Derived Npc GSE102139 1,250
Developmental Stage Architecture Erythroid GSE102182 1,250
Effect Fgf13 Depletion H460 GSE102185 1,250
Modulation Endogenous Retroviruses Vorinostat GSE102187 1,250
Transporters Present Post-Transplant Gvhd GSE102228 1,250
Zika Virus Oncolytic Glioblastoma GSE102244 1,250
Augments Il-4-Induced Stat6 Batf GSE123603 1,250
Effectively Progress Rapalog Impairment GSE102246 1,250
Mononuclear Hsa Circ 0005836 Diagnostic Biomarker GSE102272 1,250
Variation Embryonic Lines Impacts GSE102311 1,250
Myelomonocytic Donors Bone Marrow GSE102312 1,250
Sequential Cortical Neuron Ipscs GSE102352 1,250
Jcad Kiaa1462 Disease-Associated Product GSE102498 1,250
Transcriptome-Analysis Ulcerative Colitis Intestinal GSE102746 1,250
Ipf Lung-Associated Normal Peripheral GSE102751 1,250
P53 Shapes Landscape Chronic GSE102796 1,250
Hepatitis Ns5A Stabilizes Growth-Regulatory GSE102910 1,250
Augments Il-4-Induced Stat6 Batf GSE123603 2,250
Glioblastoma Infected Zika Virus GSE102924 1,250
Display Sepsis-Like Reverted Il-1 GSE103170 1,250
Regulated Noncoding H19 Hepatic GSE103201 1,250
Thyroid State Regulates Blood GSE103305 1,250
Determine Depletion Setdb1 Thp-1 GSE103409 1,250
Bidirectional Occurs Transposable Setdb1 GSE103410 1,250
Seq Aml Nb4 Fto GSE103494 1,250
Wild-Type Idh1 R132H Astroglial GSE103557 1,250
Suv39H1-Low Migratory Populations Cervical GSE103792 1,250
5Hmc Data Lines Antioxidant GSE103850 1,250
Analysis Sin3A Functions Hek293T GSE123861 1,250
Metabolomics Discloses Pivotal Arachidonic GSE103940 1,250
Associate Mediate Gsdma Contribution GSE104174 1,250
Epigenomes Ex Exposure Mevalonate GSE104227 1,250
Profile Hepatocellular Carcinoma Sequencing GSE104310 1,250
Manifest Profound Predispose Hsce GSE104406 1,250
Metformin Induces Chromosome Reorganization GSE104458 1,250
Naïve Esrrb Capacity Rapid GSE104583 1,250
Differentially Lncrnas Identified Seq GSE104836 1,250
Cxcr5 Cd45Ra-Cd8 Subset Follicular GSE105095 1,250
Bone Marrow-Derived Dental Pulp-Derived GSE105145 1,250
Analysis Sin3A Functions Hek293T GSE123861 2,250
Evidence O-Methylation Capabilities Ribosomes GSE105248 1,250
Penetrant Idh1 Provides Benefit GSE105447 1,250
N6-Methyladenosine Marking Regulons Erythropoiesis GSE105782 1,250
Accumulate Type2 Alpha-Ketoglutarate Tet-Tdg GSE106177 1,250
Effects Doxorubicin Cells-Derived Cardiomyocytes GSE106297 1,250
Pancreatic Associated Gemcitabine Resistance GSE106336 1,250
Lymphoma Induced Lsd1 Depletion GSE106416 1,250
Premalignant Lesions Lynch Syndrome GSE106500 1,250
Trim59 Gliomagenesis Tc45 Dephosphorylation GSE106557 1,250
Identify Neuropilin-1 Bt-474 Model GSE106638 1,250
Transcriptomic Peripheral Blood-Derived Mast GSE125887 1,250
Facile Generating Tumorigenic Spheroids GSE106848 1,250
Landscape H3K4Me3 Human Cd19 GSE106851 1,250
Month Year 42 61 GSE107111 1,250
Proteotranscriptomic Potential E6Ap Targets GSE107245 1,250
Insulin Receptor Associates Promoters GSE107336 1,250
Placenta Cruzi Infected Mothers GSE107376 1,250
Proteomic Plk1 Setd2-Deficient Clear GSE107391 1,250
Genomic Analyses Hep-G2 Fto GSE107411 1,250
Imp3 Regulated Gene Breast GSE107564 1,250
Uniquely Plate Chondrocytes Uncover GSE107649 1,250
Transcriptomic Peripheral Blood-Derived Mast GSE125887 2,250
Sirna-Mediated Orai3 Mda-Mb-468 Exposed GSE107692 1,250
Sh-Trc Sh-Mir100Hg Triplex Negative GSE107717 1,250
Signature Notch Receptor Activation GSE107748 1,250
Widespread Autism Spectrum Disorders GSE107867 1,250
U87Mg Glioblastoma Shrna-Mediated Trim52 GSE107932 1,250
Intrahepatic Cholangiocarcinoma Prognostic Subclassees GSE107943 1,250
Roll Shear Tether Sling GSE107981 1,250
Adaptor Zfc3H1 Competes Retain GSE108197 1,250
Growing Senescent Il-1R-Depleted Imr90 GSE108278 1,250
Id1 Mutant Kras Adenocarcinoma GSE108491 1,250
Divergent Erf3 Upf1 Uorf GSE126385 1,250
Widespread Two-Dimensional 2D Nanosilicates GSE108638 1,250
Luminal Erα-Controlled Ligand-Independent Manner GSE108693 1,250
Mesenchymal Psoriasis Skin Lesion GSE108743 1,250
Neutrophils Infected Iav Using GSE108807 1,250
Crosstalk Activities Mepce P-Tefb GSE108830 1,250
Polyacrylamide Matrices Kpa 55 GSE108907 1,250
Atherogenic Transcriptiome Diabetic Epicardial GSE108971 1,250
Network Androgen Receptor Epididymis GSE109062 1,250
Sex Late Trimester Placenta GSE109082 1,250
Sex Late Trimester Placenta GSE109120 1,250
Divergent Erf3 Upf1 Uorf GSE126385 2,250
Neo-Antigenic Naturally Processed Presented GSE108413 1,250
P53 Metabolism Regulating Pgc-1Α GSE109373 1,250
Antibody-Mediated Mica Shedding Cell-Driven GSE109542 1,250
Comparative Triple Differentiated Teneurin-4 GSE109798 1,250
Levels Nkg2C Nk Vitro GSE109823 1,250
Expression Profiles Cd4Low Hla-G GSE109844 1,250
Silencing P300 Mcf7 Study GSE109957 1,250
Involved Tgf-Β-Driven Transformation Myofibroblasts GSE110021 1,250
Th17 Presence Cd28 Costimulation GSE110097 1,250
Practical Alignment Algorithms Calling GSE110114 1,250
Bap1 Opposing Prc1-Mediated Ubiquitylation GSE110143 1,250
Rala Ralb Independently Ras GSE126794 1,250
Amlexanox Ikk-Ɛ Tbk1 Nf-Κb GSE110206 1,250
Bone Lesion Ivbl Orthotopic GSE110451 1,250
Septic Shock According Therapy GSE110487 1,250
Sicon Sih19-Transfected Uterine Usmc GSE110557 1,250
Embryonic Stem Axial Progenitors GSE110608 1,250
Pthrp Overexpression Mcf7 Cells GSE110713 1,250
Facilitates Cord Cd34 Hdac5 GSE110736 1,250
Developmental Origins Subcutaneous Visceral GSE110820 1,250
Comparative Hescs Ipscs-Derived Corneal GSE110872 1,250
Cd11C Hi Igd Subjects GSE110999 1,250
Rala Ralb Independently Ras GSE126794 2,250
Open-Label Pilot Evaluate Patch GSE111061 1,250
Hescs Ipscs-Derived Lentoid Body GSE111071 1,250
A20 Canonical Wnt-Signaling Ripk4 GSE111084 1,250
Deep Vascular Common Diseases GSE111120 1,250
Multi-Parameter Coordination Major Mechanisms GSE111222 1,250
Perivascular Signals Temozolomide Gelatin GSE111231 1,250
Snai1 Vegf Stimulus Huvecs GSE111386 1,250
Co-Cocultured Boyden Chamber 4D GSE111538 1,250
Apobec Recessive Dystrophic Epidermolysis GSE111582 1,250
Zfp281 Shapes Trophoblast Placental GSE111824 1,250
H9 Pax6 Ko Pax6D GSE128140 1,250
Osmostress Architecture Mammalian Hic GSE111904 1,250
Raji Subline Apto-253 253R GSE111928 1,250
G-Protein Coupled Safeguards Carcinomas GSE111932 1,250
Targeted Reactivation Fmr1 Fxs GSE112031 1,250
Prostate Pc3E Gs689 Li GSE112037 1,250
Damage-Induced Transient Cell-Cycle Arrest GSE112068 1,250
Polarized Cell Functions GSE112448 1,250
Rheumatoid Arthritis Fibroblast-Like Synoviocytes GSE112656 1,250
Seletive Cdk9 Dlbcl Lines GSE113035 1,250
Mapping Multi-Layered Environmental Stress GSE113171 1,250
H9 Pax6 Ko Pax6D GSE128140 2,250
Acute Viral Bronchiolitis Nms GSE113209 1,250
Acute Viral Bronchiolitis Pbmc GSE113210 1,250
Sauchinone Cholesterol Homeostasis Pcsk9 GSE113247 1,250
Neuroblastoma Lines Thz531 Dmso GSE113314 1,250
Setdb1 Compacts Inactive Il1Rapl1 GSE113399 1,250
Administered Ghrelin D-Lys3 Ghrp-6 GSE113799 1,250
Bach1 Self-Renewal Mesendodermal Embryonic GSE113817 1,250
Nascent Nmyc Sh-Ep Mycner GSE113861 1,250
Seq Tes L1Rp-Expressing Hek293T GSE113960 1,250
Main Source Tumor-Specific Antigens GSE113972 1,250
Norrie Ndp Patient-Derived Glioblastoma GSE128255 1,250
Hbv-Infected Primary Hepatocytes Tazarotene GSE114003 1,250
Factor Rbm25 Myc Myeloid GSE114027 1,250
T-Cells Infants Food Allergy GSE114065 1,250
Oncogene Addiction Medullary Thyroid GSE114069 1,250
Wnk1 Slug Co-Overexpressed Lncap GSE114154 1,250
Ror1 Antigen Involved Rho-Gtpase GSE114382 1,250
Hypoxic Editing Apobec3G Lymphocytes GSE114519 1,250
Antibiotic Host-Microbiome Upper Tract GSE114588 1,250
Silencing Xrn1 Dox-Inducible Shrna GSE114605 1,250
Adipocyte-Derived Lipids Mediate Fatp GSE114941 1,250
Norrie Ndp Patient-Derived Glioblastoma GSE128255 2,250
Interacts G9A Methyltransferase Drive GSE115024 1,250
Captured Oculomotor Mortem Material GSE115130 1,250
Prmt5 Diffuse Large Dlbcl GSE115136 1,250
Tgfβr Improved Cell-Based Therapies GSE115137 1,250
Utilized Influenza-Specific Monoclonal Antibody GSE115203 1,250
Fgf2 Core-Fucosylations N-Glycans Integrins GSE115240 1,250
Low Cell-Matrix Adhesion Subtypes GSE115256 1,250
Data Mir340 Overexpressing A549 GSE115361 1,250
Modification Xrn1 Depletion Hela GSE115471 1,250
Mrna-Sequencing Spheroidal Aggregates Electrotaxis GSE115509 1,250
Bacteroides Fragilis Bf Carcinogenesis GSE130152 1,250
Mir22 Master Predictive Clear GSE115552 1,250
Integrated Epigenomic Terminal Erythropoiesis GSE115684 1,250
Grex Age-Related Macular Degeneration GSE115828 1,250
Dynamic 3D Chromosomal Landscapes GSE115895 1,250
Discovering Cytokine Eqtl Trial GSE116006 1,250
Atlas Subcellular Localization Apex-Seq GSE116008 1,250
Rnaseq Idiopathic Pulmonary Fibrosis GSE116086 1,250
Adaptation Glutamine Starvation Slc1A3 GSE116087 1,250
Srf-Dependent Mirna-Dependent Manner Huh-7 GSE116133 1,250
Population Tissue-Resident Inflamed Mucosal GSE116139 1,250
Bacteroides Fragilis Bf Carcinogenesis GSE130152 2,250
Fibroblasts Cholesteatoma Activate Osteoclasts GSE116142 1,250
Pre-Transplantational Post-Transplantational Fate Cartilage GSE116173 1,250
Temporal Nr5A2 Rarγ Tgfβ GSE116501 1,250
Validation Circhipk3 Upregulated Promoting GSE116589 1,250
Arid4B Presents Essentiality Pten-Deficient GSE116668 1,250
Rna Brca2-Depleted Breast Lines GSE116943 1,250
Cd73 Effect Pancreatic Lines GSE117012 1,250
Decay Constants Half-Lives Proliferating GSE117121 1,250
Shrna-Mediated Tmeff2 Absence Dihydrotestosterone GSE117180 1,250
Fisetin Endoplasmic Reticulum Stress-Dependent GSE117189 1,250
Macroh2A1 Paracrine-Mediated Chemoresistance Cd25 GSE131680 1,250
Outcomes Kinetic Patterning Nf-Κb GSE117254 1,250
Sune-1 Downregulation Dancr Expression GSE117415 1,250
Proliferating Quiescent Dermal Fibroblasts GSE117444 1,250
Stvi-120 Induction Epidermal Followed GSE117562 1,250
Inflammation Impairs Pneumococcal Carriage GSE117580 1,250
Rna-Seq Pc9 Tolerant Gefitinib GSE117610 1,250
Canonical Adaptive Hcmv Seropositive GSE117614 1,250
Wnt Olaparib Resistant Ovarian GSE117765 1,250
Examining Serotonergic Neuron Ipscs GSE117910 1,250
Sequencing Coh29 Treatment C4-2 GSE117921 1,250
Macroh2A1 Paracrine-Mediated Chemoresistance Cd25 GSE131680 2,250
Lysine Benzoylation Histone Mark GSE108469 1,250
Rna-Seq Mda-Mb-231 Tet1 Knockout GSE100483 1,250
Sequencing Rrm2 Overexpressing Lncap GSE117922 1,250
Sequencing Rrm2 Overexpressing Pc-3 GSE117923 1,250
Sequencing Rrm2 Knockdown C4-2 GSE117924 1,250
Net-Cage Characterizes Topology Transcribed GSE118075 1,250
Transcriptomic Lung Carcinoids Lcs GSE118131 1,250
Transcriptomic Rps3-Regulated Hcc Line GSE118140 1,250
Rna-Sequencing Retinal Pigment Epithelum GSE118167 1,250
Stripak Directs Pp2A Transformation GSE118272 1,250
Terminal Repeat The1B Placenta-Specific GSE118285 1,250
Hemoglobin Switching Lin28B-Mediated Bcl11A GSE118358 1,250
Bfgf Wnt3A Exfoliated Deciduous GSE131758 1,250
Hemoglobin Switching Lin28B-Mediated Bcl11A GSE118359 1,250
Del 7Q Shwachman Diamond GSE118372 1,250
Acquisition Extra Diamond Sds GSE118377 1,250
Grainyhead-Like Grhl2 Intermediate Epithelial-Mesenchymal GSE118407 1,250
Assessing Maturity Histological Birth GSE118442 1,250
Β2 Β5 Characteristics Chemotherapy GSE118449 1,250
Open Depot-Specific Subcutaneous Preadipocytes GSE118497 1,250
Hypoxia-Regulated Non-Coding Rnas Endothelial GSE118530 1,250
Transcriptome-Wide Dynamic Obesity Adipogenesis GSE118762 1,250
Ugdh Knockdown Mda-Mb-231 GSE118772 1,250
Bfgf Wnt3A Exfoliated Deciduous GSE131758 2,250
Wide Change Lcc2 Mcf-7 GSE118774 1,250
Checkpoint Pulmonary Fibrosis Bulk GSE118933 1,250
Nras Embryonal Rhabdomyosarcoma Erms GSE118939 1,250
Modes Prc2 Elicit H3K27M GSE118954 1,250
Truncating Myof Limb-Girdle Muscular GSE119027 1,250
Incorporation Acquisition Traits Colonization GSE119030 1,250
Longitudinal Characterization Immune Hepatitis GSE119117 1,250
Human Treg Il-12 Stimulation GSE119191 1,250
Human Treg Nacl Stimulation GSE119192 1,250
Validation Cone-Enriched Retinal Organoids GSE119274 1,250
Monocyte U937-Cas9 Wt Irf2Ko GSE132178 1,250
Over-Editing Aggressiveness Intrahepatic Cholangiocarcinoma GSE119336 1,250
Foxa1-Mediated Repression Tgf-Β Castration-Resistant GSE119757 1,250
Cd34 Hspcs Co-Culture Myelodyplastic GSE119916 1,250
P63 Stratified Ectodermal Dysplasia GSE120107 1,250
Menscs Inhibit Hcc 5-Hmc GSE120158 1,250
Rna Sequencing Mammary Epithelial GSE120174 1,250
Rna-Seq Mda-Mb-231 Sict Siaxl GSE120268 1,250
Ascitic Fluid-Isolated Mesothelial Serous GSE120303 1,250
Genomic K562 Shrna Lncrna-Iirx GSE120337 1,250
Unstable Section Atherosclerotic Plaques GSE120521 1,250
Monocyte U937-Cas9 Wt Irf2Ko GSE132178 2,250
Nci-H82 Dox-On Prb Ptripz GSE120562 1,250
Dilated Cardiomyopathy Vs Myocarditis GSE120567 1,250
Pbmcs Peripheral Blood Hepatocellular GSE120663 1,250
Transiently Al Reports 2018 GSE120702 1,250
Ca2 Release-Activated Entry Defence GSE120730 1,250
Pi3-Kinase Endometrium Transdifferentiation Collective GSE121198 1,250
Circmrps35 Mediated Mrna Profiles GSE121382 1,250
Circular Gastric Tissues Adjacent GSE121445 1,250
U87 Knocking Glud1 Low GSE121580 1,250
Determine Acquired Egfr Tki GSE121634 1,250
Mammary Mcf-10A Sr Sr-Like GSE137440 1,250
Sequencing Tumor-Infiltrating Renal Clear GSE121636 1,250
Sequencing Tumor-Infiltrating Clear Vdj GSE121637 1,250
Peninsular Coordinates Asynchronous Generate GSE121679 1,250
Small-Molecule Brachyury Chordoma Rnaseq Sgrna GSE121845 1,250
Specifying Anterior Streak Yap1 GSE121877 1,250
Villus Unexplained Abortion Abortions GSE121950 1,250
H1609088 Human Rna-Sequencing GSE121995 1,250
Fat1 Suppressor Cdk4 Hippo GSE122088 1,250
Ftsec Ft190 Ft194 Shrna GSE122237 1,250
Dualism Fgf Converging Rna-Seq 65 Hdf GSE122369 1,250
Mammary Mcf-10A Sr Sr-Like GSE137440 2,250
Wt Vs Socs3 Stem-Cells GSE122486 1,250
Shank2 Spectrum Cause Hyperconnectivity GSE122550 1,250
Inin Fibroblast-Like Patients Trauma GSE122616 1,250
Widespread Underlies Pathogenic Myeloma GSE122638 1,250
Lncrna Ischemic Stroke Patients GSE122709 1,250
Rna Sequencing Pairs Gastric GSE122796 1,250
Walls Lysosomes Immunoglobulins Rupture GSE122897 1,250
Thymidylate Synthase Maintains De-Differentiated GSE122953 1,250
Profile Mhcc-97H-Sh-Nc Mhcc-97H-Sh-Uck2 Liver GSE123039 1,250
Mechanistic Model-Guided Study Morphogenesis GSE123074 1,250
Simultaneous Implicates Gwas Causal GSE138767 1,250
Knockdown Zbtb7A Ntc Control GSE123090 1,250
Cas9 Peo1 Grown Suspension GSE123290 1,250
Induction Yap5Sa-Gfp Ngfp Flipintrex293 GSE123296 1,250
Transcriptional Cell-Derived Polarized Hepatocytes GSE123462 1,250
Egr1-Controlled Transcriptome Hescs GSE123472 1,250
Quantseq Salmon Quantification Tophat2 GSE123523 1,250
Neutrophils Generalised Pustular Psoriasis GSE123785 1,250
Generalised Pustular Psoriasis Individuals GSE123786 1,250
Carbonic Anhydrase Ix Ph GSE123856 1,250
Muc1-C Represses Rassf1A Kras GSE123860 1,250
Simultaneous Implicates Gwas Causal GSE138767 2,250
Reprograms End-Stage Heart Failure GSE123976 1,250
Insulin Acetylation Triple Negative GSE124127 1,250
Bacille Calmette-Guérin Vaccination Elicits GSE124217 1,250
Convergent Autism Revealed Course GSE124308 1,250
Transcriptome Keratinocytes Hpv16 Oncogene GSE124357 1,250
Traps Il-8 Il-1 Bronchial GSE124378 1,250
Transcriptomes Mda-Mb-231 Lm2-4175 Lines GSE124380 1,250
Innate-Like Mucosal-Associated Invariant Mycobacterial GSE124381 1,250
Genome-Wide Cancer-Specific Alternative Circrna GSE124453 1,250
35 Paired Hcc Non-Tumor GSE124535 1,250
Dual Orientia Tsutsugamushi Huvec GSE139498 1,250
Npm1C Presence Autologous Mice GSE124538 1,250
Genetically Pim-1 Oncogenicity C-Kit GSE124590 1,250
Foxa1 Upregulation Reprogramming Endocrine-Resistant GSE124655 1,250
Accessibility Ilscs Vs Iblasts GSE124730 1,250
Study Role Pou3F2 Uvb GSE124761 1,250
Β-Cells Interferon-Α Pnpt11-Mir-26A-Tet2 Autoimmune GSE124810 1,250
N384546 Papillary Mir-145-5P Akt3 GSE124841 1,250
Altered Hotair Knockdown Mcf-7-Tnr GSE124934 1,250
Differetially Expressed Htr U2Os GSE125024 1,250
Aml1-Eto Fusion F-Circae Kasumi-1 GSE125043 1,250
Dual Orientia Tsutsugamushi Huvec GSE139498 2,250
Foxp1 Development Lung Adenocarcinoma GSE108500 1,250
Srebp1 Keratin 80-Dependent Behavior GSE125128 1,250
Identify Tgf-Β-Regulated Rna-Sequencing Mcf10A GSE125280 1,250
Tmed9-Gated Cnih4 Tgfa Pro-Metastatic GSE125282 1,250
Characterizing Patterns Basal Carcinomas GSE125285 1,250
Tgfbeta Emt H358 Nsclc GSE125365 1,250
Comprehensive Signatures Cesarean-Born Infants GSE125421 1,250
Intracerebral Hemorrhage Inflammatory Ich GSE125512 1,250
Rna-Sequencing Profiles Affected Casc9 GSE125648 1,250
Prrx2 Hey2 Double Ascl1-Induced GSE125692 1,250
Remodeling Arid1A Indispensable Hematopoiesis GSE125848 1,250
Suite Haploid Spring Srebp GSE143530 1,250
Alk Nsclc Aberrations Outcomes GSE125864 1,250
Preterm Infants Bronchopulmonary Dysplasia GSE125873 1,250
Adoptively Transferred Cd19-Specific Adults GSE125881 1,250
Sinoatrial Node Conserved Program GSE125932 1,250
States Drive Outcomes Tcf21 GSE126131 1,250
Tbx3 Tbx3Iso1 Tbx3Iso2 Dcis-Like GSE126153 1,250
Genomics Aida Coronary Artery GSE126198 1,250
Ksdm1B Role Ewing Sarcoma GSE126275 1,250
Crispr-Engineered Ar-V Parp Sensitivities GSE126306 1,250
Pka Pp2A Neuroendocrine Sclc GSE126353 1,250
Suite Haploid Spring Srebp GSE143530 2,250
Double-Stranded Alu Relapsing Remitting GSE126427 1,250
Reticulated Platelets Prothrombotic Mrna-Seq GSE126446 1,250
Integrated Screen Leads Pediatric GSE126489 1,250
Facilitates Quantitative Sw480 Hpse-Knockdown GSE126504 1,250
Egfr Hla-G Trimester Trophoblasts GSE126530 1,250
Evolutionarily Motif Chemically Hydrogels GSE126717 1,250
Studies Pml Rarα Fusion GSE126720 1,250
Bromouridine Ip Chase Bric-Seq GSE126784 1,250
Wnt-Dependent Wnt-Independent Glioblastoma Cultures GSE126840 1,250
57 Laryngeal Paired Adjacent GSE127165 1,250
Biosimilarity Trastuzumab Monoclonal Therapeutics GSE158969 1,250
Sequencing-Based Crispri Resolves Drivers GSE127201 1,250
Glioblastoma Derived Xenograft Primary GSE127274 1,250
H9 Embronic Hesc Rpe GSE127352 1,250
3243A Pro-Atherogenic Melas Ips GSE127478 1,250
Ncbi Geo Submission High-Fat GSE127530 1,250
Suppressor Itf2 Tumorigenesis Chemotherapy GSE127559 1,250
Cleavage-Resistant Ripk1 Autoinflammation Syndrome GSE127572 1,250
Main Targetable Tumor-Specific Antigens GSE127825 1,250
Variable Parasite Load Leishmaniasis GSE127831 1,250
Transcriptional Cenpa-Depleted Prostate Lines GSE127836 1,250
Biosimilarity Trastuzumab Monoclonal Therapeutics GSE158969 2,250
4Su-Seq Ev Prl3 Expressing GSE127855 1,250
Absence Nkg2D Ligands Evasion GSE127959 1,250
Myt1 Attenuates Inhibiting Retinoic GSE128054 1,250
Subcellular Afflicted Aneurysm Marfan GSE128101 1,250
Ska3 Laryngeal Squamous Carcinoma GSE128133 1,250
Ap-1 Dependent Negative Myometrium GSE128237 1,250
Engagement Underlie Med12 Leiomyomas GSE128242 1,250
Analyses Panel Transcripts Construction GSE128274 1,250
White Wbcs Trisomy Unstranded GSE128614 1,250
White Wbcs Trisomy Stranded GSE128621 1,250
Snhg5 Sirna Knock Hct116 GSE76801 1,250
Polya Rna Tet-Inducible Saos2-P21 GSE128669 1,250
Resting Peripheral-Blood Nk Counterparts GSE128696 1,250
Erk Bmp B-Catenin Malformations GSE128740 1,250
Cbfβ-Smmhc Affects Polycomb Repressive GSE128771 1,250
Cancer-Causing Sf3B1 Alter Sugp1 GSE128805 1,250
Autologous Antigen-Specific D3-Generated Tolerogenic GSE128816 1,250
High-Dimensional Effector Treg Correlates GSE128822 1,250
Samples Umbilical Cord Cd34 GSE128910 1,250
Proteomics Marker Signature Mapki GSE128915 1,250
Il-11 Neutralising Nonalcoholic Steatohepatitis GSE128940 1,250
Snhg5 Sirna Knock Hct116 GSE76801 2,250
Β-Catenin Ras-Erk Chemotherapy-Resistant Pdx GSE128967 1,250
Time Course Msc Osteogenesis GSE129036 1,250
Platform Melanoma 95 Pdx GSE129127 1,250
Elevated A-To-I Sites Adar3 GSE129142 1,250
H2A Chemosensitivity Ductal Adenocarcinoma GSE129182 1,250
M6A Coding Helicase-Containing Ythdc2 GSE129194 1,250
Effect Smyd3 Mda-Mb-231 Breast GSE129268 1,250
Neural Progenitor Lowe Syndrome GSE129310 1,250
Physiologic Versus Toxic Manganese GSE129336 1,250
Ocular Elucidated Genetics Pigment GSE129479 1,250
Il-13 Pbmcs Il-13R Antagonist GSE79027 1,250
Programming Decidual Innate Lymphoid GSE129555 1,250
Gene-Centric Dissection Variation Hematopoiesis GSE129603 1,250
Changes Induced Unfolded Protein GSE129813 1,250
Time-Restricted Feeding Rhythmicity Overweight GSE129843 1,250
Rna Sequencing Human Monocytes GSE129935 1,250
786-O Rcc Prdm16 Lentivirus GSE130049 1,250
Perivascular Vesicles Psc-Evs Pscs GSE130086 1,250
Transcriptome-Wide Identification Defects Xab2 GSE130087 1,250
Telomerase-Reverse Transcriptase Immortalised Bj GSE130100 1,250
Models Non-Small Evaluating Sensitivity GSE130160 1,250
Il-13 Pbmcs Il-13R Antagonist GSE79027 2,250
6-Tg Cycle Mcf-7 Dnmt1 GSE130161 1,250
Vivo-Ex Cycling Manipulation Hepatocytes GSE130219 1,250
Caco-2 Co-Treatment Lovastatin Ligands GSE130234 1,250
Role Fto Ovarian Cancer GSE130350 1,250
Non-Cytolytic Cell-Mediated Hiv Mhc-Independent GSE130368 1,250
Irreversible Accompanied Discordance Timing GSE130542 1,250
Women Pcos Controlling Reproductive GSE130580 1,250
Dimensional Matrix Three-Dimensional Cultures GSE130590 1,250
Ilf3 Hela Steady Levels GSE130595 1,250
Ilf3 Establishment Antiviral Interferon GSE130618 1,250
Rectal Men Anal Intercourse GSE83245 1,250
Super Polyunsaturated Fatty Support GSE130648 1,250
High Throughput Thp-1 Monensin GSE130657 1,250
Erk1 Maintains Integrity Endothelium GSE130737 1,250
Non-Oncogene Sirt3 Plays Lymphomagenesis GSE130751 1,250
Pathway-Level Information Extractor Plier GSE130824 1,250
Serpine1 Dispersal Analyzing Dispersing GSE130857 1,250
Total Shrna-Mediated Tarbp2 Knockdown GSE130869 1,250
Nuclear Shrna-Mediated Tarbp2 Knockdown GSE130870 1,250
Profile Shows Prominent Adaptive GSE130955 1,250
Isolated Fiber-Type Skeletal Muscle GSE130977 1,250
Rectal Men Anal Intercourse GSE83245 2,250
Necroptosis Dopaminergic Opa1 Mptp GSE109228 1,250
Obtained Atcc Dsmz Biorepository GSE130985 1,250
Lymph Node Follicular Helper GSE131089 1,250
A431 Expressing Arid1A-Targeting Shrnas GSE131132 1,250
Innate T-Cell Rejection Allografts GSE131179 1,250
Circular Rnas Oral Squamous GSE131182 1,250
Gbm Myc Parp Inhibitor GSE131218 1,250
Lymphomas Indicates Subtype Microenvironments GSE131261 1,250
Rna-Binding Atxn2 Processes Megakaryopoiesis GSE131308 1,250
Tnap Periodontal Ligament Hypophosphatasia GSE131338 1,250
Tumor-Associated Macrophages Liver Clm GSE131353 1,250
Rna Adar1 Adar2 Aimp2 GSE87198 1,250
Hypoxia Effects Transcriptome Hela GSE131379 1,250
Ntapp Unexposed Tissue-Derived Asc GSE131384 1,250
Monocyte-Like Precursors Granulocytes Pmn-Mdsc GSE131552 1,250
Paxillin Genomic Networks Pc3 GSE131730 1,250
Profiling Cybrids 14487T Mutation GSE131739 1,250
Dynamic Induction Drug Stress-Responsive GSE131823 1,250
Generating Patterned Studying Diseases GSE131841 1,250
Sexually Dimorphic Crosstalk Maternal-Fetal GSE131874 1,250
Proteogenomics Vast Tumor-Specific Antigens GSE131880 1,250
Cell Sw620 Mobility Junction GSE131948 1,250
Rna Adar1 Adar2 Aimp2 GSE87198 2,250
Redundant Stag Subunits Looping GSE132014 1,250
Tumor Following Angiopellosis Extravasation GSE132082 1,250
Dataset Revealing Molecular Features GSE132083 1,250
Dual Micrornas Rest Maturation GSE132154 1,250
Phenotypic Corneal Vitro Expansion GSE132204 1,250
Macrophage Multinucleated Programmed Il15 GSE132270 1,250
