Pathway,Count
Argonaute Binds Trna Cis GSE68813 1,250
Head Neck Squamous Cell-Lines GSE68872 1,250
Rock1 Nominates Fasudil Anti-Leukemic GSE68925 1,250
Specificity Sec Tat Employs GSE69021 1,250
Elavl2-Regulated Link Atlernative Neocortical GSE69092 1,250
Sox9 Developing Mammalian Chondrocyte GSE69110 1,250
Sequencing Matched Nephrectomy Samples GSE69197 1,250
Talen-Based Mir-141 Mir-200C Sk-Br-3 GSE51217 3,250
Portrait Ductal Situ Dcis GSE69240 1,250
Fra-1 Classifier Predicts Disease-Free GSE69415 1,250
Jurkat Clones Cbap-Knockdown Sets GSE69511 1,250
Identification Cebpd Regulated Mcf7 GSE69604 1,250
Talens-Mediated Genome-Editing Exploring Abnormality GSE69678 1,250
Tnfaip3 A20 Granular Lymphocytic GSE69735 1,250
H2B1Ub Pause Release Needed GSE69738 1,250
Evolution N6-Methyladenosine Primates GSE70299 1,250
Ncrna Non-Coding Signature Hypoxia GSE70330 1,250
Paf1 Promoter-Proximal Pausing Polymerase GSE70408 1,250
Redirect Phagocytosis Non-Professional Phagocytes GSE89049 1,250
Dek-Dependent Hpv Neck Hnscc GSE70462 1,250
Integral Oncogene-Induced Multinucleation Arrest GSE70668 1,250
Analyzed Throughput Lymphocytic Specimens GSE70830 1,250
Dentate Mesial Lobe Hippocampal GSE71058 1,250
Deciphering H3K4Me3 Broad Landscapes GSE71238 1,250
Causes Hypermethylation Reducing Tet GSE71401 1,250
Wild Mir-155 Flt3-Itd Mv4-11 GSE71541 1,250
Mll-Af9 Highlights Ret Rna-Seq Normal GSE71689 1,250
Chip-Seq Kmt2D-Silenced Metastatic Melanoma GSE71854 1,250
Differential Gene Mcf10A Mcf7 GSE71862 1,250
Redirect Phagocytosis Non-Professional Phagocytes GSE89049 2,250
Rna Pancreatic Lines Gemcitabine GSE110580 1,250
Survival Pancreatic Lacking Kras GSE71876 1,250
Polycomb Bmi1 Invasive Chemoresistance GSE71890 1,250
Postnatal Epidermal Crest Fates GSE72268 1,250
Ilc2S Primary Vs Il-1B-Primed GSE72460 1,250
Gene Expression Analysis Adenomas GSE72820 1,250
Mesoderm Posterior Bhlh Mesp1 GSE72862 1,250
Chromatin-Remodelling Nurf Adult Melanocyte GSE72915 1,250
Primary Trophoblast Term Placenta GSE73016 1,250
Complementary Information Detected Punch-P GSE73565 1,250
Data Kdm1B Glioma-Initiating Gics GSE73573 1,250
Redirect Phagocytosis Non-Professional Phagocytes GSE89049 3,250
Illumina Polycystic Liver Biliary GSE73579 1,250
Disorganisation Occurs Coincident Range GSE73784 1,250
Newly Constructed Cascades Applied GSE73857 1,250
Limiting Biosynthetic Flux Sting-Dependent GSE73942 1,250
Genes Regulated Dimethyl-2-Ketoglutarate Dkg GSE74031 1,250
Fetal Progenitor Hspcs Proes GSE74053 1,250
Formalin-Fixed Paraffin-Embedded Specimens Mining GSE74270 1,250
Differences Lymphatic-Specific Dermal Microvascular GSE74322 1,250
Rnaseq Regulated Gde2 Neuronal GSE74345 1,250
Smarca4 Higher-Order Structure Proliferating GSE74716 1,250
Euchromatic L1S Screens L1 GSE95374 1,250
Characterization Parental Rociletinib-Resistant H1975 GSE74866 1,250
Calcineurin-Dependent Transfer Vasp Tunnel GSE74924 1,250
Hpv-Positive Copy Number Pik3Ca GSE74927 1,250
Runx1 Contributes Higher-Order Organization GSE75070 1,250
Melanomas Pre Mapki Treatment GSE75313 1,250
Integration Atac-Seq Alpha Beta GSE76268 1,250
Trascriptome Thyroid Cancer-Induced Macrophages GSE76445 1,250
Foxc1 Deficiency Undifferentiated Keratinocytes GSE76647 1,250
Calcified Bicuspid Tricuspid Tav GSE76717 1,250
Phenotypic Large Deletion 22Q11 GSE76922 1,250
Euchromatic L1S Screens L1 GSE95374 2,250
Compound Blocks Hiv-1 Srsf10 GSE76947 1,250
Spliced Synthetic Internal Experiments GSE77072 1,250
Epcr Primitive Subset Hspc GSE77128 1,250
Genome-Wide Change Sharpin Mcf-7 GSE77261 1,250
Runx2-Mediated Survival P53 Defective GSE77352 1,250
Negative Csl Damage P53 GSE77370 1,250
Fh-Deficient Uok262 Fh-Competent Uok262Pfh GSE77538 1,250
Mertk Based Ms Haplotype GSE77598 1,250
Transformed Oncogenes N-Myc Myrakt1 GSE77624 1,250
Hmtr4 Creating Balanced Pools GSE77639 1,250
Euchromatic L1S Screens L1 GSE95374 3,250
Tagging Tripotent Plate Mesodermal GSE77879 1,250
Keratoconus Corneas Collagen Hippo GSE77938 1,250
Dux4 Recruits Cbp C-Terminus GSE78158 1,250
24Hr Ca Cdk19 Phosphoproteomics GSE78506 1,250
Non-Follicular Hiv Lymph Nodes GSE78522 1,250
Kshv Mimics Next-Generation Mrna-Seq GSE79029 1,250
Im-0223 Transfected Kpc1 Vector GSE79111 1,250
Cavity Result Ldb1 Reduction GSE79183 1,250
Density Genomes Multi-Platform Deepcage GSE79293 1,250
Haploid Oocytes Polar Genomes GSE79309 1,250
Effects Belinostat Dexamethasone A549 GSE96649 1,250
Toxoplasma Gondii Remodels Cis-Regulatory GSE79608 1,250
Nextgen Consortium Genesips Identifying GSE79636 1,250
Hiecs Mir-30Bcd Locked Acids GSE79923 1,250
Merkel Polyomavirus Pro-Glycolytic Perturbations GSE79968 1,250
Myelin Pmp2 Sox10 Invasion GSE79988 1,250
Stochastic Principles Governing Alternative GSE80016 1,250
Environment Distinguish Lncrnas Nucfrac GSE80043 1,250
Environment Distinguish Lncrnas Stability GSE80045 1,250
Joint-Specific Signatures Rheumatoid Arthritis GSE80072 1,250
Transcriptome Profiling Primary Monocytes GSE80095 1,250
Effects Belinostat Dexamethasone A549 GSE96649 2,250
Profound Sicon Sih19-Transfected Evt GSE80237 1,250
Grainyhead-Like Essential Androgen Receptor GSE80450 1,250
Guided Self-Organization Recapitulates Bioengineered GSE80538 1,250
Nascent Rna-Seq Kasumi-1 Cells GSE80582 1,250
Splice Variants Preferred Bindings GSE80741 1,250
Rat Lymphocytes 8-Tetrachlorodibenzo-P-Dioxin Tcdd GSE80953 1,250
Cyclooxygenase-2 Cox-2 Erβ 5Α-Reductase GSE80979 1,250
Kdm2B Leads Deregulation Related GSE81043 1,250
Targeting Mthfd2 Acute Myeloid GSE81062 1,250
Transcriptome Analysis Mr1 Reactive GSE81063 1,250
Effects Belinostat Dexamethasone A549 GSE96649 3,250
Hoxa Vasculature Resembles Aorta-Gonad-Mesonephros GSE81074 1,250
Generation Rnaseq Non-Small Lung GSE81089 1,250
Circrna-Sequencing GSE81106 1,250
Rna-Binding Acinus Component Junction GSE81460 1,250
Directed Embryonic Corneal Cell-Like GSE81474 1,250
Wide Functional Mesenchymal Stem GSE81478 1,250
Cumulus Main Determinant Follicular GSE81579 1,250
Leader Recruitment Upstream Reading GSE81802 1,250
Phf20 Readers H3K4 H4K16 GSE82115 1,250
Differentially Certinib-Resistant Nb-1 Xenografts GSE82143 1,250
U87Mg A3 Adenosine Mrs1220 GSE100146 1,250
Subcutaneous Fat Obtained Obese GSE83322 1,250
Hnrnp Key Synthesis Mitosis GSE83493 1,250
Self-Renewing Multipotent Substrate Stiffness GSE83584 1,250
Jq1 Vemurafenib Braf A375 GSE83592 1,250
Bcl6-Centric Reorganization Affinity Maturation GSE84022 1,250
Sequencing Adipose-Derived Mesechymal Stromal GSE84322 1,250
Ins-Gfp Hes3 Hescs H1152 GSE84325 1,250
Asxl2 Shrna Kd Skno-1 GSE84358 1,250
Twist1 Cisplatin Gas6 L1Cam GSE84425 1,250
Progenitors Culture Simulated Microgravity GSE84582 1,250
Thyroid Primary Knock-Down Nrg1 GSE100322 1,250
Enriched Retinal Ganglion Embryonic GSE84639 1,250
Affymetrix Hta Arrays Tumours GSE84776 1,250
Time Course Hesc-Derived Cardiac GSE84815 1,250
Drug-Tolerant Persister Bt474 Lapatinib GSE84896 1,250
Read-Through Convergent Protein-Coding Prolif-Sen GSE85082 1,250
Ctcf Modulates Estrogen Matrix GSE85088 1,250
Ino80 Required Oncogenic Non-Small GSE85118 1,250
Smokers Inhalation E-Cigarette Vapors GSE85121 1,250
Artifacts Produced Mispriming Reverse GSE85163 1,250
Tt-Seq Captures Activation Ernas GSE85201 1,250
Altered C1Orf106 Papillary Thyroid GSE100392 1,250
Parental Enzalutamide Resistant C4-2B GSE110802 1,250
Genome-Wide Cardiomyocyte Embryonic Ips GSE85331 1,250
Rna-Dependent Specificities Capsnatching Viruses GSE85474 1,250
Hnf4G Charcoal Stripped-Serum Css GSE85557 1,250
Defined Set Epigenome Contribute GSE85606 1,250
Profiles Response Proanthocyanidins Pancreatic GSE85610 1,250
Mdux Mervl Hervl Retrotransposons GSE85632 1,250
Runx1 Stabilizes Epithelial Prevents GSE85857 1,250
Hormonal Gata3 Trimester Placentation GSE85995 1,250
Spliced Resulting Prenatal Alcohol GSE86006 1,250
4N 2N Polyploid Cytokinesis GSE86102 1,250
Mutational Consequences 33 Types GSE100530 1,250
Analyzing Circrnas Predict Competing GSE86202 1,250
Respiratory Transplantation Expandable Sox9 GSE86247 1,250
Directional Collected Asthma Obesity GSE86430 1,250
Cd161 Tconv Share Modified GSE86452 1,250
Hour Adenoviruses Chaperone Asf1B GSE86611 1,250
Rewiring Cis-Regulatory Units Commitment GSE86821 1,250
Lymphoblastoid Brca2 Non-Brca1 Families GSE87080 1,250
Ksrp Specifies Granulocytic Mir-129 GSE87088 1,250
Aurora Phosphorylates Saf-A Xist GSE87200 1,250
Trac-Looping Measures Structure Accessibility GSE87254 1,250
Genome-Wide Mrnas Micrornas Eri2 GSE100610 1,250
Hypoxic Sq20B Head Neck GSE87456 1,250
Alkbh5 Sustaining Foxm1 Programing GSE87515 1,250
Genome Spatial Disorganization Copy GSE87585 1,250
Interaction Mitoneet Naf-1 Cancer GSE87626 1,250
Inferring Communication Maternal-Fetal Interface GSE87692 1,250
Systematic Affecting Red Traits GSE87710 1,250
Pulse Acute Exercise-Responsive Nr4A3 GSE87748 1,250
Cap Methyltransferase Rnmt-Ram Pol GSE87767 1,250
Cellular Hepatitis Virus Hev GSE88731 1,250
Tgf-Β Regulation Mirna Pancreatic GSE88759 1,250
Kaposi Reveal Glucose Lipid GSE100684 1,250
Appropriately Arpe-19 Regain Native GSE88848 1,250
Cd74 Role Transcription Regulation GSE88956 1,250
Understanding Reproducibility Robustness Protocol GSE89044 1,250
Vitro Interrogating Non-Alcoholic Steatohepatitis GSE89063 1,250
Mcf10A Tgfb Snail S6A GSE89152 1,250
Shtp53 Rb1 Lncap Ar GSE89226 1,250
Ddx54 Dynamics Damage Rna-Seq1 GSE89367 1,250
Nkx2-5 Null Het Cardiomyogenesis GSE89443 1,250
Hypomethylation Poorly Fossa Ependymomas GSE89448 1,250
Self-Organized Amniogenesis Biomimetic Implantation-Like GSE89479 1,250
Stat Tet1 Potent Strategy GSE101480 1,250
Expressions Heart Hypertrophic Cardiomyopathy GSE89714 1,250
Egfr-Ddef1 Metastatic Unresectable Hepatoblastoma GSE89775 1,250
Cost-Effective Protocol Large-Scale Studies GSE89872 1,250
Impact Variation Ipscs Differentiated GSE89895 1,250
Pause Early Blockade Pluripotency GSE89975 1,250
Induced Repressor Hic1 Suppressive GSE90468 1,250
Ribosome G2019S Lrrk2 Dopamine GSE90469 1,250
Nominates Valproic Pharmacologic Modulator GSE90552 1,250
Tissue-Resident Magnitude Cytotoxic Nsclc GSE90728 1,250
Super Abundant Detected Microarray GSE90741 1,250
V336Y Mitochondrial Ribosomal Hek293 GSE101503 1,250
Bovis Bacillus Calmette-Guerin Bcg GSE90748 1,250
Erythroid-Specific Atp2B4 Hydration Malaria GSE90878 1,250
Splenic Mock Hiv-1-Infected Humanized GSE92262 1,250
Circrna-Sequencing GSE92322 1,250
Parent-Of-Origin Bias Gene Levels GSE92521 1,250
Modeling Gata6 Haploinsufficiency Development GSE92581 1,250
E8 Akit Culture Medium GSE92628 1,250
Genomic Haploinsufficient Suppressor Cux1 GSE92882 1,250
Patient-Derived Luminal Xenografts Progestins GSE93057 1,250
Kidney 36 Nephrectomy Sorafenib GSE93069 1,250
Overall Crym Overexpressed Lncap GSE101525 1,250
Mimicry Rig-I Unshielding Exorna-Seq GSE93070 1,250
Gene Changes Loc550643 Silencing GSE93292 1,250
Myeloma Mm 1S Kdm6B GSE93395 1,250
Sips Plant 1201 Solidago GSE93535 1,250
Facilitates Cell-Derived Endocardial-Like Cardiac GSE93705 1,250
Identification Target Taz Prostate GSE93748 1,250
Vibrio T3Ss1 Rewires Subvert GSE93783 1,250
Quiescence Requires Ca2 Mitochondria GSE93991 1,250
S-Adenosylhomocysteine Hydrolase Participates Inheritance GSE94055 1,250
Lipids Central Replicative Senescence GSE94280 1,250
Differential Rnas Sorbs2-Depleted Ovarian GSE101594 1,250
Atf4 P62 Represses Tumorigenesis GSE94367 1,250
Downregulation Ddx5 Ddx17 GSE94372 1,250
Senescent Restores Chemotoxicity Aging GSE94395 1,250
Gene Thyroid Cell Lines GSE94464 1,250
Helicase Ddx39B Il7R Reducing GSE94730 1,250
Enriched Young Elderly Women GSE94736 1,250
H9-Hesc Idh1-R132H Shrna Knockdown GSE94853 1,250
Eomes-Expressing Ptpn22 1858T Allele GSE94859 1,250
Identification Rb Loss-Induced Prostate GSE94863 1,250
Kras Signatures Immortalized Isogenic GSE94937 1,250
Alpha Amanitin Sorbs2-Depleted Control-Treated GSE101595 1,250
Live Erythroblasts Trcn0000162889 Slc25A39 GSE94963 1,250
Aicda-Induced Accelerates Germinal Center-Derived GSE95013 1,250
Znf131 Centrosome Fragmentation Haus5 GSE95027 1,250
Motor Bearing Sod1 A272C GSE95089 1,250
Significance Visibility Multi-Parametric Mri GSE95369 1,250
Basic Helix-Loop-Helix Sharp1 Mll-Af6 GSE95511 1,250
Activin-A-Induced Tr1-Like Regulatory Conventional GSE95820 1,250
H3K4Ox-Mediated Condensation Protects Damage GSE96064 1,250
Zoledronic Nfat Il-2 Diminishes GSE96075 1,250
Effects Uva Radiation Keratinocytes GSE96596 1,250
Transcriptomic Senescent Ptbp1 Knockdown GSE101750 1,250
Rna Seq Ribo Seq Analyses Cpt-Treated GSE96643 1,250
Time-Dependent Programming Ncor2 Rnaseq Tk GSE96715 1,250
Gene Il-17 Producing Spleen GSE96741 1,250
Cell-Of-Origin Comprising Fibrotic Reticulum GSE97038 1,250
Target Discovery Screens Il11 GSE97117 1,250
Rna-Sequencing Mouse Hematopoietic Progenitors GSE97440 1,250
Oral Cutaneous Wound Healing GSE97615 1,250
Wide Mesenchymal Poly Lps GSE97724 1,250
Adenovirally Delivered Hif1A Hif2A GSE98060 1,250
Transcriptomic Analysis Hotair-Regulated Genes GSE98091 1,250
Exploring Fxr1 H358 Using GSE101754 1,250
Facilitates Quantitative Retinoblastoma Transcriptomes GSE111168 1,250
Comparing Omental Ovarian Samples GSE98281 1,250
Subtype Underlying Tp53 Deregulation GSE98394 1,250
Rp11-2B6 Positive Lupus Nephritis GSE98422 1,250
Lipodystrophic Hotspot R482W Inducer GSE98675 1,250
Kdm1A Ewing Engages Er-Stress GSE98786 1,250
Timp3 Clock-Controlled Susceptibility Uv-Induced GSE98900 1,250
Obesity-Associated Killer Deteriorates Energy GSE99068 1,250
Differential Juvenile Nasopharyngeal Angiofibroma GSE99247 1,250
Stress Granule Principles Granules GSE99304 1,250
Enhancer Reprogramming Pancreatic Metastasis GSE99310 1,250
Intrinsic Plasma Defects Benta GSE101756 1,250
Pge2 Mediated Cervical Stromal GSE99392 1,250
Glomeruli Accurate Modelling Podocytopathy GSE99583 1,250
Cll Mediated Mscs Contact GSE99724 1,250
Platelet Hiv Abcc4 Biomarker GSE99737 1,250
B-Cell Baff Stimulation Burkitt GSE99768 1,250
Pediatric Cases Natural Chikungunya GSE99992 1,250
Impact Mthfd2 Aortic Endothelial GSE100261 1,250
Serpina3 Keratinocyte Promotor Lesion GSE102000 1,250
Airway Epithelium Infected Bocavirus GSE102392 1,250
Hepg2 Menin-Mll Mi-503 Dmso GSE103327 1,250
Cbfb-Smmhc Triggers Disrupting Dynamics GSE101788 1,250
Lncap Treated Ibet GSE103907 1,250
Sarm Rad140 Ar Er GSE104177 1,250
Skov3 Ovarian Non-Coding Dnm3Os GSE104295 1,250
Pp1-Nipp1 Wild Flip-In T-Rex GSE104320 1,250
Clustering Series Infinite Gaussian GSE104714 1,250
Tools Exhibit Substandard Performance GSE104756 1,250
Region-Specific Innate Antiviral Epididymis GSE104944 1,250
Time Series Trophoblast Lineage GSE104969 1,250
Comprehensive Profiles Hepatocellular Carcinoma GSE105130 1,250
H3K27Ac Y537S Er Thz1 GSE106552 1,250
Jmjd3 Ebpβ-Centered Exert Oncorepressor GSE101891 1,250
Hapln1 Lumican Hyaluronic Acid-Dependent GSE106640 1,250
Ring-Finger Amplification Shp-1 Poor GSE107980 1,250
Htlv-1 Tax Mt-1 Kk-1 GSE108601 1,250
Small-Molecule-Based Genome G4 Potential GSE109369 1,250
Parkinson Risk Midbrain Neuronal GSE109706 1,250
Gsk3Α Inhibitor Brd0507 Brd0320 GSE109985 1,250
Genome-Wide Gsk3Β Selective Brd3731 GSE109986 1,250
Transcriptomic-Based Adverse Lymphatic Filariasis GSE110146 1,250
Total All-Sil Tlx1 Knockdown GSE110635 1,250
Hnrnpm-Regulated Splicing Dependencies Prostate GSE113782 1,250
Huh7 Stably Overexpressing Crabp1 GSE101934 1,250
Rnaseq Hek293 Chtop Knockdown GSE113952 1,250
Altered P53 Activates Ras GSE114502 1,250
Glioma Stem Infected Zikv GSE114907 1,250
Pericentric Satellite Double-Stranded Stranded-Rnaseq GSE114938 1,250
Virus Infection Induces Rnas GSE115266 1,250
Generation Knockdown Ac093323 Lung GSE115659 1,250
Subtype Major Determinant Significance GSE117994 1,250
Cdk11 Required Replication-Dependent Histone GSE118051 1,250
Acetyl-Coa Carboxylase Microtubule Transport GSE118567 1,250
Effects Hotair Rnai H23 GSE119510 1,250
Obstructed Defecation Enteric Neuropathy GSE101968 1,250
Effects Hotair Rnai T47D GSE119511 1,250
Effects Bloom Rnai A549 GSE119512 1,250
Proline 152 Abolishes Cognate GSE119654 1,250
Microrna-934 Orchestrating Neurogenesis Neural GSE119760 1,250
Lncrna-Af339830 Stabilizing Specifying Pattern GSE119866 1,250
Sub-Complex Constitutes Vulnerability Rhabdoid GSE120233 1,250
Sub-Complex Constitutes Vulnerability Rhabdoid GSE120235 1,250
Facilitates Quantitative Cd8 Tox-Overexpression GSE120364 1,250
Thyroid Tc Coculture Tc-Induced GSE120391 1,250
Mycn Knock-Down Dna-Repair Deficiency GSE120858 1,250
Hbo1 Myst2 Uwb1 289 GSE101972 1,250
Differential Genes Ad169-Infected Mrc5 GSE120890 1,250
Enhances Zika Neuronal Brain GSE121534 1,250
Dualism Fgf Converging Rna-Seq Fgf2 GSE122368 1,250
Proteogenomic Characterization Early-Onset Gastric GSE122401 1,250
Postmortem Cortex Retrotransposon Glia GSE122647 1,250
Small Molecule-Mediated Astrocyte-To-Neuron Reprogramming GSE122701 1,250
Losmapimod Non-Specific Inflammatory Aged GSE123112 1,250
Resistance Pi3K Glioblastoma Gbm GSE123821 1,250
Transcriptome Sh-Sy5Y Knockdown Circslc45A4 GSE124001 1,250
Lncrna-Pcat1 Independent Lncap Lncap-Ai GSE124519 1,250
Arid1A Arid1B Loss Tov21G GSE101974 1,250
Organization Lamin Haploinsufficient Cardiomyocytes GSE126458 1,250
Older Subject Bed Rest GSE126865 1,250
Irf4 Plays Plasma Identity GSE126925 1,250
Clonal Evolution Npm1 Set GSE128603 1,250
Plin2 Alters Genome-Wide Leiomyoma GSE128898 1,250
Based Gbm44 Glioma Bat1 GSE129542 1,250
Lncrna-Ak096729 Stabilizing Specifying Pattern GSE129950 1,250
Rendered Resistant Cationic Siramesine GSE130363 1,250
Nutritional Supplement Older Subject GSE130722 1,250
Anillin Non-Canonical Involving Stemness GSE131120 1,250
Mitotically Mancr Cycle Triple GSE102155 1,250
Glutamic Leucine Rich Pelp1 GSE131502 1,250
Lix1L Stabilization Ccl20 Fibrosis GSE133121 1,250
Greb1 Signaling Suppressing Tgfβ GSE133976 1,250
Ybey Essential Biogenesis Ribosomes GSE134960 1,250
Stau2 Knockdown Bccml K562 GSE135012 1,250
Cd97 Critical Regulator Myeloid GSE135028 1,250
Secondary Structures Recognized Adars GSE136326 1,250
Gene Impact Tdp-43 Knockout GSE136366 1,250
Comparative Hotairm1 Knockdown Caki-1 GSE136604 1,250
Cyp2J2 Diverse Adult Cardiomyocytes GSE136957 1,250
Rna-Seq Neutrophils Antiphospholipid Syndrome GSE102215 1,250
Fbp2 Sarcoma Restraining Biogenesis GSE137755 1,250
Facilitates Quantitative Lap2Α Deficient GSE138512 1,250
Nad Mucin Ls 174T GSE140116 1,250
Element Lack Cis-Trans Compensation GSE140574 1,250
Xenograft Tumors Vehicle Cbl0137 GSE140652 1,250
Diagnostic Biomarker Sprr3 Bioinformatics GSE140707 1,250
Effect Iron Overload Ipsc-Cms GSE141678 1,250
Transcriptomics Fam122A Nc K562 GSE141735 1,250
Overcoming Wee1 Azd1775 Ovcar8 GSE141990 1,250
Corneal Endothelial Slc4A11 Deficiency GSE142636 1,250
Pbm T-Cells Humanized-Mice Hu-Mice GSE102220 1,250
Circrna Profile Hypopharyngeal Cancer GSE111423 1,250
Mechanisms Resistance Immunogenic Cytotoxicity GSE100828 1,250
Protein Casp8Ap2 Improvement G0 GSE143808 1,250
Wide Gene-Expression Cardiomyocytes Qki GSE144008 1,250
Dmso Epz6438 Cd34 Hspcs GSE144131 1,250
Nutrient Sensing Birth Glucose-Stimulated GSE147321 1,250
Matched Primary Liver Metastases GSE147738 1,250
Resistant Optimized Hk2 Alpha-Particle GSE147850 1,250
Recognition Mage Ubiquitin Ligases GSE148458 1,250
Drugs Blocking Sars-Cov-2 Colonic GSE148696 1,250
Lead Drug Candidates Covid-19 GSE148697 1,250
Lycat Modulates Altered H2122 GSE149054 1,250
Strand-Oriented Culture 24H Presence GSE102305 1,250
Hepatic Stellate Gipc Contribution GSE151250 1,250
Cytomegalovirus Hcmv Nasal Turbinate GSE152114 1,250
Map2K1 Langerhans Histiocytosis Immunodeficient GSE153831 1,250
Low-Dose Decitabine Immune Thrombocytopenia GSE154703 1,250
Tanshinone Inhibit Hematopoiesis Repressing GSE155572 1,250
Elavl1 Primarily Couples Utrs GSE157052 1,250
Gata6-As1 Cultures Cardiomyocyte Day GSE157369 1,250
Pu Regulome Interactome Dendritic GSE157844 1,250
Hypr-Seq Chosen Hybridization Probes GSE158001 1,250
Chk1 Blocks Phosphorylation Fam122A GSE158338 1,250
Sf3B1 Molecules Spliceosome Rh18 GSE102539 1,250
Hnrnp-L Circcspp1 Mir-520H Egr1 GSE158975 1,250
Tumor-Infiltrating Mast Anti-Pd-1 Therapy GSE161351 1,250
Mycnos1 Mycn-Amplified Retinoblastoma Rb1 GSE161449 1,250
Mir-141 Il-13-Induced Mucus Production GSE162696 1,250
Effects Cardiac Glycosides Lncap-Abl GSE35126 1,250
Tcf21 Precursor Contribute Fibrous GSE44461 1,250
Β-Catenin-Signaling Modulated Androgen Ablation GSE48403 1,250
Advanced Non-Castrate Docetaxel Chemotherapy GSE51005 1,250
Rna-Binding Rbm47 Suppresses Metastatic GSE53779 1,250
Regions Susceptible Damage Pylori GSE55699 1,250
Metformin Mycobacterium In-Vitro Ex GSE102633 1,250
Integrative Genomic Widespread Damage GSE55727 1,250
Investigation Tra2 Protein-Dependent Iclip GSE59335 1,250
Open Mapping Epididymis Rnase-Seq GSE59781 1,250
Rapid Neurogenesis Transcriptional Activation GSE60548 1,250
Cabozantinib C-Met Vegfr2 Explant GSE60939 1,250
Foxp1 Orchestration Asd-Relevant Pathways GSE62718 1,250
Her2 Samples Green Fluorescent GSE62820 1,250
Epas1 Knockdown Sirna Endothelial GSE62974 1,250
Peroxisome Proliferator-Activated Gamma Loss-Of GSE62982 1,250
Gas1 Modular Kat2A Specify GSE63764 1,250
Prevalent N6-Methyldeoxyadenosine Mammalian Mitochondrial GSE102670 1,250
Schlafen Slfn5 Motility Rcc GSE64399 1,250
Ovo-Like Transcript Bewo Trophoblast GSE66962 1,250
Nucleotide Hexim1 Cell-Specific Rna-Seq1 GSE68039 1,250
Nucleotide Hexim1 Cell-Specific Rna-Seq2 GSE68040 1,250
Rc3H1 Posttranscriptionally A20 Ikk GSE68611 1,250
Surveillance Enhancers Rack7-Histone Demethylase GSE71325 1,250
Surveillance Enhancers Rack7-Histone Demethylase GSE71326 1,250
Rnai Viability Ews-Fli1 Positive GSE73092 1,250
Hcc Transfected Ncsirna Odc1Sirna GSE73268 1,250
Mef2B Ebf1 Il6R Bound GSE73887 1,250
Ribozero Gold Dorsolateral Samples GSE102741 1,250
Rna-Seq Undifferentiated Differentiated Sh-Sy5Y GSE74886 1,250
Determination Combinatorial Epithelial-To-Mesenchymal Emt GSE75487 1,250
Hnf1 Critical Epididymis Epithelium GSE76377 1,250
Mcf-7 10Nm Treatment Tcdd GSE76608 1,250
Protien Close Translation Sires GSE76627 1,250
Mirnas Affected Antagomir-17 Treatment GSE76663 1,250
Igf2Bp3 Hematopoietic Progenitor Leukemogenic GSE76931 1,250
Discloses Events Related Sh-Sy5Y GSE77383 1,250
Igf2Bp3 Invasiveness Modulation Risc GSE79147 1,250
Gr Binding Potentiate Clusters GSE79426 1,250
Tap73 Marker Glutamine Medulloblastoma GSE103029 1,250
Safety Tofacitinib Citrate Areata GSE80688 1,250
Expression-Based Biomarkers Juvenile Jia GSE83415 1,250
Fibroblasts Supt4H1 Sirna Treatment GSE83484 1,250
Biopsies Pre-Treated Acquired Cetuximab GSE84267 1,250
Tgfβri Gata4 Deficient Cancers GSE85001 1,250
Read-Through Convergent Protein-Coding H2A GSE85083 1,250
Effect Daunorubicin Treatment Hct116 GSE86190 1,250
Invasive Mucinous Adnocarcinoma Lung GSE86958 1,250
Quantitative Ppard Colon Ngs GSE89729 1,250
Genetic Determinants Pioneer Binding GSE90455 1,250
Functional Role Cpped1 Trophoblasts GSE103035 1,250
Ht-29 Colorectal Nucleatum Treatment GSE90944 1,250
Comparative Neuroblastoma Confrontation Microenvironment GSE91377 1,250
21 Hbv-Hcc Non-Neoplastic Tissues GSE94660 1,250
Synovial Biopsies Triple Dmard GSE97165 1,250
Srp55-Regulated Network Beta Survival GSE98485 1,250
Scaffold Attachment Saf-A Rpe1 GSE98541 1,250
Miclip Rna-Seq Ribo-Seq Molm13 GSE98623 1,250
Boris Ctcfl K562 Line GSE99825 1,250
Responses Short-Term Nutrient-Exercise Humans GSE99963 1,250
Fet Treated Rspo1 Tgfβ1 GSE103650 1,250
Tumour Non-Coding Ghsros Lncap GSE103320 1,250
Fet Treated Rspo1 Tgfβ1 GSE103650 2,250
Mediators Independently Detects Advanced GSE107104 1,250
Mediators Independently Detects Advanced GSE107104 2,250
Elf1 Reduces Ets Sensitivity GSE113485 1,250
Elf1 Reduces Ets Sensitivity GSE113485 2,250
Genome-Wide Nedd9-Regulated Genes Using GSE113659 1,250
Genome-Wide Nedd9-Regulated Genes Using GSE113659 2,250
Chipseq T47D Trps1 Chd4 GSE114213 1,250
Chipseq T47D Trps1 Chd4 GSE114213 2,250
Flare-Up Process Investigating Difference GSE124389 1,250
Seq Aml Nb4 Fto GSE103495 1,250
Flare-Up Process Investigating Difference GSE124389 2,250
Rko Ctaz Ko Putback GSE128257 1,250
Rko Ctaz Ko Putback GSE128257 2,250
Smarcb1 Super-Enhancers Govern Hesc GSE128351 1,250
Smarcb1 Super-Enhancers Govern Hesc GSE128351 2,250
Scrna-Seq Vitiligo Multi-Step Process GSE129921 1,250
Scrna-Seq Vitiligo Multi-Step Process GSE129921 2,250
H2A Isoforms Interplay U2Os Siz1-Siz2 GSE131571 1,250
H2A Isoforms Interplay U2Os Siz1-Siz2 GSE131571 2,250
H2A Isoforms Interplay Wi38 Siz1-Siz2 GSE131574 1,250
Uveal Melanoma Treated Fr900359 GSE103761 1,250
Metabolomic African American Racial GSE113091 1,250
H2A Isoforms Interplay Wi38 Siz1-Siz2 GSE131574 2,250
H2A Isoforms Interplay Wi38 Siphf14-Sisirt1 GSE131576 1,250
H2A Isoforms Interplay Wi38 Siphf14-Sisirt1 GSE131576 2,250
Jc Polyomavirus Controlled Ifn-Induced GSE135833 1,250
Jc Polyomavirus Controlled Ifn-Induced GSE135833 2,250
Phf19 Promoting H3K27Me3 Deposition GSE135895 1,250
Phf19 Promoting H3K27Me3 Deposition GSE135895 2,250
Antiretroviral Hiv-Specific Perinatally Children GSE138804 1,250
Antiretroviral Hiv-Specific Perinatally Children GSE138804 2,250
Ctcf Rad21 Slk Kshv GSE138937 1,250
Herpes Simplex Hsv-1 Infected GSE103763 1,250
Ctcf Rad21 Slk Kshv GSE138937 2,250
Prkci Silenced Validated Constructs GSE141666 1,250
Prkci Silenced Validated Constructs GSE141666 2,250
Resting Activated Jurkat E6 GSE145453 1,250
Resting Activated Jurkat E6 GSE145453 2,250
Pol Slowdown Alpha-Amanitin Drb GSE153303 1,250
Pol Slowdown Alpha-Amanitin Drb GSE153303 2,250
Maf Mafb-Sirnas M-Csf-Derived Macrophages GSE155719 1,250
Maf Mafb-Sirnas M-Csf-Derived Macrophages GSE155719 2,250
Phf2 Repressed Ews Fli1 GSE156387 1,250
Epigenomes Bacillus Calmette-Guérin Vaccine GSE104149 1,250
Phf2 Repressed Ews Fli1 GSE156387 2,250
Longitudinal Morphological Application Progranulin GSE157573 1,250
Longitudinal Morphological Application Progranulin GSE157573 2,250
